Compound_ID	Molecule Name	Molecular Weight	AlogP	Smiles	Standard Type	Standard Relation	Standard Units	Standard Value	Assay ChEMBL ID	Assay Description	BAO Format ID	BAO Label	Assay Organism	Target ChEMBL ID	Target Name	Target Organism	Target Type	Document ChEMBL ID	Source Description	Document Journal	Document Year	Active	bits	Group
CHEMBL3354526		297.32	1.13	NC(=O)c1ccc(-c2c[nH]c3ncnc(NCCO)c23)cc1	IC50	'='	nM	21.0	CHEMBL3376646	Inhibition of PIM1 (unknown origin)	BAO_0000357	single protein format	Homo sapiens	CHEMBL2147	Serine/threonine-protein kinase PIM1	Homo sapiens	SINGLE PROTEIN	CHEMBL3352230	Scientific Literature	Bioorg Med Chem Lett	2015.0	1.0	<rdkit.DataStructs.cDataStructs.ExplicitBitVect object at 0x0000025409FAD9A0>	G1
CHEMBL3905144		349.39	2.28	Cc1nc2cccc(-c3cc4c([nH]3)C(CO)NC4=O)c2nc1NC1CC1	IC50	'='	nM	0.331	CHEMBL3888799	Homogeneous Time Resolved Fluorescence Assay (HTRF): The assay for the determination of Pim activity is based on the formation of phosphorylated biotinylated-BAD peptide at the Serine 112 residue (S112) and employs HTRF® (homogeneous time resolved fluorescence) technology to detect the product in a 384-well plate format. The phosphorylation of biotinylated-BAD (S112) peptide by full length recombinant Pim-1, Pim-2, or Pim-3 protein was detected with streptavidin:Allophycocyanin (APC) conjugate and a europium (Eu) labeled antibody directed against phosphorylated-BAD (S112). Excitation of Eu by a high energy laser light (337 nm) leads to a transfer of energy to the APC molecule, and results in an emission at 665 nm. The fluorescence is directly proportional to the amount of phosphorylated BAD peptide present in the reaction. Compounds were prepared in DMSO by conducting 3-fold serial dilutions to give a 22-point dosing curve having a high dose of 1 μM. A reference compound was included on each assay plate [Costar 3658] in order to validate that plate; on one plate of every assay run, two additional reference compounds were included. The Reaction Buffer consisted of 45 mM Hepes, pH 7.0, 15 mM NaCl, and 1 mM MgCl. The quench/detection buffer consisted of 50 mM Tris, 100 mM NaCl, 0.05% BSA, 0.1% Tween and 3 mM EDTA. Biotinylated BAD peptide (Biopeptide), 10 mM ATP (Sigma), Labeled p-BAD (S112) mAb (Cell Signalling and Perkin Elmer) [with 0.05% BSA and 2 mM DTT added] streptavidin:Allophycocyanin [Perkin Elmer]. Final concentrations either Pim-1 enzyme [5 pM], or Pim-2 enzyme [0.5 pM], DMSO [1%], BLC BAD (S112) [0.5 μM], ATP [1.5 μM], streptavidin:Allophycocyanin [0.002 mg/mL] and biotinylated-BAD (S112) mAb [100 pM]. Initial incubations were carried out at RT (22° C.) for 30 min for both Pim-1 and for Pim-2. Pim enzyme is added to compound in buffer, and plates are incubated of 30 min. Biotinylated BAD and ATP are added and plates are incubated for 1 h. A mixture of labeled p-BAD (S112) mAb and quench/detection buffer are added and incubated for 2 h. Fluorescence was measured by an HTRF® Envision microplate reader.	BAO_0000357	single protein format	None	CHEMBL2147	Serine/threonine-protein kinase PIM1	Homo sapiens	SINGLE PROTEIN	CHEMBL3886836	BindingDB Database		2016.0	1.0	<rdkit.DataStructs.cDataStructs.ExplicitBitVect object at 0x0000025409FAD930>	G1
CHEMBL3639838		559.93	4.91	CCCn1c(N2CCNCC2)nc2c(Br)c(Br)c(Br)c(Br)c21	IC50	'='	nM	9.36	CHEMBL3705636	Luminometric Kinase Assay: Kinase assay was performed using luminescent Kinase-Glo (Promega) system. The Kinase-Glo Luminescent Kinase Assay Platform provides a homogeneous, high-throughput screening method for measuring kinase activity by quantifying the amount of ATP remaining in solution following a kinase reaction.	BAO_0000357	single protein format	None	CHEMBL2147	Serine/threonine-protein kinase PIM1	Homo sapiens	SINGLE PROTEIN	CHEMBL3638987	BindingDB Database		2013.0	1.0	<rdkit.DataStructs.cDataStructs.ExplicitBitVect object at 0x0000025409FAD8C0>	G1
CHEMBL3929768		377.37	3.22	N[C@H]1CCCN(c2ccc3ncc(-c4cccc(OC(F)(F)F)c4)n3n2)C1	IC50	'='	nM	30.0	CHEMBL3888916	Kinase-Glo Assay: These assays are set up in duplicate 50 ul volumes in white, flat bottom 96 well plates. Inhibitors are added to the solution of 1× kinase buffer, 10 uM ATP, 100 uM Pim-1-specific substrate, 50 ng of active Pim-1 enzyme, and water in serial dilutions ranging from micromolar to nanomolar concentrations. This solution is incubated at 30 degrees Celsius at 360 rpm for two hours. Following the incubation, 50 ul of Kinase-Glo reagent is added to each well, including all positive and negative control wells, and incubated at room temperature for 15 minutes. The plate is then read by the Luminoskan Ascent instrument and the results displayed with the Ascent Software version 2.6.	BAO_0000357	single protein format	None	CHEMBL2147	Serine/threonine-protein kinase PIM1	Homo sapiens	SINGLE PROTEIN	CHEMBL3886885	BindingDB Database		2016.0	1.0	<rdkit.DataStructs.cDataStructs.ExplicitBitVect object at 0x0000025409FAD850>	G1
CHEMBL3942758		420.9	4.32	Clc1ccccc1-c1ccc2cnc(Nc3cnccc3O[C@H]3CCCNC3)n2n1	IC50	'='	nM	44.0	CHEMBL3887608	PIM Enzyme Assay: The assay for the determination of Pim activity is based on the formation of phosphorylated biotinylated-BAD peptide at the Serine 112 residue (S112) and employs HTRF (homogeneous time resolved fluorescence) technology to detect the product in a 96-well plate format. The phosphorylation of biotinylated-BAD (S112) peptide by full length recombinant Pim-1, Pim-2, or Pim-3 protein was detected with streptavidin:Allophycocyanin (APC) conjugate and a europium (Eu) labeled antibody directed against phosphorylated-BAD (S112). Excitation of Eu by a high energy laser light (337 nm) leads to a transfer of energy to the APC molecule, and results in an emission at 665 nm. The fluorescence is directly proportional to the amount of phosphorylated BAD peptide present in the reaction.Compounds were prepared in DMSO by conducting 3-fold serial dilutions to give a 10-point dosing curve having a high dose of 1 uM. A reference compound was included on each assay plate in order to validate that plate.	BAO_0000357	single protein format	None	CHEMBL2147	Serine/threonine-protein kinase PIM1	Homo sapiens	SINGLE PROTEIN	CHEMBL3886376	BindingDB Database		2015.0	1.0	<rdkit.DataStructs.cDataStructs.ExplicitBitVect object at 0x0000025409FAD770>	G1
CHEMBL4781049		415.95	4.5	CN1CCC(CNC2=NC(=O)/C(=C/c3ccc(-c4cccc(Cl)c4)o3)S2)CC1	IC50	'='	nM	37.0	CHEMBL4687837	Inhibition of PIM1 (unknown origin) by coupled kinetic assay	BAO_0000357	single protein format	Homo sapiens	CHEMBL2147	Serine/threonine-protein kinase PIM1	Homo sapiens	SINGLE PROTEIN	CHEMBL4680285	Scientific Literature	Bioorg Med Chem	2020.0	1.0	<rdkit.DataStructs.cDataStructs.ExplicitBitVect object at 0x0000025409FAD700>	G1
CHEMBL3962885		365.44	2.36	Cn1c(NC(C)(C)C)nc2c(-c3cc4n(c3)CCNC4=O)cccc2c1=O	IC50	'='	nM	7.74	CHEMBL3888799	Homogeneous Time Resolved Fluorescence Assay (HTRF): The assay for the determination of Pim activity is based on the formation of phosphorylated biotinylated-BAD peptide at the Serine 112 residue (S112) and employs HTRF® (homogeneous time resolved fluorescence) technology to detect the product in a 384-well plate format. The phosphorylation of biotinylated-BAD (S112) peptide by full length recombinant Pim-1, Pim-2, or Pim-3 protein was detected with streptavidin:Allophycocyanin (APC) conjugate and a europium (Eu) labeled antibody directed against phosphorylated-BAD (S112). Excitation of Eu by a high energy laser light (337 nm) leads to a transfer of energy to the APC molecule, and results in an emission at 665 nm. The fluorescence is directly proportional to the amount of phosphorylated BAD peptide present in the reaction. Compounds were prepared in DMSO by conducting 3-fold serial dilutions to give a 22-point dosing curve having a high dose of 1 μM. A reference compound was included on each assay plate [Costar 3658] in order to validate that plate; on one plate of every assay run, two additional reference compounds were included. The Reaction Buffer consisted of 45 mM Hepes, pH 7.0, 15 mM NaCl, and 1 mM MgCl. The quench/detection buffer consisted of 50 mM Tris, 100 mM NaCl, 0.05% BSA, 0.1% Tween and 3 mM EDTA. Biotinylated BAD peptide (Biopeptide), 10 mM ATP (Sigma), Labeled p-BAD (S112) mAb (Cell Signalling and Perkin Elmer) [with 0.05% BSA and 2 mM DTT added] streptavidin:Allophycocyanin [Perkin Elmer]. Final concentrations either Pim-1 enzyme [5 pM], or Pim-2 enzyme [0.5 pM], DMSO [1%], BLC BAD (S112) [0.5 μM], ATP [1.5 μM], streptavidin:Allophycocyanin [0.002 mg/mL] and biotinylated-BAD (S112) mAb [100 pM]. Initial incubations were carried out at RT (22° C.) for 30 min for both Pim-1 and for Pim-2. Pim enzyme is added to compound in buffer, and plates are incubated of 30 min. Biotinylated BAD and ATP are added and plates are incubated for 1 h. A mixture of labeled p-BAD (S112) mAb and quench/detection buffer are added and incubated for 2 h. Fluorescence was measured by an HTRF® Envision microplate reader.	BAO_0000357	single protein format	None	CHEMBL2147	Serine/threonine-protein kinase PIM1	Homo sapiens	SINGLE PROTEIN	CHEMBL3886836	BindingDB Database		2016.0	1.0	<rdkit.DataStructs.cDataStructs.ExplicitBitVect object at 0x0000025409FAD690>	G1
CHEMBL3980052		365.86	4.11	NCCC1CNC(=O)c2cc(-c3cccc(Cl)c3)c(-c3ccccc3)n21	IC50	'='	nM	34.0	CHEMBL3887519	Trans-Phosphorylation Assay: The inhibitory activity of putative kinase inhibitors and the potency of selected compounds were determined using a trans-phosphorylation assay. Specific peptide or protein substrates were trans-phosphorylated by their specific ser-thr or tyr kinase in the presence of ATP traced with 33P-gamma-ATP, and in the presence of their own optimal buffer and cofactors.At the end of the phosphorylation reaction, more than 98% unlabeled ATP and radioactive ATP were captured by an excess of the ion exchange dowex resin; the resin then settled down to the bottom of the reaction plate by gravity. Supernatant was subsequently withdrawn and transferred into a counting plate, then evaluated by beta-counting. Kinase Buffer (KB):The buffer for PIM1 assay was composed of HEPES 50 mM, at pH 7.5, with 10 mM MgCl2, 1 mM DTT, 3 uM NaVO3, and 0.2 mg/mL BSA.Â  Full-length human PIM1 was expressed and purified as described in Bullock A N, et al., J. Biol. Chem. 2005, 280, 41675-82.	BAO_0000357	single protein format	None	CHEMBL2147	Serine/threonine-protein kinase PIM1	Homo sapiens	SINGLE PROTEIN	CHEMBL3886350	BindingDB Database		2015.0	1.0	<rdkit.DataStructs.cDataStructs.ExplicitBitVect object at 0x0000025409FAD620>	G1
CHEMBL2037204		479.94	5.01	CN1CCCN(C(=O)c2ccc(F)c(-c3ccc(/C=C4/C(=O)Nc5ccc(Cl)cc54)o3)c2)CC1	IC50	'='	nM	3.0	CHEMBL2038828	Inhibition of human recombinant Pim1 using RSRHSSYPAGT as substrate by radiometric assay	BAO_0000357	single protein format	Homo sapiens	CHEMBL2147	Serine/threonine-protein kinase PIM1	Homo sapiens	SINGLE PROTEIN	CHEMBL2034977	Scientific Literature	ACS Med Chem Lett	2012.0	1.0	<rdkit.DataStructs.cDataStructs.ExplicitBitVect object at 0x0000025409FAD5B0>	G1
