Compound_ID	Molecule Name	Molecular Weight	AlogP	Smiles	Standard Type	Standard Relation	Standard Units	Standard Value	Assay ChEMBL ID	Assay Description	BAO Format ID	BAO Label	Assay Organism	Target ChEMBL ID	Target Name	Target Organism	Target Type	Document ChEMBL ID	Source Description	Document Journal	Document Year	Active	bits	Group	ROMol	Set	Set_type
CHEMBL3687223		483.62	2.79	COc1cc(Nc2nc(NC3CCOCC3)c(C(C)C)nc2C(N)=O)ccc1N1CCN(C)CC1	IC50	'='	nM	0.49	CHEMBL3706339	Inhibition Assay: A partial protein of only a kinase domain of FLT3 protein was purchased from Carna Biosciences Inc., Japan, and tests were conducted as in Test Example 5. Test Example 5: A partial protein of only a kinase domain of RET protein was purchased from Carna Biosciences Inc., Japan. The phosphorylation activity toward a peptide substrate was investigated using an EZ reader (Caliper). Test compounds were each mixed with a protein solution to give 8 final concentrations from 100 nM to 0.03 nM, followed by addition of a mixed liquid of ATP and substrate peptide (Caliper) and reaction for 30 minutes. The ATP concentration used was 100 ÂµM. A reaction liquid which contained protein but no test compound (in which the solvent DMSO alone was added at 0.8% in place of the test compound) was prepared, followed by reaction in the same manner with or without ATP addition.	BAO_0000357	single protein format	Homo sapiens	CHEMBL1974	Tyrosine-protein kinase receptor FLT3	Homo sapiens	SINGLE PROTEIN	CHEMBL3639105	BindingDB Database		2015.0	1.0	<rdkit.DataStructs.cDataStructs.ExplicitBitVect object at 0x00000262042EAF10>	G2	<rdkit.Chem.rdchem.Mol object at 0x00000262077EC660>	G2 active	Train
CHEMBL1257804		303.34	4.73	Cc1cc(/C=C2/C(=O)Nc3ccc(F)cc32)c2cccccc1-2	IC50	'='	nM	60.0	CHEMBL1261358	Inhibition of FLT3 by time resolved fluorescence method	BAO_0000357	single protein format	None	CHEMBL1974	Tyrosine-protein kinase receptor FLT3	Homo sapiens	SINGLE PROTEIN	CHEMBL1255211	Scientific Literature	Bioorg Med Chem Lett	2010.0	1.0	<rdkit.DataStructs.cDataStructs.ExplicitBitVect object at 0x00000262042EAEA0>	G2	<rdkit.Chem.rdchem.Mol object at 0x00000262077EC6D0>	G2 active	Train
CHEMBL4777640		520.68	5.78	COc1cc2c(Nc3cnc(OCCCC4CCCC4)nc3)ncnc2cc1OCCCN1CCCCC1	IC50	'='	nM	19.95	CHEMBL4739200	Inhibition of His6/TEV fused-GST-tagged Flt3 (unknown origin) (H564 to S993 residues) using Axltide (CKKSRGDYMTMQJ-acid) peptide as substrate preincubated for 30 mins followed by substrate and ATP addition at Km concentration measured after 75 mins by RapidFire LC-MS analysis	BAO_0000357	single protein format	Homo sapiens	CHEMBL1974	Tyrosine-protein kinase receptor FLT3	Homo sapiens	SINGLE PROTEIN	CHEMBL4732252	Scientific Literature	J Med Chem	2021.0	1.0	<rdkit.DataStructs.cDataStructs.ExplicitBitVect object at 0x00000262042EADC0>	G2	<rdkit.Chem.rdchem.Mol object at 0x00000262077EC890>	G2 active	Train
CHEMBL2032155		551.53	4.32	Nc1ncc(-c2cnn(C3CCNCC3)c2)cc1-c1nc2cccc(-c3ccccn3)c2o1	IC50	'='	nM	0.6	CHEMBL2034188	Inhibition of recombinant FLT3 by time resolved-fluorescence resonance energy transfer analysis	BAO_0000357	single protein format	None	CHEMBL1974	Tyrosine-protein kinase receptor FLT3	Homo sapiens	SINGLE PROTEIN	CHEMBL2029247	Scientific Literature	Bioorg Med Chem Lett	2012.0	1.0	<rdkit.DataStructs.cDataStructs.ExplicitBitVect object at 0x00000262042EAD50>	G2	<rdkit.Chem.rdchem.Mol object at 0x00000262077EC740>	G2 active	Train
CHEMBL4740352		518.6	4.87	Cc1cc(NC(=O)Nc2ccc3c(c2)sc2nc(-c4ccc(OCCN5CCOCC5)cc4)cn23)no1	IC50	'='	nM	82.56	CHEMBL4670662	Inhibition of FLT3 ITD mutant (unknown origin)	BAO_0000357	single protein format	Homo sapiens	CHEMBL1974	Tyrosine-protein kinase receptor FLT3	Homo sapiens	SINGLE PROTEIN	CHEMBL4665799	Scientific Literature	Bioorg Med Chem Lett	2020.0	1.0	<rdkit.DataStructs.cDataStructs.ExplicitBitVect object at 0x00000262042EACE0>	G2	<rdkit.Chem.rdchem.Mol object at 0x00000262077EC4A0>	G2 active	Train
CHEMBL1236904		551.49	3.76	Cc1cc(CN2CCN(c3c(Br)cnc4nc(-c5ccc(N6CCN(C)CC6)cc5)[nH]c34)CC2)no1	Kd	'='	nM	1.2	CHEMBL2214092	Binding affinity to FLT3	BAO_0000357	single protein format	None	CHEMBL1974	Tyrosine-protein kinase receptor FLT3	Homo sapiens	SINGLE PROTEIN	CHEMBL2203264	Scientific Literature	J Med Chem	2012.0	1.0	<rdkit.DataStructs.cDataStructs.ExplicitBitVect object at 0x00000262042EAC70>	G2	<rdkit.Chem.rdchem.Mol object at 0x00000262077EC900>	G2 active	Train
CHEMBL4237289		393.83	5.08	Cc1cc(-c2ccc(NC(=O)Nc3cccc(Cl)c3)cc2)c2c(N)onc2n1	IC50	'='	nM	5.0	CHEMBL4236210	Inhibition of human FLT3 using biotin labeled substrate after 1 hr by HTFR assay	BAO_0000357	single protein format	Homo sapiens	CHEMBL1974	Tyrosine-protein kinase receptor FLT3	Homo sapiens	SINGLE PROTEIN	CHEMBL4229538	Scientific Literature	Bioorg Med Chem	2018.0	1.0	<rdkit.DataStructs.cDataStructs.ExplicitBitVect object at 0x00000262042EAC00>	G2	<rdkit.Chem.rdchem.Mol object at 0x00000262077EC3C0>	G2 active	Train
CHEMBL4571608		431.57	5.05	CN1CCC(Nc2ccc(C(=O)Nc3cc(-c4cc5ccccc5s4)n[nH]3)cc2)CC1	IC50	'='	nM	10.51	CHEMBL4353138	Inhibition of human FLT3 ITD mutant using EAIYAAPFAKKK peptide as substrate in presence of 33P-gamma ATP by hotspot kinase assay	BAO_0000357	single protein format	Homo sapiens	CHEMBL1974	Tyrosine-protein kinase receptor FLT3	Homo sapiens	SINGLE PROTEIN	CHEMBL4350983	Scientific Literature	Eur J Med Chem	2019.0	1.0	<rdkit.DataStructs.cDataStructs.ExplicitBitVect object at 0x00000262042EAB20>	G2	<rdkit.Chem.rdchem.Mol object at 0x00000262077EC2E0>	G2 active	Train
CHEMBL2046726		306.37	2.65	COc1cc2ncnc(Sc3nncs3)c2cc1OC	IC50	'='	nM	9.0	CHEMBL2050053	Inhibition of human FLT3	BAO_0000357	single protein format	Homo sapiens	CHEMBL1974	Tyrosine-protein kinase receptor FLT3	Homo sapiens	SINGLE PROTEIN	CHEMBL2046280	Scientific Literature	J Med Chem	2012.0	1.0	<rdkit.DataStructs.cDataStructs.ExplicitBitVect object at 0x00000262042EAAB0>	G2	<rdkit.Chem.rdchem.Mol object at 0x00000262077EC270>	G2 active	Train
CHEMBL2063435		547.62	2.76	Cc1nc(Nc2cc(-c3ccc(CNC(=O)OCc4cc(C)on4)cc3)n[nH]2)cc(N2CCN(CCO)CC2)n1	IC50	'='	nM	72.0	CHEMBL2066303	Inhibition of wild type FLT3	BAO_0000357	single protein format	Homo sapiens	CHEMBL1974	Tyrosine-protein kinase receptor FLT3	Homo sapiens	SINGLE PROTEIN	CHEMBL2062390	Scientific Literature	Bioorg Med Chem Lett	2012.0	1.0	<rdkit.DataStructs.cDataStructs.ExplicitBitVect object at 0x00000262042EAA40>	G2	<rdkit.Chem.rdchem.Mol object at 0x00000262077EC200>	G2 active	Train
CHEMBL3329682		562.6	3.53	COc1ccc(C(=O)NC(=O)Nc2ccc3c(c2)NC(=O)/C3=C\c2[nH]c(C)c(C(=O)NCCN(C)C)c2C)c(F)c1	IC50	'='	nM	16.2	CHEMBL3380434	Inhibition of FLT3 (unknown origin) using EAIYAAPFAKKK substrate	BAO_0000357	single protein format	Homo sapiens	CHEMBL1974	Tyrosine-protein kinase receptor FLT3	Homo sapiens	SINGLE PROTEIN	CHEMBL3351479	Scientific Literature	Eur J Med Chem	2014.0	1.0	<rdkit.DataStructs.cDataStructs.ExplicitBitVect object at 0x00000262042EA9D0>	G2	<rdkit.Chem.rdchem.Mol object at 0x00000262077EC190>	G2 active	Train
CHEMBL3353341		506.61	4.27	COc1ccc2c(c1)[C@]1(C[C@H]1c1ccc3c(/C=C/c4ccc(N5CCN(C)CC5)nc4)n[nH]c3c1)C(=O)N2	IC50	'='	nM	24.0	CHEMBL3364611	Inhibition of FLT3 (unknown origin) by FRET-based homogeneous assay	BAO_0000357	single protein format	Homo sapiens	CHEMBL1974	Tyrosine-protein kinase receptor FLT3	Homo sapiens	SINGLE PROTEIN	CHEMBL3351767	Scientific Literature	J Med Chem	2015.0	1.0	<rdkit.DataStructs.cDataStructs.ExplicitBitVect object at 0x00000262042EA960>	G2	<rdkit.Chem.rdchem.Mol object at 0x00000262077EC120>	G2 active	Train
CHEMBL2407897		420.52	5.29	CN(C)Cc1ccc(/C=C/c2n[nH]c3cc(/C=C4/C(=O)Nc5ccccc54)ccc23)cc1	IC50	'='	nM	35.0	CHEMBL3364611	Inhibition of FLT3 (unknown origin) by FRET-based homogeneous assay	BAO_0000357	single protein format	Homo sapiens	CHEMBL1974	Tyrosine-protein kinase receptor FLT3	Homo sapiens	SINGLE PROTEIN	CHEMBL3351767	Scientific Literature	J Med Chem	2015.0	1.0	<rdkit.DataStructs.cDataStructs.ExplicitBitVect object at 0x00000262042EA8F0>	G2	<rdkit.Chem.rdchem.Mol object at 0x00000262077EC0B0>	G2 active	Train
CHEMBL3326002		514.65	3.2	CCCCNc1ncc2c(-c3ccc(S(=O)(=O)N4CCOCC4)cc3)nn([C@H]3CC[C@H](O)CC3)c2n1	IC50	'='	nM	3.0	CHEMBL3363649	Inhibition of Flt3 (unknown origin)	BAO_0000357	single protein format	Homo sapiens	CHEMBL1974	Tyrosine-protein kinase receptor FLT3	Homo sapiens	SINGLE PROTEIN	CHEMBL3351548	Scientific Literature	J Med Chem	2014.0	1.0	<rdkit.DataStructs.cDataStructs.ExplicitBitVect object at 0x00000262042EA880>	G2	<rdkit.Chem.rdchem.Mol object at 0x00000262077EC040>	G2 active	Train
CHEMBL1650545		452.92	3.47	Cc1cn2c(-c3cn[nH]c3)cnc2c(Nc2cc(CN3CCC(F)(F)C3)ns2)n1	IC50	'='	nM	76.0	CHEMBL1656204	Inhibition of FLT3	BAO_0000357	single protein format	None	CHEMBL1974	Tyrosine-protein kinase receptor FLT3	Homo sapiens	SINGLE PROTEIN	CHEMBL1649074	Scientific Literature	J Med Chem	2011.0	1.0	<rdkit.DataStructs.cDataStructs.ExplicitBitVect object at 0x00000262042EA810>	G2	<rdkit.Chem.rdchem.Mol object at 0x0000026204307DF0>	G2 active	Train
CHEMBL259013		441.42	4.66	Nc1ncnc2c1N=C(c1ccc(NC(=O)Nc3ccc(C(F)(F)F)cc3)cc1)CCN2	IC50	'='	nM	9.0	CHEMBL928169	Inhibition of Flt3	BAO_0000357	single protein format	None	CHEMBL1974	Tyrosine-protein kinase receptor FLT3	Homo sapiens	SINGLE PROTEIN	CHEMBL1144750	Scientific Literature	Bioorg Med Chem Lett	2008.0	1.0	<rdkit.DataStructs.cDataStructs.ExplicitBitVect object at 0x00000262042EA730>	G2	<rdkit.Chem.rdchem.Mol object at 0x0000026204304BA0>	G2 active	Train
CHEMBL4077074		435.51	3.24	O=C(Nc1ccc(CN2CCOCC2)cc1)c1n[nH]cc1Nc1ncnc2sccc12	IC50	'='	nM	0.623	CHEMBL4059187	Inhibition of human FLT3 using EAIYAAPFAKKK as substrate preincubated for 20 mins followed by [gamma-33P]-ATP addition measure after 120 mins by filter binding method	BAO_0000357	single protein format	Homo sapiens	CHEMBL1974	Tyrosine-protein kinase receptor FLT3	Homo sapiens	SINGLE PROTEIN	CHEMBL4052828	Scientific Literature	J Med Chem	2018.0	1.0	<rdkit.DataStructs.cDataStructs.ExplicitBitVect object at 0x00000262042EA650>	G2	<rdkit.Chem.rdchem.Mol object at 0x0000026204306730>	G2 active	Train
CHEMBL260307		390.42	5.48	Cc1ccc(F)c(NC(=O)Nc2ccc(-c3ccc(C)c4onc(N)c34)cc2)c1	IC50	'='	nM	61.0	CHEMBL949291	Inhibition of FLT3 by HTRF assay	BAO_0000357	single protein format	None	CHEMBL1974	Tyrosine-protein kinase receptor FLT3	Homo sapiens	SINGLE PROTEIN	CHEMBL1142358	Scientific Literature	J Med Chem	2008.0	1.0	<rdkit.DataStructs.cDataStructs.ExplicitBitVect object at 0x00000262042EA5E0>	G2	<rdkit.Chem.rdchem.Mol object at 0x0000026204306E30>	G2 active	Train
CHEMBL2207500		413.87	2.03	Cc1nn(C)cc1-c1nc2c(N3CCN(Cc4ncon4)CC3)c(Cl)cnc2[nH]1	Kd	'='	nM	4.4	CHEMBL2214092	Binding affinity to FLT3	BAO_0000357	single protein format	None	CHEMBL1974	Tyrosine-protein kinase receptor FLT3	Homo sapiens	SINGLE PROTEIN	CHEMBL2203264	Scientific Literature	J Med Chem	2012.0	1.0	<rdkit.DataStructs.cDataStructs.ExplicitBitVect object at 0x00000262042EA490>	G2	<rdkit.Chem.rdchem.Mol object at 0x0000026207A69E70>	G2 active	Train
CHEMBL3982932		467.57	4.66	CN1CCN(c2ccc(C(=O)Nc3n[nH]c4cc(OC/C=C/c5ccccc5)ccc34)cc2)CC1	IC50	'='	nM	62.0	CHEMBL3888812	Biochemical Assay: The assay was performed using FLT3 cytoplasmic domain product and purified in house as GST fused protein. The FLT3 protein (1 microM) was pre activated with 800 microM ATP for 1 hour at 28° C in order to obtain a linear kinetic. Kinase buffer was composed of 50 mM HEPES pH 7.9 containing 4 mM MgCl2, 1 mM DTT, 10 microM Na3VO4, and 0.2 mg/mL BSA. The FLT3 kinase assay was run with a final pre activated enzyme concentration of 2 nM, in the presence of 254 microM ATP (residual ATP from KIT pre activation step is negligible), 8 nM 33P-γ-ATP and 55 microM of substrate BioDB n*24 (Aminoacidic sequence: GGKKKVSRSGLYRSPSMPENLNRPR- SEQ ID NO: 1).	BAO_0000357	single protein format	None	CHEMBL1974	Tyrosine-protein kinase receptor FLT3	Homo sapiens	SINGLE PROTEIN	CHEMBL3886843	BindingDB Database		2016.0	1.0	<rdkit.DataStructs.cDataStructs.ExplicitBitVect object at 0x00000262042EA3B0>	G2	<rdkit.Chem.rdchem.Mol object at 0x0000026207A69D90>	G2 active	Train
CHEMBL1258831		464.51	4.97	Cc1cc(/C=C2\C(=O)Nc3ccc(F)c(F)c32)c2ccccc(OCCCN3CCOCC3)c1-2	IC50	'='	nM	12.0	CHEMBL1261358	Inhibition of FLT3 by time resolved fluorescence method	BAO_0000357	single protein format	None	CHEMBL1974	Tyrosine-protein kinase receptor FLT3	Homo sapiens	SINGLE PROTEIN	CHEMBL1255211	Scientific Literature	Bioorg Med Chem Lett	2010.0	1.0	<rdkit.DataStructs.cDataStructs.ExplicitBitVect object at 0x00000262042EA2D0>	G2	<rdkit.Chem.rdchem.Mol object at 0x0000026207A69CB0>	G2 active	Train
CHEMBL4869214		345.33	4.39	CCc1c(C)c(-c2c[nH]nc2C(F)(F)F)nc2ccc3[nH]ncc3c12	IC50	'='	nM	4.0	CHEMBL4836766	Inhibition of human FLT3 ITD mutant using EAIYAAPFAKKK as substrate preincubated for 20 mins followed by 33P-ATP addition and measured after 2 hrs by filter binding method	BAO_0000357	single protein format	Homo sapiens	CHEMBL1974	Tyrosine-protein kinase receptor FLT3	Homo sapiens	SINGLE PROTEIN	CHEMBL4834472	Scientific Literature	J Med Chem	2021.0	1.0	<rdkit.DataStructs.cDataStructs.ExplicitBitVect object at 0x00000262042EA1F0>	G2	<rdkit.Chem.rdchem.Mol object at 0x0000026207A69BD0>	G2 active	Train
CHEMBL1969102		440.53	5.89	Cc1cccc(NC(=O)Nc2ccc(-c3csc4c(-c5cn[nH]c5)cnc(N)c34)cc2)c1	IC50	'='	nM	1.81	CHEMBL3707703	Homogenous Time-Resolved Fluorescence Assay (HTRF): To determine the activity of the various kinases, a homogenous time-resolved fluorescence (HTRF) in vitro kinase assay was used. (Mathis, G., HTRF(R) Technology. J Biomol Screen, 1999. 4(6): p. 309-314; Alfred J. Kolb, Paul V. Kaplita, David J. Hayes, Young-Whan Park, Christine Pernell, John S. Major and Gerard Mathis, Drug Discovery Today, 1998, 3, 333-342.). For example for KDR, cKIT, FLT1, CSF1R and FTL3, purified enzyme was mixed with 0.5 μM N-biotinylated substrate (Biotin-Ahx-AEEEYFFLA-amide (SEQ. ID. 1)), various concentrations of inhibitor in reaction buffer (50 mM HEPES, pH 7.1, 10 mM MgCl2, 2 mM MnCl2, 0.1% BSA and 1 mM DTT, 40 μL final volume), ATP (1 mM final conc.) in a black 384-well plate. After 60 minutes incubation at room temperature, the reaction was quenched by addition of a buffered EDTA solution.	BAO_0000357	single protein format	Homo sapiens	CHEMBL1974	Tyrosine-protein kinase receptor FLT3	Homo sapiens	SINGLE PROTEIN	CHEMBL3638379	BindingDB Database		2014.0	1.0	<rdkit.DataStructs.cDataStructs.ExplicitBitVect object at 0x00000262042EA110>	G2	<rdkit.Chem.rdchem.Mol object at 0x0000026207A69AF0>	G2 active	Train
CHEMBL3943797		515.61	4.15	O=C(Nc1n[nH]c2cc(OCCOCc3ccccc3)ccc12)c1ccc(NCCN2CCOCC2)cc1	IC50	'='	nM	74.0	CHEMBL3888812	Biochemical Assay: The assay was performed using FLT3 cytoplasmic domain product and purified in house as GST fused protein. The FLT3 protein (1 microM) was pre activated with 800 microM ATP for 1 hour at 28° C in order to obtain a linear kinetic. Kinase buffer was composed of 50 mM HEPES pH 7.9 containing 4 mM MgCl2, 1 mM DTT, 10 microM Na3VO4, and 0.2 mg/mL BSA. The FLT3 kinase assay was run with a final pre activated enzyme concentration of 2 nM, in the presence of 254 microM ATP (residual ATP from KIT pre activation step is negligible), 8 nM 33P-γ-ATP and 55 microM of substrate BioDB n*24 (Aminoacidic sequence: GGKKKVSRSGLYRSPSMPENLNRPR- SEQ ID NO: 1).	BAO_0000357	single protein format	None	CHEMBL1974	Tyrosine-protein kinase receptor FLT3	Homo sapiens	SINGLE PROTEIN	CHEMBL3886843	BindingDB Database		2016.0	1.0	<rdkit.DataStructs.cDataStructs.ExplicitBitVect object at 0x00000262042EA0A0>	G2	<rdkit.Chem.rdchem.Mol object at 0x0000026207A69A80>	G2 active	Train
CHEMBL4475381		468.54	3.89	CN1CCN(c2ccc(-c3n[nH]c4cc([C@@H]5C[C@@]56C(=O)Nc5ccc(F)cc56)ccc34)cn2)CC1	IC50	'='	nM	98.0	CHEMBL4430365	Inhibition of FLT3 (unknown origin)	BAO_0000357	single protein format	Homo sapiens	CHEMBL1974	Tyrosine-protein kinase receptor FLT3	Homo sapiens	SINGLE PROTEIN	CHEMBL4428091	Scientific Literature	Bioorg Med Chem Lett	2016.0	1.0	<rdkit.DataStructs.cDataStructs.ExplicitBitVect object at 0x00000262042EA030>	G2	<rdkit.Chem.rdchem.Mol object at 0x0000026207A69A10>	G2 active	Train
CHEMBL3944875		429.89	0.1	Cn1cc(Nc2ncc(Cl)c(NC3COC4C(NS(C)(=O)=O)COC34)n2)cn1	IC50	'='	nM	11.0	CHEMBL3888643	Kinase Assay: FLT3 (h) is incubated with 8 mM MOPS pH 7.0, 0.2 mM EDTA, 50 μM EAIYAAPFAKKK, 10 mM MgAcetate and [γ-33P-ATP](specific activity approx. 500 cpm/pmol, concentration as required). The reaction is initiated by the addition of the MgATP mix. After incubation for 40 minutes at room temperature, the reaction is stopped by the addition of 3% phosphoric acid solution. 10 μL of the reaction is then spotted onto a P30 filtermat and washed three times for 5 minutes in 75 mM phosphoric acid and once in methanol prior to drying and scintillation counting.	BAO_0000357	single protein format	Homo sapiens	CHEMBL1974	Tyrosine-protein kinase receptor FLT3	Homo sapiens	SINGLE PROTEIN	CHEMBL3886792	BindingDB Database		2016.0	1.0	<rdkit.DataStructs.cDataStructs.ExplicitBitVect object at 0x00000262042E9FC0>	G2	<rdkit.Chem.rdchem.Mol object at 0x0000026207A699A0>	G2 active	Train
CHEMBL3237703		442.57	4.28	C[C@H]1CC[C@H](n2c3cnccc3c3cnc(Nc4ccc(N5CCNCC5)cn4)nc32)CC1	IC50	'='	nM	2.0	CHEMBL3240326	Inhibition of GST-fused human FLT3 cytoplasmic domain (amino acids 564 to 993) using Ulight-JAK1 as substrate after 1 hr by TR-FRET assay	BAO_0000357	single protein format	Homo sapiens	CHEMBL1974	Tyrosine-protein kinase receptor FLT3	Homo sapiens	SINGLE PROTEIN	CHEMBL3232894	Scientific Literature	J Med Chem	2014.0	1.0	<rdkit.DataStructs.cDataStructs.ExplicitBitVect object at 0x00000262042E9F50>	G2	<rdkit.Chem.rdchem.Mol object at 0x0000026207A69930>	G2 active	Train
CHEMBL381207		461.44	6.05	Cc1sc2ncnc(N)c2c1-c1ccc(NC(=O)Nc2cc(C(F)(F)F)ccc2F)cc1	IC50	'='	nM	27.0	CHEMBL871628	Inhibitory concentration against FLT3 with 4 uM Biotin-Ahx-AEEEYFFLFA-amide for 1 hr at ambient temperature with 1 mM ATP and 3.2-50 uM compound in 5%DMSO at pH 7.5	BAO_0000357	single protein format	Homo sapiens	CHEMBL1974	Tyrosine-protein kinase receptor FLT3	Homo sapiens	SINGLE PROTEIN	CHEMBL1141091	Scientific Literature	J Med Chem	2005.0	1.0	<rdkit.DataStructs.cDataStructs.ExplicitBitVect object at 0x00000262042E9D90>	G2	<rdkit.Chem.rdchem.Mol object at 0x0000026207A69380>	G2 active	Train
CHEMBL2023485		462.51	4.52	CCc1cc(NC(=O)Cc2ccc(Oc3ccnc4cc(OC)c(OC)cc34)cc2OC)n[nH]1	IC50	'='	nM	60.0	CHEMBL2026428	Inhibition of Flt3	BAO_0000357	single protein format	None	CHEMBL1974	Tyrosine-protein kinase receptor FLT3	Homo sapiens	SINGLE PROTEIN	CHEMBL2021798	Scientific Literature	Bioorg Med Chem Lett	2012.0	1.0	<rdkit.DataStructs.cDataStructs.ExplicitBitVect object at 0x00000262042E9D20>	G2	<rdkit.Chem.rdchem.Mol object at 0x0000026207A697E0>	G2 active	Train
CHEMBL453057		437.51	4.94	Cc1cccc(NC(=O)Nc2ccc(-c3cnc4c(-c5cnn(C)c5)ccn4c3N)cc2)c1	IC50	'='	nM	5.0	CHEMBL948367	Inhibition of Flt3 by HTRF assay	BAO_0000357	single protein format	None	CHEMBL1974	Tyrosine-protein kinase receptor FLT3	Homo sapiens	SINGLE PROTEIN	CHEMBL1155009	Scientific Literature	J Med Chem	2008.0	1.0	<rdkit.DataStructs.cDataStructs.ExplicitBitVect object at 0x00000262042E9CB0>	G2	<rdkit.Chem.rdchem.Mol object at 0x0000026207A69700>	G2 active	Train
CHEMBL272183		389.37	4.63	Nc1noc2cccc(-c3ccc(NC(=O)Nc4cccc([N+](=O)[O-])c4)cc3)c12	IC50	'='	nM	5.0	CHEMBL949291	Inhibition of FLT3 by HTRF assay	BAO_0000357	single protein format	None	CHEMBL1974	Tyrosine-protein kinase receptor FLT3	Homo sapiens	SINGLE PROTEIN	CHEMBL1142358	Scientific Literature	J Med Chem	2008.0	1.0	<rdkit.DataStructs.cDataStructs.ExplicitBitVect object at 0x00000262042E9C40>	G2	<rdkit.Chem.rdchem.Mol object at 0x0000026207A69620>	G2 active	Train
CHEMBL2063321		510.6	4.37	CN1CCN(c2ccc(C(=O)Nc3cc(-c4ccc(CNC(=O)Oc5ccccc5)cc4)n[nH]3)cc2)CC1	IC50	'='	nM	16.0	CHEMBL2066303	Inhibition of wild type FLT3	BAO_0000357	single protein format	Homo sapiens	CHEMBL1974	Tyrosine-protein kinase receptor FLT3	Homo sapiens	SINGLE PROTEIN	CHEMBL2062390	Scientific Literature	Bioorg Med Chem Lett	2012.0	1.0	<rdkit.DataStructs.cDataStructs.ExplicitBitVect object at 0x00000262042E9BD0>	G2	<rdkit.Chem.rdchem.Mol object at 0x0000026207A69540>	G2 active	Train
CHEMBL3353344		406.49	5.12	Cc1ccc(/C=C/c2n[nH]c3cc([C@@H]4C[C@@]45C(=O)Nc4ccccc45)ccc23)c(C)n1	IC50	'='	nM	59.0	CHEMBL3364611	Inhibition of FLT3 (unknown origin) by FRET-based homogeneous assay	BAO_0000357	single protein format	Homo sapiens	CHEMBL1974	Tyrosine-protein kinase receptor FLT3	Homo sapiens	SINGLE PROTEIN	CHEMBL3351767	Scientific Literature	J Med Chem	2015.0	1.0	<rdkit.DataStructs.cDataStructs.ExplicitBitVect object at 0x00000262042E9B60>	G2	<rdkit.Chem.rdchem.Mol object at 0x0000026207A694D0>	G2 active	Train
CHEMBL393525		452.29	2.97	Cc1ccc([N+](=O)[O-])cc1S(=O)(=O)N(C)/N=C/c1cnc2ccc(Br)cn12	IC50	'='	nM	5.15	CHEMBL3615646	Inhibition of FLT3 (unknown origin) using biotin-Glu-Gly-Pro-Trp-Leu-Glu-Glu-Glu-Glu-Glu-Ala-Tyr-Gly-Trp-Met-Asp-Phe-NH2 as substrate after 90 mins by luminescence assay	BAO_0000357	single protein format	Homo sapiens	CHEMBL1974	Tyrosine-protein kinase receptor FLT3	Homo sapiens	SINGLE PROTEIN	CHEMBL3612060	Scientific Literature	Bioorg Med Chem	2015.0	1.0	<rdkit.DataStructs.cDataStructs.ExplicitBitVect object at 0x00000262042E9A80>	G2	<rdkit.Chem.rdchem.Mol object at 0x0000026207A693F0>	G2 active	Train
CHEMBL4871011		441.54	3.78	CC(=O)N1CCCN(c2cccc(Nc3nccc(-c4cnc5n(C)cccc4-5)n3)c2)CC1	Ki	'='	nM	1.0	CHEMBL4815226	Inhibition of wild type FLT3 (unknown origin) using Glu/Tyr peptide substrate incubated for 120 mins measured after 40 mins incubation under dark by ADP-glo based luminescence assay	BAO_0000357	single protein format	Homo sapiens	CHEMBL1974	Tyrosine-protein kinase receptor FLT3	Homo sapiens	SINGLE PROTEIN	CHEMBL4813946	Scientific Literature	Eur J Med Chem	2021.0	1.0	<rdkit.DataStructs.cDataStructs.ExplicitBitVect object at 0x00000262042E9A10>	G2	<rdkit.Chem.rdchem.Mol object at 0x0000026207A69310>	G2 active	Train
CHEMBL4277564		506.74	5.61	CCC[C@H](C)Nc1ncc2c(-c3ccc(CNCCN(CC)CC)cc3)cn([C@H]3CC[C@H](O)CC3)c2n1	IC50	'='	nM	49.0	CHEMBL4276335	Inhibition of FLT3 (unknown origin) using 5'-FAM-KKKKEEIYFFF-CONH2 as substrate after 180 mins by MCE assay	BAO_0000357	single protein format	Homo sapiens	CHEMBL1974	Tyrosine-protein kinase receptor FLT3	Homo sapiens	SINGLE PROTEIN	CHEMBL4270664	Scientific Literature	J Med Chem	2018.0	1.0	<rdkit.DataStructs.cDataStructs.ExplicitBitVect object at 0x00000262042E99A0>	G2	<rdkit.Chem.rdchem.Mol object at 0x0000026207A69230>	G2 active	Train
CHEMBL4847680		390.9	5.78	Cn1cc(-c2ccn3c(-c4ccc(-c5cccc(Cl)c5)s4)cnc3c2)cn1	IC50	'='	nM	53.0	CHEMBL4831021	Inhibition of FLT3 (unknown origin) using 5' FAM-EPLYWSFPA peptide as a substrate in the presence of ATP incubated for 60 mins by microfluidics assay	BAO_0000357	single protein format	Homo sapiens	CHEMBL1974	Tyrosine-protein kinase receptor FLT3	Homo sapiens	SINGLE PROTEIN	CHEMBL4828756	Scientific Literature	Eur J Med Chem	2021.0	1.0	<rdkit.DataStructs.cDataStructs.ExplicitBitVect object at 0x00000262042E9930>	G2	<rdkit.Chem.rdchem.Mol object at 0x0000026207A691C0>	G2 active	Train
CHEMBL4202997		483.57	4.86	Nc1ncnc2c1c(-c1ccc(Oc3ccccc3)cc1)cn2[C@H]1CC[C@H](N[C@H]2CCOC2=O)CC1	IC50	'='	nM	25.0	CHEMBL4180099	Inhibition of recombinant human C-terminal FLT3 ITD mutant (571 to 993 residues) after 90 mins by mobility shift assay	BAO_0000357	single protein format	Homo sapiens	CHEMBL1974	Tyrosine-protein kinase receptor FLT3	Homo sapiens	SINGLE PROTEIN	CHEMBL4177609	Scientific Literature	Bioorg Med Chem Lett	2017.0	1.0	<rdkit.DataStructs.cDataStructs.ExplicitBitVect object at 0x00000262042E98C0>	G2	<rdkit.Chem.rdchem.Mol object at 0x0000026207A692A0>	G2 active	Train
CHEMBL4466113		344.4	4.18	O=C1Nc2ccccc2/C1=C\c1ccc2c(-c3nccs3)n[nH]c2c1	IC50	'='	nM	72.0	CHEMBL4430365	Inhibition of FLT3 (unknown origin)	BAO_0000357	single protein format	Homo sapiens	CHEMBL1974	Tyrosine-protein kinase receptor FLT3	Homo sapiens	SINGLE PROTEIN	CHEMBL4428091	Scientific Literature	Bioorg Med Chem Lett	2016.0	1.0	<rdkit.DataStructs.cDataStructs.ExplicitBitVect object at 0x00000262042E9850>	G2	<rdkit.Chem.rdchem.Mol object at 0x0000026207A689E0>	G2 active	Train
CHEMBL3646211		530.61	4.41	COc1ccc(NC(=O)Nc2ccc(-c3csc4c(-c5cnn(C[C@H](O)CO)c5)cnc(N)c34)cc2)cc1	IC50	'='	nM	1.22	CHEMBL3707703	Homogenous Time-Resolved Fluorescence Assay (HTRF): To determine the activity of the various kinases, a homogenous time-resolved fluorescence (HTRF) in vitro kinase assay was used. (Mathis, G., HTRF(R) Technology. J Biomol Screen, 1999. 4(6): p. 309-314; Alfred J. Kolb, Paul V. Kaplita, David J. Hayes, Young-Whan Park, Christine Pernell, John S. Major and Gerard Mathis, Drug Discovery Today, 1998, 3, 333-342.). For example for KDR, cKIT, FLT1, CSF1R and FTL3, purified enzyme was mixed with 0.5 μM N-biotinylated substrate (Biotin-Ahx-AEEEYFFLA-amide (SEQ. ID. 1)), various concentrations of inhibitor in reaction buffer (50 mM HEPES, pH 7.1, 10 mM MgCl2, 2 mM MnCl2, 0.1% BSA and 1 mM DTT, 40 μL final volume), ATP (1 mM final conc.) in a black 384-well plate. After 60 minutes incubation at room temperature, the reaction was quenched by addition of a buffered EDTA solution.	BAO_0000357	single protein format	Homo sapiens	CHEMBL1974	Tyrosine-protein kinase receptor FLT3	Homo sapiens	SINGLE PROTEIN	CHEMBL3638379	BindingDB Database		2014.0	1.0	<rdkit.DataStructs.cDataStructs.ExplicitBitVect object at 0x00000262042E97E0>	G2	<rdkit.Chem.rdchem.Mol object at 0x0000026207A695B0>	G2 active	Train
