Compound_ID	Molecule Name	Molecular Weight	AlogP	Smiles	Standard Type	Standard Relation	Standard Units	Standard Value	Assay ChEMBL ID	Assay Description	BAO Format ID	BAO Label	Assay Organism	Target ChEMBL ID	Target Name	Target Organism	Target Type	Document ChEMBL ID	Source Description	Document Journal	Document Year	Active	bits	Group	ROMol	Set	Set_type
CHEMBL3982591		349.44	3.15	CN(c1ncc2cccc(-c3cc4c([nH]3)CCNC4=O)c2n1)C(C)(C)C	IC50	'='	nM	2.43	CHEMBL3888799	Homogeneous Time Resolved Fluorescence Assay (HTRF): The assay for the determination of Pim activity is based on the formation of phosphorylated biotinylated-BAD peptide at the Serine 112 residue (S112) and employs HTRF® (homogeneous time resolved fluorescence) technology to detect the product in a 384-well plate format. The phosphorylation of biotinylated-BAD (S112) peptide by full length recombinant Pim-1, Pim-2, or Pim-3 protein was detected with streptavidin:Allophycocyanin (APC) conjugate and a europium (Eu) labeled antibody directed against phosphorylated-BAD (S112). Excitation of Eu by a high energy laser light (337 nm) leads to a transfer of energy to the APC molecule, and results in an emission at 665 nm. The fluorescence is directly proportional to the amount of phosphorylated BAD peptide present in the reaction. Compounds were prepared in DMSO by conducting 3-fold serial dilutions to give a 22-point dosing curve having a high dose of 1 μM. A reference compound was included on each assay plate [Costar 3658] in order to validate that plate; on one plate of every assay run, two additional reference compounds were included. The Reaction Buffer consisted of 45 mM Hepes, pH 7.0, 15 mM NaCl, and 1 mM MgCl. The quench/detection buffer consisted of 50 mM Tris, 100 mM NaCl, 0.05% BSA, 0.1% Tween and 3 mM EDTA. Biotinylated BAD peptide (Biopeptide), 10 mM ATP (Sigma), Labeled p-BAD (S112) mAb (Cell Signalling and Perkin Elmer) [with 0.05% BSA and 2 mM DTT added] streptavidin:Allophycocyanin [Perkin Elmer]. Final concentrations either Pim-1 enzyme [5 pM], or Pim-2 enzyme [0.5 pM], DMSO [1%], BLC BAD (S112) [0.5 μM], ATP [1.5 μM], streptavidin:Allophycocyanin [0.002 mg/mL] and biotinylated-BAD (S112) mAb [100 pM]. Initial incubations were carried out at RT (22° C.) for 30 min for both Pim-1 and for Pim-2. Pim enzyme is added to compound in buffer, and plates are incubated of 30 min. Biotinylated BAD and ATP are added and plates are incubated for 1 h. A mixture of labeled p-BAD (S112) mAb and quench/detection buffer are added and incubated for 2 h. Fluorescence was measured by an HTRF® Envision microplate reader.	BAO_0000357	single protein format	None	CHEMBL2147	Serine/threonine-protein kinase PIM1	Homo sapiens	SINGLE PROTEIN	CHEMBL3886836	BindingDB Database		2016.0	1.0	<rdkit.DataStructs.cDataStructs.ExplicitBitVect object at 0x0000022A723E4890>	G2	<rdkit.Chem.rdchem.Mol object at 0x0000022A723AB4C0>	G2 active	Train
CHEMBL3103867		406.47	3.04	Nc1ccc(-c2ccccc2F)nc1C(=O)Nc1cnccc1N1CCC[C@H](N)C1	Ki	'='	nM	0.03	CHEMBL4316999	Inhibition of recombinant human PIM1 using FAM-pimtide as substrate after 90 mins by Z-LYTE assay	BAO_0000357	single protein format	Homo sapiens	CHEMBL2147	Serine/threonine-protein kinase PIM1	Homo sapiens	SINGLE PROTEIN	CHEMBL4316591	Scientific Literature	J Med Chem	2019.0	1.0	<rdkit.DataStructs.cDataStructs.ExplicitBitVect object at 0x0000022A723E7E60>	G2	<rdkit.Chem.rdchem.Mol object at 0x0000022A723AB530>	G2 active	Train
CHEMBL3355544		392.38	4.01	O[C@H]1CC[C@H](Nc2ccn3ncc(-c4cccc(OC(F)(F)F)c4)c3n2)CC1	IC50	'='	nM	27.0	CHEMBL3374860	Inhibition of Pim1 (unknown origin) using luciferase-luciferin based ATP detection reagent by Kinase-Glo assay	BAO_0000357	single protein format	Homo sapiens	CHEMBL2147	Serine/threonine-protein kinase PIM1	Homo sapiens	SINGLE PROTEIN	CHEMBL3351833	Scientific Literature	ACS Med Chem Lett	2015.0	1.0	<rdkit.DataStructs.cDataStructs.ExplicitBitVect object at 0x0000022A723E7370>	G2	<rdkit.Chem.rdchem.Mol object at 0x0000022A723AB5A0>	G2 active	Train
CHEMBL3684968		700.11	7.7	CN(C)CCN(Cc1ccccc1)c1nc2c(Br)c(Br)c(Br)c(Br)c2n1Cc1ccccc1	IC50	'='	nM	75.66	CHEMBL3705636	Luminometric Kinase Assay: Kinase assay was performed using luminescent Kinase-Glo (Promega) system. The Kinase-Glo Luminescent Kinase Assay Platform provides a homogeneous, high-throughput screening method for measuring kinase activity by quantifying the amount of ATP remaining in solution following a kinase reaction.	BAO_0000357	single protein format	None	CHEMBL2147	Serine/threonine-protein kinase PIM1	Homo sapiens	SINGLE PROTEIN	CHEMBL3638987	BindingDB Database		2013.0	1.0	<rdkit.DataStructs.cDataStructs.ExplicitBitVect object at 0x0000022A723E5930>	G2	<rdkit.Chem.rdchem.Mol object at 0x0000022A723AB610>	G2 active	Train
CHEMBL3689317		640.01	5.94	CN(C)CC(CNc1nc2c(Br)c(Br)c(Br)c(Br)c2[nH]1)C(O)c1ccccc1	IC50	'='	nM	43.34	CHEMBL3705636	Luminometric Kinase Assay: Kinase assay was performed using luminescent Kinase-Glo (Promega) system. The Kinase-Glo Luminescent Kinase Assay Platform provides a homogeneous, high-throughput screening method for measuring kinase activity by quantifying the amount of ATP remaining in solution following a kinase reaction.	BAO_0000357	single protein format	None	CHEMBL2147	Serine/threonine-protein kinase PIM1	Homo sapiens	SINGLE PROTEIN	CHEMBL3638987	BindingDB Database		2013.0	1.0	<rdkit.DataStructs.cDataStructs.ExplicitBitVect object at 0x0000022A723E69D0>	G2	<rdkit.Chem.rdchem.Mol object at 0x0000022A723AB680>	G2 active	Train
CHEMBL4786077		495.65	2.61	CN(C)S(=O)(=O)Nc1cccc(-c2nc(/C=C3\SC(NCC(C)(C)CO)=NC3=O)cs2)c1	IC50	'='	nM	22.1	CHEMBL4687837	Inhibition of PIM1 (unknown origin) by coupled kinetic assay	BAO_0000357	single protein format	Homo sapiens	CHEMBL2147	Serine/threonine-protein kinase PIM1	Homo sapiens	SINGLE PROTEIN	CHEMBL4680285	Scientific Literature	Bioorg Med Chem	2020.0	1.0	<rdkit.DataStructs.cDataStructs.ExplicitBitVect object at 0x0000022A723E7BC0>	G2	<rdkit.Chem.rdchem.Mol object at 0x0000022A723AB6F0>	G2 active	Train
CHEMBL3949175		393.47	3.73	C[C@H]1NC(=O)c2cc(-c3c(F)ccc4c3N=C(NC3(C)CC3)N(C3CC3)C4)[nH]c21	IC50	'='	nM	0.046	CHEMBL3888799	Homogeneous Time Resolved Fluorescence Assay (HTRF): The assay for the determination of Pim activity is based on the formation of phosphorylated biotinylated-BAD peptide at the Serine 112 residue (S112) and employs HTRF® (homogeneous time resolved fluorescence) technology to detect the product in a 384-well plate format. The phosphorylation of biotinylated-BAD (S112) peptide by full length recombinant Pim-1, Pim-2, or Pim-3 protein was detected with streptavidin:Allophycocyanin (APC) conjugate and a europium (Eu) labeled antibody directed against phosphorylated-BAD (S112). Excitation of Eu by a high energy laser light (337 nm) leads to a transfer of energy to the APC molecule, and results in an emission at 665 nm. The fluorescence is directly proportional to the amount of phosphorylated BAD peptide present in the reaction. Compounds were prepared in DMSO by conducting 3-fold serial dilutions to give a 22-point dosing curve having a high dose of 1 μM. A reference compound was included on each assay plate [Costar 3658] in order to validate that plate; on one plate of every assay run, two additional reference compounds were included. The Reaction Buffer consisted of 45 mM Hepes, pH 7.0, 15 mM NaCl, and 1 mM MgCl. The quench/detection buffer consisted of 50 mM Tris, 100 mM NaCl, 0.05% BSA, 0.1% Tween and 3 mM EDTA. Biotinylated BAD peptide (Biopeptide), 10 mM ATP (Sigma), Labeled p-BAD (S112) mAb (Cell Signalling and Perkin Elmer) [with 0.05% BSA and 2 mM DTT added] streptavidin:Allophycocyanin [Perkin Elmer]. Final concentrations either Pim-1 enzyme [5 pM], or Pim-2 enzyme [0.5 pM], DMSO [1%], BLC BAD (S112) [0.5 μM], ATP [1.5 μM], streptavidin:Allophycocyanin [0.002 mg/mL] and biotinylated-BAD (S112) mAb [100 pM]. Initial incubations were carried out at RT (22° C.) for 30 min for both Pim-1 and for Pim-2. Pim enzyme is added to compound in buffer, and plates are incubated of 30 min. Biotinylated BAD and ATP are added and plates are incubated for 1 h. A mixture of labeled p-BAD (S112) mAb and quench/detection buffer are added and incubated for 2 h. Fluorescence was measured by an HTRF® Envision microplate reader.	BAO_0000357	single protein format	None	CHEMBL2147	Serine/threonine-protein kinase PIM1	Homo sapiens	SINGLE PROTEIN	CHEMBL3886836	BindingDB Database		2016.0	1.0	<rdkit.DataStructs.cDataStructs.ExplicitBitVect object at 0x0000022A723E7AE0>	G2	<rdkit.Chem.rdchem.Mol object at 0x0000022A723AB760>	G2 active	Train
CHEMBL3684945		565.89	6.18	Brc1c(Br)c(Br)c2[nH]c(N3CCNc4ccccc43)nc2c1Br	IC50	'='	nM	39.48	CHEMBL3705636	Luminometric Kinase Assay: Kinase assay was performed using luminescent Kinase-Glo (Promega) system. The Kinase-Glo Luminescent Kinase Assay Platform provides a homogeneous, high-throughput screening method for measuring kinase activity by quantifying the amount of ATP remaining in solution following a kinase reaction.	BAO_0000357	single protein format	None	CHEMBL2147	Serine/threonine-protein kinase PIM1	Homo sapiens	SINGLE PROTEIN	CHEMBL3638987	BindingDB Database		2013.0	1.0	<rdkit.DataStructs.cDataStructs.ExplicitBitVect object at 0x0000022A723E7990>	G2	<rdkit.Chem.rdchem.Mol object at 0x0000022A723AB7D0>	G2 active	Train
CHEMBL3634769		402.46	1.67	CCn1cncc(-c2cc3c(-c4cccc(N5CCNCC5)n4)n[nH]c3cn2)c1=O	Ki	'='	nM	0.015	CHEMBL3636740	Inhibition of Pim1 (unknown origin) using 5FAM-ARKRRRHPSGPPTA as substrate after 90 mins	BAO_0000357	single protein format	Homo sapiens	CHEMBL2147	Serine/threonine-protein kinase PIM1	Homo sapiens	SINGLE PROTEIN	CHEMBL3632547	Scientific Literature	Bioorg Med Chem Lett	2015.0	1.0	<rdkit.DataStructs.cDataStructs.ExplicitBitVect object at 0x0000022A723E7920>	G2	<rdkit.Chem.rdchem.Mol object at 0x0000022A723A8C10>	G2 active	Train
CHEMBL2036118		333.44	4.43	CN(C)CCCCn1c2ccccc2c2ccc3c(C=O)c[nH]c3c21	IC50	'='	nM	75.0	CHEMBL2040255	Inhibition of Pim-1 using RSRHSSYPAGT as substrate after 30 mins	BAO_0000357	single protein format	None	CHEMBL2147	Serine/threonine-protein kinase PIM1	Homo sapiens	SINGLE PROTEIN	CHEMBL2034961	Scientific Literature	Bioorg Med Chem Lett	2012.0	1.0	<rdkit.DataStructs.cDataStructs.ExplicitBitVect object at 0x0000022A723E7840>	G2	<rdkit.Chem.rdchem.Mol object at 0x0000022A723A8C80>	G2 active	Train
CHEMBL1952122		392.39	2.9	CNC1CCN(c2ccc3nnn(-c4cccc(OC(F)(F)F)c4)c3n2)CC1	IC50	'='	nM	87.0	CHEMBL1954566	Inhibition of PIM1	BAO_0000357	single protein format	None	CHEMBL2147	Serine/threonine-protein kinase PIM1	Homo sapiens	SINGLE PROTEIN	CHEMBL1949661	Scientific Literature	Bioorg Med Chem Lett	2012.0	1.0	<rdkit.DataStructs.cDataStructs.ExplicitBitVect object at 0x0000022A723E76F0>	G2	<rdkit.Chem.rdchem.Mol object at 0x0000022A723A8CF0>	G2 active	Train
CHEMBL4756601		440.85	4.01	N#Cc1c(-c2ccccc2Cl)c2c(N/N=C3\C=CC(=O)c4ccccc43)n[nH]c2[nH]c1=O	IC50	'='	nM	95.0	CHEMBL4705104	Inhibition of recombinant human GST-tagged PIM1 by ELISA	BAO_0000357	single protein format	Homo sapiens	CHEMBL2147	Serine/threonine-protein kinase PIM1	Homo sapiens	SINGLE PROTEIN	CHEMBL4699630	Scientific Literature	Bioorg Med Chem	2020.0	1.0	<rdkit.DataStructs.cDataStructs.ExplicitBitVect object at 0x0000022A723E7610>	G2	<rdkit.Chem.rdchem.Mol object at 0x0000022A72407760>	G2 active	Train
CHEMBL3660042		388.43	2.87	NC(=O)N1CCC(Oc2cccc3ccc(-c4nnc5ccccn45)nc23)CC1	IC50	'='	nM	12.0	CHEMBL3705106	PIM-1 Enzyme Assay: The assay for the determination of PIM activity is based on the incorporation of [33P] ATP into PIM2tide substrate and capture of the radiolabeled peptide onto a Whatman P81 (phosphocellulose) filter plate. Assay mixtures contained 35uM [gamma-33P] ATP (20 uCi/mL), 7.5 uM PIM2tide and 0.25 nM PIM-1 in a total volume of 50 pt.	BAO_0000357	single protein format	None	CHEMBL2147	Serine/threonine-protein kinase PIM1	Homo sapiens	SINGLE PROTEIN	CHEMBL3639321	BindingDB Database		2013.0	1.0	<rdkit.DataStructs.cDataStructs.ExplicitBitVect object at 0x0000022A723E7680>	G2	<rdkit.Chem.rdchem.Mol object at 0x0000022A724077D0>	G2 active	Train
CHEMBL3664618		465.53	3.33	COC1(COc2cc(F)cc3ccc(-c4nnc5ccccn45)nc23)CCCN(CCO)CC1	IC50	'='	nM	1.4	CHEMBL3705106	PIM-1 Enzyme Assay: The assay for the determination of PIM activity is based on the incorporation of [33P] ATP into PIM2tide substrate and capture of the radiolabeled peptide onto a Whatman P81 (phosphocellulose) filter plate. Assay mixtures contained 35uM [gamma-33P] ATP (20 uCi/mL), 7.5 uM PIM2tide and 0.25 nM PIM-1 in a total volume of 50 pt.	BAO_0000357	single protein format	None	CHEMBL2147	Serine/threonine-protein kinase PIM1	Homo sapiens	SINGLE PROTEIN	CHEMBL3639321	BindingDB Database		2013.0	1.0	<rdkit.DataStructs.cDataStructs.ExplicitBitVect object at 0x0000022A723E7450>	G2	<rdkit.Chem.rdchem.Mol object at 0x0000022A72407840>	G2 active	Train
CHEMBL3664625		361.41	2.31	c1cc(OCC2CNCCO2)c2nc(-c3nnc4ccccn34)ccc2c1	IC50	'='	nM	14.2	CHEMBL3705106	PIM-1 Enzyme Assay: The assay for the determination of PIM activity is based on the incorporation of [33P] ATP into PIM2tide substrate and capture of the radiolabeled peptide onto a Whatman P81 (phosphocellulose) filter plate. Assay mixtures contained 35uM [gamma-33P] ATP (20 uCi/mL), 7.5 uM PIM2tide and 0.25 nM PIM-1 in a total volume of 50 pt.	BAO_0000357	single protein format	None	CHEMBL2147	Serine/threonine-protein kinase PIM1	Homo sapiens	SINGLE PROTEIN	CHEMBL3639321	BindingDB Database		2013.0	1.0	<rdkit.DataStructs.cDataStructs.ExplicitBitVect object at 0x0000022A723E6F80>	G2	<rdkit.Chem.rdchem.Mol object at 0x0000022A724076F0>	G2 active	Train
CHEMBL1835063		380.37	2.27	NC(=O)c1cnc(N2CCC[C@H](N)C2)nc1Nc1cccc(C(F)(F)F)c1	IC50	'='	nM	53.0	CHEMBL4629877	Inhibition of human PIM1 using KKRNRTLTK as substrate in presence of [gamma-33P]-ATP by hotspot kinase assay	BAO_0000357	single protein format	Homo sapiens	CHEMBL2147	Serine/threonine-protein kinase PIM1	Homo sapiens	SINGLE PROTEIN	CHEMBL4627396	Scientific Literature	J Med Chem	2020.0	1.0	<rdkit.DataStructs.cDataStructs.ExplicitBitVect object at 0x0000022A723E6EA0>	G2	<rdkit.Chem.rdchem.Mol object at 0x0000022A724078B0>	G2 active	Train
CHEMBL3703187		343.46	2.39	CSc1ncc2ccc3c(C(N)=O)cn(CC(C)(C)CN)c3c2n1	IC50	'='	nM	24.0	CHEMBL3705587	Trans-Phosphorylation Assay: Specific peptide or protein substrates are trans-phosphorylated by their specific ser-thr or tyr kinase in the presence of ATP traced with 33P-gamma-ATP, and in the presence of their own optimal buffer and cofactors.At the end of the phosphorylation reaction, more than 98% unlabeled ATP and radioactive ATP is captured by an excess of the ion exchange dowex resin; the resin then settles down to the bottom of the reaction plate by gravity.Supernatant is subsequently withdrawn and transferred into a counting plate, then evaluated by beta -counting.Reagents/Assay ConditionsDowex Resin Preparation500 g of wet resin (SIGMA, custom prepared resin DOWEX 18 200-400 mesh, 2.5 Kg) are weighed out and diluted to 2 L in 150 mM sodium formate, pH 3.00.The resin is allowed to settle down (some hours) and then the supernatant is discarded.After three washes as above over a couple of days, the resin is allowed to settle and two volumes (wrt the resin volume) of 150 mM sodium formate buffer are added.	BAO_0000357	single protein format	None	CHEMBL2147	Serine/threonine-protein kinase PIM1	Homo sapiens	SINGLE PROTEIN	CHEMBL3639053	BindingDB Database		2015.0	1.0	<rdkit.DataStructs.cDataStructs.ExplicitBitVect object at 0x0000022A723E6810>	G2	<rdkit.Chem.rdchem.Mol object at 0x0000022A72407990>	G2 active	Train
CHEMBL3921910		415.42	4.35	NCCC1CNC(=O)c2cc(-c3cccc(OC(F)(F)F)c3)c(-c3ccccc3)n21	IC50	'='	nM	7.0	CHEMBL3887519	Trans-Phosphorylation Assay: The inhibitory activity of putative kinase inhibitors and the potency of selected compounds were determined using a trans-phosphorylation assay. Specific peptide or protein substrates were trans-phosphorylated by their specific ser-thr or tyr kinase in the presence of ATP traced with 33P-gamma-ATP, and in the presence of their own optimal buffer and cofactors.At the end of the phosphorylation reaction, more than 98% unlabeled ATP and radioactive ATP were captured by an excess of the ion exchange dowex resin; the resin then settled down to the bottom of the reaction plate by gravity. Supernatant was subsequently withdrawn and transferred into a counting plate, then evaluated by beta-counting. Kinase Buffer (KB):The buffer for PIM1 assay was composed of HEPES 50 mM, at pH 7.5, with 10 mM MgCl2, 1 mM DTT, 3 uM NaVO3, and 0.2 mg/mL BSA.Â  Full-length human PIM1 was expressed and purified as described in Bullock A N, et al., J. Biol. Chem. 2005, 280, 41675-82.	BAO_0000357	single protein format	None	CHEMBL2147	Serine/threonine-protein kinase PIM1	Homo sapiens	SINGLE PROTEIN	CHEMBL3886350	BindingDB Database		2015.0	1.0	<rdkit.DataStructs.cDataStructs.ExplicitBitVect object at 0x0000022A723E67A0>	G2	<rdkit.Chem.rdchem.Mol object at 0x0000022A72407A00>	G2 active	Train
CHEMBL3964497		536.59	5.05	COc1nc(-c2cn(S(=O)(=O)c3ccc(C)cc3)c3ccc(-c4nnc(NC(C)(C)C)o4)cc23)ncc1F	IC50	'='	nM	8.767	CHEMBL3888377	Enzyme Assay: The assay for the determination of Pim activity is based on the formation of phosphorylated biotinylated-BAD peptide at the Serine 112 residue (S112) and employs HTRF® (homogeneous time resolved fluorescence) technology to detect the product in a 96-well plate format. The phosphorylation of biotinylated-BAD (S112) peptide by full length recombinant Pim-1, Pim-2, or Pim-3 protein was detected with streptavidin:Allophycocyanin (APC) conjugate and a europium (Eu) labeled antibody directed against phosphorylated-BAD (S112). Excitation of Eu by a high energy laser light (337 nm) leads to a transfer of energy to the APC molecule, and results in an emission at 665 nm. The fluorescence is directly proportional to the amount of phosphorylated BAD peptide present in the reaction.Compounds were prepared in DMSO by conducting 3-fold serial dilutions to give a 10-point dosing curve having a high dose of 1 uM. A reference compound was included on each assay plate in order to validate that plate; on	BAO_0000357	single protein format	None	CHEMBL2147	Serine/threonine-protein kinase PIM1	Homo sapiens	SINGLE PROTEIN	CHEMBL3886684	BindingDB Database		2016.0	1.0	<rdkit.DataStructs.cDataStructs.ExplicitBitVect object at 0x0000022A723E6650>	G2	<rdkit.Chem.rdchem.Mol object at 0x0000022A72407AE0>	G2 active	Train
CHEMBL3949953		393.49	3.28	Cc1nc2cccc(-c3cc4n(c3)C(CCO)CNC4=O)c2nc1NC(C)(C)C	IC50	'='	nM	9.5	CHEMBL3888799	Homogeneous Time Resolved Fluorescence Assay (HTRF): The assay for the determination of Pim activity is based on the formation of phosphorylated biotinylated-BAD peptide at the Serine 112 residue (S112) and employs HTRF® (homogeneous time resolved fluorescence) technology to detect the product in a 384-well plate format. The phosphorylation of biotinylated-BAD (S112) peptide by full length recombinant Pim-1, Pim-2, or Pim-3 protein was detected with streptavidin:Allophycocyanin (APC) conjugate and a europium (Eu) labeled antibody directed against phosphorylated-BAD (S112). Excitation of Eu by a high energy laser light (337 nm) leads to a transfer of energy to the APC molecule, and results in an emission at 665 nm. The fluorescence is directly proportional to the amount of phosphorylated BAD peptide present in the reaction. Compounds were prepared in DMSO by conducting 3-fold serial dilutions to give a 22-point dosing curve having a high dose of 1 μM. A reference compound was included on each assay plate [Costar 3658] in order to validate that plate; on one plate of every assay run, two additional reference compounds were included. The Reaction Buffer consisted of 45 mM Hepes, pH 7.0, 15 mM NaCl, and 1 mM MgCl. The quench/detection buffer consisted of 50 mM Tris, 100 mM NaCl, 0.05% BSA, 0.1% Tween and 3 mM EDTA. Biotinylated BAD peptide (Biopeptide), 10 mM ATP (Sigma), Labeled p-BAD (S112) mAb (Cell Signalling and Perkin Elmer) [with 0.05% BSA and 2 mM DTT added] streptavidin:Allophycocyanin [Perkin Elmer]. Final concentrations either Pim-1 enzyme [5 pM], or Pim-2 enzyme [0.5 pM], DMSO [1%], BLC BAD (S112) [0.5 μM], ATP [1.5 μM], streptavidin:Allophycocyanin [0.002 mg/mL] and biotinylated-BAD (S112) mAb [100 pM]. Initial incubations were carried out at RT (22° C.) for 30 min for both Pim-1 and for Pim-2. Pim enzyme is added to compound in buffer, and plates are incubated of 30 min. Biotinylated BAD and ATP are added and plates are incubated for 1 h. A mixture of labeled p-BAD (S112) mAb and quench/detection buffer are added and incubated for 2 h. Fluorescence was measured by an HTRF® Envision microplate reader.	BAO_0000357	single protein format	None	CHEMBL2147	Serine/threonine-protein kinase PIM1	Homo sapiens	SINGLE PROTEIN	CHEMBL3886836	BindingDB Database		2016.0	1.0	<rdkit.DataStructs.cDataStructs.ExplicitBitVect object at 0x0000022A723E6570>	G2	<rdkit.Chem.rdchem.Mol object at 0x0000022A72407B50>	G2 active	Train
CHEMBL1915439		386.85	4.99	CN(c1ccccc1Cl)c1nc2c(-c3nnc[nH]3)cccc2c2cnccc12	IC50	'='	nM	21.0	CHEMBL1919015	Inhibition of human recombinant Pim1 using RSRHSSYPAGT as substrate by radiometric assay in the presence of 30 uM [ATP]	BAO_0000357	single protein format	Homo sapiens	CHEMBL2147	Serine/threonine-protein kinase PIM1	Homo sapiens	SINGLE PROTEIN	CHEMBL1914433	Scientific Literature	Bioorg Med Chem Lett	2011.0	1.0	<rdkit.DataStructs.cDataStructs.ExplicitBitVect object at 0x0000022A723E63B0>	G2	<rdkit.Chem.rdchem.Mol object at 0x0000022A72407C30>	G2 active	Train
CHEMBL3684966		545.9	5.29	NC1CCC(Nc2nc3c(Br)c(Br)c(Br)c(Br)c3[nH]2)CC1	IC50	'='	nM	15.07	CHEMBL3705636	Luminometric Kinase Assay: Kinase assay was performed using luminescent Kinase-Glo (Promega) system. The Kinase-Glo Luminescent Kinase Assay Platform provides a homogeneous, high-throughput screening method for measuring kinase activity by quantifying the amount of ATP remaining in solution following a kinase reaction.	BAO_0000357	single protein format	None	CHEMBL2147	Serine/threonine-protein kinase PIM1	Homo sapiens	SINGLE PROTEIN	CHEMBL3638987	BindingDB Database		2013.0	1.0	<rdkit.DataStructs.cDataStructs.ExplicitBitVect object at 0x0000022A723E61F0>	G2	<rdkit.Chem.rdchem.Mol object at 0x0000022A72407D10>	G2 active	Train
CHEMBL4104431		388.42	4.2	O=C1NC(=S)S/C1=C\c1csc(-c2ccc(OC(F)(F)F)cc2)n1	IC50	'='	nM	2.9	CHEMBL4029679	Inhibition of recombinant PIM1 (unknown origin) by pyruvate kinase/lactate dehydrogenase-coupled assay	BAO_0000357	single protein format	Homo sapiens	CHEMBL2147	Serine/threonine-protein kinase PIM1	Homo sapiens	SINGLE PROTEIN	CHEMBL4028814	Scientific Literature	Bioorg Med Chem	2017.0	1.0	<rdkit.DataStructs.cDataStructs.ExplicitBitVect object at 0x0000022A723E6180>	G2	<rdkit.Chem.rdchem.Mol object at 0x0000022A72407D80>	G2 active	Train
CHEMBL3968565		351.44	4.19	CCOc1cccc(-c2c[nH]c3ccc(-c4nnc(NC)s4)cc23)n1	IC50	'='	nM	30.91	CHEMBL3888377	Enzyme Assay: The assay for the determination of Pim activity is based on the formation of phosphorylated biotinylated-BAD peptide at the Serine 112 residue (S112) and employs HTRF® (homogeneous time resolved fluorescence) technology to detect the product in a 96-well plate format. The phosphorylation of biotinylated-BAD (S112) peptide by full length recombinant Pim-1, Pim-2, or Pim-3 protein was detected with streptavidin:Allophycocyanin (APC) conjugate and a europium (Eu) labeled antibody directed against phosphorylated-BAD (S112). Excitation of Eu by a high energy laser light (337 nm) leads to a transfer of energy to the APC molecule, and results in an emission at 665 nm. The fluorescence is directly proportional to the amount of phosphorylated BAD peptide present in the reaction.Compounds were prepared in DMSO by conducting 3-fold serial dilutions to give a 10-point dosing curve having a high dose of 1 uM. A reference compound was included on each assay plate in order to validate that plate; on	BAO_0000357	single protein format	None	CHEMBL2147	Serine/threonine-protein kinase PIM1	Homo sapiens	SINGLE PROTEIN	CHEMBL3886684	BindingDB Database		2016.0	1.0	<rdkit.DataStructs.cDataStructs.ExplicitBitVect object at 0x0000022A723E6110>	G2	<rdkit.Chem.rdchem.Mol object at 0x0000022A72407DF0>	G2 active	Train
CHEMBL516312		339.36	3.75	N#Cc1ccc(-c2cnc3[nH]cc(NC(=O)c4cccnc4)c3c2)cc1	Kd	'='	nM	35.0	CHEMBL986210	Binding affinity to human PIM1	BAO_0000357	single protein format	Homo sapiens	CHEMBL2147	Serine/threonine-protein kinase PIM1	Homo sapiens	SINGLE PROTEIN	CHEMBL1151712	Scientific Literature	J Med Chem	2008.0	1.0	<rdkit.DataStructs.cDataStructs.ExplicitBitVect object at 0x0000022A723E60A0>	G2	<rdkit.Chem.rdchem.Mol object at 0x0000022A72407E60>	G2 active	Train
CHEMBL3103880		327.39	0.88	NCC1CCCN(c2ccncc2NC(=O)c2nccnc2N)C1	Ki	'='	nM	11.0	CHEMBL3106177	Inhibition of PIM1 (unknown origin)	BAO_0000357	single protein format	Homo sapiens	CHEMBL2147	Serine/threonine-protein kinase PIM1	Homo sapiens	SINGLE PROTEIN	CHEMBL3102815	Scientific Literature	ACS Med Chem Lett	2013.0	1.0	<rdkit.DataStructs.cDataStructs.ExplicitBitVect object at 0x0000022A723E5FC0>	G2	<rdkit.Chem.rdchem.Mol object at 0x0000022A72407ED0>	G2 active	Train
CHEMBL4070120		487.79	5.16	O=c1[nH]c(-c2ccc(NCC3CCNCC3)cc2Cl)nc2c1oc1ccc(Br)cc12	IC50	'='	nM	7.0	CHEMBL4044916	Inhibition of human recombinant PIM1 in presence of ATP by ELISA based spectrophotometric analysis	BAO_0000357	single protein format	Homo sapiens	CHEMBL2147	Serine/threonine-protein kinase PIM1	Homo sapiens	SINGLE PROTEIN	CHEMBL4043135	Scientific Literature	Bioorg Med Chem	2017.0	1.0	<rdkit.DataStructs.cDataStructs.ExplicitBitVect object at 0x0000022A723E5EE0>	G2	<rdkit.Chem.rdchem.Mol object at 0x0000022A72405380>	G2 active	Train
