Compound_ID	Molecule Name	Molecular Weight	AlogP	Smiles	Standard Type	Standard Relation	Standard Units	Standard Value	Assay ChEMBL ID	Assay Description	BAO Format ID	BAO Label	Assay Organism	Target ChEMBL ID	Target Name	Target Organism	Target Type	Document ChEMBL ID	Source Description	Document Journal	Document Year	Active	bits	Group
CHEMBL2105728	CRENOLANIB	443.55	3.92	CC1(COc2ccc3c(c2)ncn3-c2ccc3cccc(N4CCC(N)CC4)c3n2)COC1	IC50	'='	nM	35.0	CHEMBL4360639	Inhibition of FLT3 ITD/D835H double mutant (unknown origin)	BAO_0000357	single protein format	Homo sapiens	CHEMBL1974	Tyrosine-protein kinase receptor FLT3	Homo sapiens	SINGLE PROTEIN	CHEMBL4359824	Scientific Literature	Eur J Med Chem	2019.0	1.0	<rdkit.DataStructs.cDataStructs.ExplicitBitVect object at 0x0000016BDB2959A0>	G1
CHEMBL388978	STAUROSPORINE	466.54	4.35	CN[C@@H]1C[C@H]2O[C@@](C)([C@@H]1OC)n1c3ccccc3c3c4c(c5c6ccccc6n2c5c31)C(=O)NC4	IC50	'='	nM	1.15	CHEMBL4145872	Inhibition of FLT3 (unknown origin)	BAO_0000357	single protein format	Homo sapiens	CHEMBL1974	Tyrosine-protein kinase receptor FLT3	Homo sapiens	SINGLE PROTEIN	CHEMBL4145442	Scientific Literature	Eur J Med Chem	2017.0	1.0	<rdkit.DataStructs.cDataStructs.ExplicitBitVect object at 0x0000016BDB295A10>	G1
CHEMBL1952136		416.45	4.03	FC(F)(F)c1cccc(-n2nnc3ccc(NCC4CC5(CCNCC5)C4)nc32)c1	IC50	'='	nM	28.0	CHEMBL1954565	Inhibition of FLT3	BAO_0000357	single protein format	None	CHEMBL1974	Tyrosine-protein kinase receptor FLT3	Homo sapiens	SINGLE PROTEIN	CHEMBL1949661	Scientific Literature	Bioorg Med Chem Lett	2012.0	1.0	<rdkit.DataStructs.cDataStructs.ExplicitBitVect object at 0x0000016BDB295A80>	G1
CHEMBL3923418		445.52	3.79	COc1ccc(-c2nc(C(N)=O)c(-c3ccc(N4CCNC(C)(C)C4)cc3)o2)c2cc[nH]c12	IC50	'='	nM	0.89	CHEMBL3887269	Inhibition Assay: Kinase assays were performed at Reaction Biology Corp., Malvern, Pa., USA, using the following general procedure:1) Prepare indicated substrate in freshly prepared Base Reaction Buffer (20 mM Hepes pH 7.5, 10 mM MgCl2, 1 mM EGTA, 0.02% Brij35, 0.02 mg/ml BSA, 0.1 mM Na3VO4, 2 mM DTT, 1% DMSO).2) Deliver cofactors (1.5 mM CaCl2, 16 ug/mL Calmodulin, 2 mM MnCl2) to the substrate solution above.3) Deliver indicated kinase into the substrate solution and gently mix4) Deliver varying concentrations of test compound in DMSO into the kinase reaction mixture.5) Deliver 33P-ATP (specific activity 0.01 uCi/uL final) into the reaction mixture to initiate the reaction.6) Incubate kinase reaction for 120 min at room temperature.7) Reactions are spotted onto P81 ion exchange filter paper (Whatman #3698-915)8) Unbound phosphate is removed by washing filters extensively in 0.75% phosphoric acid.9) 33P signal was determined using Typhoon phosphorimagers (GE Healthcare).	BAO_0000357	single protein format	Homo sapiens	CHEMBL1974	Tyrosine-protein kinase receptor FLT3	Homo sapiens	SINGLE PROTEIN	CHEMBL3886247	BindingDB Database		2015.0	1.0	<rdkit.DataStructs.cDataStructs.ExplicitBitVect object at 0x0000016BDB295AF0>	G1
CHEMBL1915640		430.44	4.48	COCCOc1ccc(Nc2nc3c(-c4nnc[nH]4)cccc3c3cnccc23)c(F)c1	IC50	'='	nM	44.0	CHEMBL1919426	Inhibition of FLT3 using EAIYAAPFAKKK as substrate by radiometric assay in the presence of 200 uM [ATP]	BAO_0000357	single protein format	None	CHEMBL1974	Tyrosine-protein kinase receptor FLT3	Homo sapiens	SINGLE PROTEIN	CHEMBL1914433	Scientific Literature	Bioorg Med Chem Lett	2011.0	1.0	<rdkit.DataStructs.cDataStructs.ExplicitBitVect object at 0x0000016BDB295B60>	G1
CHEMBL3813873	PEXIDARTINIB	417.82	5.23	FC(F)(F)c1ccc(CNc2ccc(Cc3c[nH]c4ncc(Cl)cc34)cn2)cn1	IC50	'='	nM	11.0	CHEMBL4315094	Inhibition of recombinant FLT3 ITD mutant (unknown origin)	BAO_0000357	single protein format	Homo sapiens	CHEMBL1974	Tyrosine-protein kinase receptor FLT3	Homo sapiens	SINGLE PROTEIN	CHEMBL4311995	Scientific Literature	Eur J Med Chem	2019.0	1.0	<rdkit.DataStructs.cDataStructs.ExplicitBitVect object at 0x0000016BDB295CB0>	G1
CHEMBL3932957		459.46	5.12	CSc1nc(N)cc(Oc2ccc(-c3nnc(Nc4cccc(C(F)(F)F)c4)[nH]3)cc2)n1	Kd	'='	nM	52.0	CHEMBL3887930	Competitive Binding Assay (KINOMEscan): For the competitive binding assay, test compounds were screened at 10 uM against 70 diverse kinase targets for competitive binding using the KINOMEscan technology (Ambit Biosciences) (Karaman, et al. (2008) Nature biotechnology 26:127-132). 11-point Kd curves were determined for hits identified during the initial screen.	BAO_0000357	single protein format	Homo sapiens	CHEMBL1974	Tyrosine-protein kinase receptor FLT3	Homo sapiens	SINGLE PROTEIN	CHEMBL3886510	BindingDB Database		2016.0	1.0	<rdkit.DataStructs.cDataStructs.ExplicitBitVect object at 0x0000016BDB295D20>	G1
CHEMBL2032283		566.54	4.63	Nc1ncc(-c2cnn(C3CCNCC3)c2)cc1-c1nc2ccc(O)c(-c3ccccc3)c2o1	IC50	'='	nM	14.0	CHEMBL2034188	Inhibition of recombinant FLT3 by time resolved-fluorescence resonance energy transfer analysis	BAO_0000357	single protein format	None	CHEMBL1974	Tyrosine-protein kinase receptor FLT3	Homo sapiens	SINGLE PROTEIN	CHEMBL2029247	Scientific Literature	Bioorg Med Chem Lett	2012.0	1.0	<rdkit.DataStructs.cDataStructs.ExplicitBitVect object at 0x0000016BDB295E70>	G1
CHEMBL273198		354.41	4.33	CCc1ccc(-c2c(-c3cnc(C)[nH]3)c(=O)[nH]c3ccc(C#N)cc23)cc1	IC50	'='	nM	47.0	CHEMBL951199	Inhibition of FLT3	BAO_0000357	single protein format	None	CHEMBL1974	Tyrosine-protein kinase receptor FLT3	Homo sapiens	SINGLE PROTEIN	CHEMBL1141632	Scientific Literature	Bioorg Med Chem Lett	2008.0	1.0	<rdkit.DataStructs.cDataStructs.ExplicitBitVect object at 0x0000016BDB295F50>	G1
CHEMBL1079354		379.42	4.26	CC(C)(C)c1cc(NC(=O)Nc2ccc(C(=O)Nc3ccccn3)cc2)no1	Kd	'='	nM	8.15	CHEMBL1112284	Binding affinity to FLT3	BAO_0000357	single protein format	None	CHEMBL1974	Tyrosine-protein kinase receptor FLT3	Homo sapiens	SINGLE PROTEIN	CHEMBL1154202	Scientific Literature	Bioorg Med Chem Lett	2009.0	1.0	<rdkit.DataStructs.cDataStructs.ExplicitBitVect object at 0x0000016BDB295FC0>	G1
CHEMBL1172838		470.53	6.97	O=C(Nc1ccc(-c2ccc3ccccc3c2)cc1)Nc1ccc2c(c1)NC(=O)/C2=C\c1ccc[nH]1	IC50	'='	nM	1.5	CHEMBL1176709	Inhibition of FLT3	BAO_0000357	single protein format	None	CHEMBL1974	Tyrosine-protein kinase receptor FLT3	Homo sapiens	SINGLE PROTEIN	CHEMBL1177651	Scientific Literature	Bioorg Med Chem	2010.0	1.0	<rdkit.DataStructs.cDataStructs.ExplicitBitVect object at 0x0000016BDB296030>	G1
CHEMBL4578114		364.48	3.51	CN1CCN(c2ccc(Nc3cc(-c4cc(C#N)cs4)n[nH]3)cc2)CC1	IC50	'='	nM	30.12	CHEMBL4353138	Inhibition of human FLT3 ITD mutant using EAIYAAPFAKKK peptide as substrate in presence of 33P-gamma ATP by hotspot kinase assay	BAO_0000357	single protein format	Homo sapiens	CHEMBL1974	Tyrosine-protein kinase receptor FLT3	Homo sapiens	SINGLE PROTEIN	CHEMBL4350983	Scientific Literature	Eur J Med Chem	2019.0	1.0	<rdkit.DataStructs.cDataStructs.ExplicitBitVect object at 0x0000016BDB2960A0>	G1
CHEMBL522892	DOVITINIB	392.44	2.54	CN1CCN(c2ccc3nc(-c4c(N)c5c(F)cccc5[nH]c4=O)[nH]c3c2)CC1	IC50	'='	nM	3.0	CHEMBL1009187	Inhibition of FLT3	BAO_0000357	single protein format	None	CHEMBL1974	Tyrosine-protein kinase receptor FLT3	Homo sapiens	SINGLE PROTEIN	CHEMBL1139379	Scientific Literature	J Med Chem	2009.0	1.0	<rdkit.DataStructs.cDataStructs.ExplicitBitVect object at 0x0000016BDB296110>	G1
CHEMBL2046699		305.38	3.25	COc1cc2ncnc(Sc3nccs3)c2cc1OC	IC50	'='	nM	7.0	CHEMBL3816779	Inhibition of human FLT3 using EAIYAAPFAKKK as substrate after 40 mins by scintillation counting method in presence of [gamma-33P-ATP]	BAO_0000357	single protein format	Homo sapiens	CHEMBL1974	Tyrosine-protein kinase receptor FLT3	Homo sapiens	SINGLE PROTEIN	CHEMBL3813654	Scientific Literature	J Med Chem	2016.0	1.0	<rdkit.DataStructs.cDataStructs.ExplicitBitVect object at 0x0000016BDB296180>	G1
CHEMBL4453941		262.32	3.43	CC(C)(C#N)c1cccc(-c2ccnc3[nH]ccc23)n1	Ki	'='	nM	100.0	CHEMBL4399591	Inhibition of FLT3 (unknown origin) using polyE4Y peptide as substrate incubated for 60 mins in presence of [33P] gammaATP by microbeta liquid scintillation counter	BAO_0000357	single protein format	Homo sapiens	CHEMBL1974	Tyrosine-protein kinase receptor FLT3	Homo sapiens	SINGLE PROTEIN	CHEMBL4396928	Scientific Literature	ACS Med Chem Lett	2019.0	1.0	<rdkit.DataStructs.cDataStructs.ExplicitBitVect object at 0x0000016BDB2961F0>	G1
CHEMBL4863351		380.48	2.59	CN(C)CCn1cc(-c2ccn3c(-c4ccc(C(N)=O)s4)cnc3c2)cn1	IC50	'='	nM	2.4	CHEMBL4831021	Inhibition of FLT3 (unknown origin) using 5' FAM-EPLYWSFPA peptide as a substrate in the presence of ATP incubated for 60 mins by microfluidics assay	BAO_0000357	single protein format	Homo sapiens	CHEMBL1974	Tyrosine-protein kinase receptor FLT3	Homo sapiens	SINGLE PROTEIN	CHEMBL4828756	Scientific Literature	Eur J Med Chem	2021.0	1.0	<rdkit.DataStructs.cDataStructs.ExplicitBitVect object at 0x0000016BDB2962D0>	G1
CHEMBL210601		346.41	2.61	COc1ccc(C(=O)Nc2sc3c(c2C(N)=O)CCC3)cc1OC	IC50	'='	nM	27.0	CHEMBL868169	Inhibition of FLT3	BAO_0000357	single protein format	Homo sapiens	CHEMBL1974	Tyrosine-protein kinase receptor FLT3	Homo sapiens	SINGLE PROTEIN	CHEMBL1147807	Scientific Literature	Bioorg Med Chem Lett	2006.0	1.0	<rdkit.DataStructs.cDataStructs.ExplicitBitVect object at 0x0000016BDB296340>	G1
CHEMBL4225923		459.58	4.5	Cc1cn2c(-c3cn[nH]c3)cnc2c(Nc2cc(C(NC(C)(C)C)c3ccccn3)ns2)n1	IC50	'='	nM	5.0	CHEMBL4222448	Inhibition of FLT3 (unknown origin)	BAO_0000357	single protein format	Homo sapiens	CHEMBL1974	Tyrosine-protein kinase receptor FLT3	Homo sapiens	SINGLE PROTEIN	CHEMBL4219148	Scientific Literature	Bioorg Med Chem Lett	2018.0	1.0	<rdkit.DataStructs.cDataStructs.ExplicitBitVect object at 0x0000016BDB2963B0>	G1
CHEMBL511337		296.31	3.06	NC(=O)c1ccc(Nc2cc(-c3ccc(F)cc3)[nH]n2)cc1	Kd	'='	nM	30.0	CHEMBL988958	Binding affinity to human FLT3	BAO_0000357	single protein format	Homo sapiens	CHEMBL1974	Tyrosine-protein kinase receptor FLT3	Homo sapiens	SINGLE PROTEIN	CHEMBL1151712	Scientific Literature	J Med Chem	2008.0	1.0	<rdkit.DataStructs.cDataStructs.ExplicitBitVect object at 0x0000016BDB296420>	G1
CHEMBL1945170		438.0	5.33	CN(C)CCCc1cccc(Nc2ncc3c(n2)-c2ccc(Cl)cc2NC(=S)C3)c1	IC50	'='	nM	28.0	CHEMBL1948347	Inhibition of FLT3	BAO_0000357	single protein format	None	CHEMBL1974	Tyrosine-protein kinase receptor FLT3	Homo sapiens	SINGLE PROTEIN	CHEMBL1944579	Scientific Literature	J Med Chem	2012.0	1.0	<rdkit.DataStructs.cDataStructs.ExplicitBitVect object at 0x0000016BDB296490>	G1
CHEMBL238222		426.48	1.72	CO/N=C/c1c(N)ncnc1N1CCN(C(=O)Nc2ccc(OC3CCC3)nc2)CC1	IC50	'='	nM	75.0	CHEMBL897762	Inhibition of human FLT3	BAO_0000357	single protein format	Homo sapiens	CHEMBL1974	Tyrosine-protein kinase receptor FLT3	Homo sapiens	SINGLE PROTEIN	CHEMBL1149650	Scientific Literature	Bioorg Med Chem Lett	2007.0	1.0	<rdkit.DataStructs.cDataStructs.ExplicitBitVect object at 0x0000016BDB296500>	G1
CHEMBL223478		486.58	4.48	Cc1cccc(NC(=O)Nc2ccc(-c3ccc(OCCN4CCOCC4)c4[nH]nc(N)c34)cc2)c1	IC50	'='	nM	24.0	CHEMBL920440	Inhibition of FLT3 by HTRF assay	BAO_0000357	single protein format	Homo sapiens	CHEMBL1974	Tyrosine-protein kinase receptor FLT3	Homo sapiens	SINGLE PROTEIN	CHEMBL1142982	Scientific Literature	J Med Chem	2007.0	1.0	<rdkit.DataStructs.cDataStructs.ExplicitBitVect object at 0x0000016BDB296570>	G1
CHEMBL3262624		390.45	2.68	N[C@H]1COCC[C@H]1Nc1cc2cc[nH]c(=O)c2c(Nc2cccc3cc[nH]c23)n1	IC50	'='	nM	20.0	CHEMBL3268722	Inhibition of Flt3 (unknown origin)	BAO_0000357	single protein format	Homo sapiens	CHEMBL1974	Tyrosine-protein kinase receptor FLT3	Homo sapiens	SINGLE PROTEIN	CHEMBL3259804	Scientific Literature	Bioorg Med Chem Lett	2014.0	1.0	<rdkit.DataStructs.cDataStructs.ExplicitBitVect object at 0x0000016BDB296650>	G1
CHEMBL3687212		564.78	3.51	CCc1nc(C(N)=O)c(Nc2ccc(N3CCC(N4CCN(C)CC4)CC3)c(C)c2)nc1N[C@H]1CC[C@](C)(O)CC1	IC50	'='	nM	0.37	CHEMBL3706339	Inhibition Assay: A partial protein of only a kinase domain of FLT3 protein was purchased from Carna Biosciences Inc., Japan, and tests were conducted as in Test Example 5. Test Example 5: A partial protein of only a kinase domain of RET protein was purchased from Carna Biosciences Inc., Japan. The phosphorylation activity toward a peptide substrate was investigated using an EZ reader (Caliper). Test compounds were each mixed with a protein solution to give 8 final concentrations from 100 nM to 0.03 nM, followed by addition of a mixed liquid of ATP and substrate peptide (Caliper) and reaction for 30 minutes. The ATP concentration used was 100 ÂµM. A reaction liquid which contained protein but no test compound (in which the solvent DMSO alone was added at 0.8% in place of the test compound) was prepared, followed by reaction in the same manner with or without ATP addition.	BAO_0000357	single protein format	Homo sapiens	CHEMBL1974	Tyrosine-protein kinase receptor FLT3	Homo sapiens	SINGLE PROTEIN	CHEMBL3639105	BindingDB Database		2015.0	1.0	<rdkit.DataStructs.cDataStructs.ExplicitBitVect object at 0x0000016BDB2966C0>	G1
CHEMBL3656369		413.53	4.09	N[C@H]1CC[C@H](Nc2nccn3c(-c4cccc(NCc5ccccc5)n4)cnc23)CC1	IC50	'='	nM	6.0	CHEMBL3705075	Kinase Assay: FLT3 kinase assay was obtained from Claiper Life Sciences (Catalog #200-0423). The assay was carried out with human recombinant FLT3 (0.287 nM), fluoresce in labeled peptide substrate (with a peptide sequence of EAIYAAPFAKKK, 1.5 μM) and test compounds (in serial dilution) using 384-well plates, quantified by Caliper technology. Kinase reaction was performed in 100 mM HEPES, pH 7.5, 4% DMSO, 0.003% Brij-35, 0.004% tween, 10 mM MgCl2, and 100 μM ATP (for IC50 determination), incubated at 28° C. for 90 minutes. After incubation, the reaction product was analyzed by electrophoretic mobility shift run on Caliper by manufacturer's protocol.	BAO_0000357	single protein format	Homo sapiens	CHEMBL1974	Tyrosine-protein kinase receptor FLT3	Homo sapiens	SINGLE PROTEIN	CHEMBL3639206	BindingDB Database		2014.0	1.0	<rdkit.DataStructs.cDataStructs.ExplicitBitVect object at 0x0000016BDB296730>	G1
CHEMBL2207514		412.89	2.63	Cc1cc(CN2CCN(c3c(Cl)cnc4[nH]c(-c5cnn(C)c5)nc34)CC2)no1	Kd	'='	nM	12.0	CHEMBL2214092	Binding affinity to FLT3	BAO_0000357	single protein format	None	CHEMBL1974	Tyrosine-protein kinase receptor FLT3	Homo sapiens	SINGLE PROTEIN	CHEMBL2203264	Scientific Literature	J Med Chem	2012.0	1.0	<rdkit.DataStructs.cDataStructs.ExplicitBitVect object at 0x0000016BDB2967A0>	G1
CHEMBL4746916		592.58	5.49	O=C(Nc1ccc(Oc2cc(NC(=O)C3CC3)ncn2)cc1)Nc1ccc(CN2CCn3ccnc3C2)c(C(F)(F)F)c1	IC50	'='	nM	3.162	CHEMBL4739200	Inhibition of His6/TEV fused-GST-tagged Flt3 (unknown origin) (H564 to S993 residues) using Axltide (CKKSRGDYMTMQJ-acid) peptide as substrate preincubated for 30 mins followed by substrate and ATP addition at Km concentration measured after 75 mins by RapidFire LC-MS analysis	BAO_0000357	single protein format	Homo sapiens	CHEMBL1974	Tyrosine-protein kinase receptor FLT3	Homo sapiens	SINGLE PROTEIN	CHEMBL4732252	Scientific Literature	J Med Chem	2021.0	1.0	<rdkit.DataStructs.cDataStructs.ExplicitBitVect object at 0x0000016BDB296810>	G1
CHEMBL4876697		427.51	3.44	CC(=O)N1CCN(c2ccc(Nc3nccc(-c4cn(C)c5ncccc45)n3)cc2)CC1	Ki	'='	nM	9.0	CHEMBL4815226	Inhibition of wild type FLT3 (unknown origin) using Glu/Tyr peptide substrate incubated for 120 mins measured after 40 mins incubation under dark by ADP-glo based luminescence assay	BAO_0000357	single protein format	Homo sapiens	CHEMBL1974	Tyrosine-protein kinase receptor FLT3	Homo sapiens	SINGLE PROTEIN	CHEMBL4813946	Scientific Literature	Eur J Med Chem	2021.0	1.0	<rdkit.DataStructs.cDataStructs.ExplicitBitVect object at 0x0000016BDB296880>	G1
CHEMBL1765097		374.44	3.68	O=C(Nc1cc(-c2ccncc2)c[nH]c1=O)c1ccc(N2CCCCC2)cc1	Ki	'='	nM	32.0	CHEMBL1768450	Inhibition of Flt3 after 20 mins by radiometric phosphate incorporation assay	BAO_0000357	single protein format	None	CHEMBL1974	Tyrosine-protein kinase receptor FLT3	Homo sapiens	SINGLE PROTEIN	CHEMBL1765075	Scientific Literature	J Med Chem	2011.0	1.0	<rdkit.DataStructs.cDataStructs.ExplicitBitVect object at 0x0000016BDB2968F0>	G1
CHEMBL4453966		394.95	5.55	CC(C)c1ccc(/C=C/c2nc(NCCN(C)C)c3cc(Cl)ccc3n2)cc1	IC50	'='	nM	80.0	CHEMBL4315098	Inhibition of FLT3 D835Y (unknown origin) using TAMRA-Src-tide as substrate measured after 1 hr in presence of ATP at its Km concentration by IMAP-FP assay	BAO_0000357	single protein format	Homo sapiens	CHEMBL1974	Tyrosine-protein kinase receptor FLT3	Homo sapiens	SINGLE PROTEIN	CHEMBL4311995	Scientific Literature	Eur J Med Chem	2019.0	1.0	<rdkit.DataStructs.cDataStructs.ExplicitBitVect object at 0x0000016BDB296960>	G1
CHEMBL407485		225.25	2.66	Nc1ccc(-c2cccc3onc(N)c23)cc1	IC50	'='	nM	68.0	CHEMBL949291	Inhibition of FLT3 by HTRF assay	BAO_0000357	single protein format	None	CHEMBL1974	Tyrosine-protein kinase receptor FLT3	Homo sapiens	SINGLE PROTEIN	CHEMBL1142358	Scientific Literature	J Med Chem	2008.0	1.0	<rdkit.DataStructs.cDataStructs.ExplicitBitVect object at 0x0000016BDB296A40>	G1
CHEMBL3684979		413.53	4.52	C[C@H]1CC[C@H](n2c3cnccc3c3cnc(Nc4cc5c(cn4)CCNC5)nc32)CC1	IC50	'='	nM	73.7	CHEMBL3705970	Kinase Assay: The FLT3 inhibitory activity of the CDK4/6-FLT3 inhibitors was determined with a HTRF kinase assay. The FLT3 enzyme (GST-FLT3 fusion) was purchased from Carna Biosciences. An ULight-labeled synthetic peptide derived from human Janus kinase 1 (aa1015-1027, ULight-JAK1, PerkinElmer) was utilized as the phosphoacceptor substrate. The assay was conducted in a 384-well white OptiPlate (PerkinElmer). The 20 μL reaction mixture contained 50 nM ULight-JAK1, 116 μM ATP, 0.0385 ng/μL FLT3 and dilutions of test compounds in the kinase buffer (50 mM Hepes, pH 7.6, 1 mM EGTA, 10 mM MgCl2, 2 mM DTT, and 0.005% Tween 20). The reaction was allowed to proceed for 1 hour at room temperature and was stopped by adding 20 μL of 10 mM EDTA, 2 nM LANCE Eu-W1024 anti-phospho-tyrosine antibody in LANCE detection buffer (PerkinElmer). The plates were incubated at room temperature for 2 hours after addition of detection reagents and then read on an Envision multimode reader (PerkinElmer).	BAO_0000357	single protein format	Homo sapiens	CHEMBL1974	Tyrosine-protein kinase receptor FLT3	Homo sapiens	SINGLE PROTEIN	CHEMBL3639325	BindingDB Database		2014.0	1.0	<rdkit.DataStructs.cDataStructs.ExplicitBitVect object at 0x0000016BDB296AB0>	G1
CHEMBL3290618		424.53	4.79	CC1=CC(=O)N(Nc2nc(-c3cccs3)nc3scc(-c4cccs4)c23)C1=O	IC50	'='	nM	69.0	CHEMBL3361927	Inhibition of human FLT3 using 10 uM ATP	BAO_0000357	single protein format	Homo sapiens	CHEMBL1974	Tyrosine-protein kinase receptor FLT3	Homo sapiens	SINGLE PROTEIN	CHEMBL3352273	Scientific Literature	Eur J Med Chem	2014.0	1.0	<rdkit.DataStructs.cDataStructs.ExplicitBitVect object at 0x0000016BDB296B20>	G1
CHEMBL1080902		324.34	2.01	COc1ccc(C2=NNC(=O)/C2=N\Nc2cccc(OC)c2)cc1	Ki	'='	nM	66.0	CHEMBL1102104	Inhibition of FLT3	BAO_0000357	single protein format	None	CHEMBL1974	Tyrosine-protein kinase receptor FLT3	Homo sapiens	SINGLE PROTEIN	CHEMBL1154953	Scientific Literature	Bioorg Med Chem Lett	2010.0	1.0	<rdkit.DataStructs.cDataStructs.ExplicitBitVect object at 0x0000016BDB296C00>	G1
CHEMBL1822792	MK-2461	495.56	2.15	CN(C[C@@H]1COCCO1)S(=O)(=O)Nc1ccc2ccc3ncc(-c4cnn(C)c4)cc3c(=O)c2c1	IC50	'='	nM	22.0	CHEMBL1804192	Inhibition of human Flt3	BAO_0000357	single protein format	Homo sapiens	CHEMBL1974	Tyrosine-protein kinase receptor FLT3	Homo sapiens	SINGLE PROTEIN	CHEMBL1800066	Scientific Literature	J Med Chem	2011.0	1.0	<rdkit.DataStructs.cDataStructs.ExplicitBitVect object at 0x0000016BDB296CE0>	G1
CHEMBL1258830		450.53	5.98	CCN(CC)CCCOc1ccccc2c(/C=C3\C(=O)Nc4ccc(F)c(F)c43)cc(C)c1-2	IC50	'='	nM	14.0	CHEMBL1261358	Inhibition of FLT3 by time resolved fluorescence method	BAO_0000357	single protein format	None	CHEMBL1974	Tyrosine-protein kinase receptor FLT3	Homo sapiens	SINGLE PROTEIN	CHEMBL1255211	Scientific Literature	Bioorg Med Chem Lett	2010.0	1.0	<rdkit.DataStructs.cDataStructs.ExplicitBitVect object at 0x0000016BDB296D50>	G1
CHEMBL369303		322.28	4.33	O=Nc1c(-c2c(O)[nH]c3ccc([N+](=O)[O-])cc23)[nH]c2ccccc12	IC50	'='	nM	62.0	CHEMBL1106056	Inhibition of FLT3 by HTRF assay	BAO_0000357	single protein format	None	CHEMBL1974	Tyrosine-protein kinase receptor FLT3	Homo sapiens	SINGLE PROTEIN	CHEMBL1155384	Scientific Literature	Bioorg Med Chem Lett	2010.0	1.0	<rdkit.DataStructs.cDataStructs.ExplicitBitVect object at 0x0000016BDB296DC0>	G1
CHEMBL4434704		466.55	3.88	COc1ccc2c(c1)C(=Cc1ccc3c(-c4ccc(N5CCN(C)CC5)nc4)n[nH]c3c1)C(=O)N2	IC50	'='	nM	28.0	CHEMBL4430365	Inhibition of FLT3 (unknown origin)	BAO_0000357	single protein format	Homo sapiens	CHEMBL1974	Tyrosine-protein kinase receptor FLT3	Homo sapiens	SINGLE PROTEIN	CHEMBL4428091	Scientific Literature	Bioorg Med Chem Lett	2016.0	1.0	<rdkit.DataStructs.cDataStructs.ExplicitBitVect object at 0x0000016BDB296E30>	G1
CHEMBL4211949		423.48	4.17	C=CC(=O)N[C@@H]1Cn2c(c(-c3ccc(Oc4ccccc4)cc3)c3c(N)ncnc32)C1=C	IC50	'='	nM	55.0	CHEMBL4189698	Inhibition of recombinant human FLT3 using Poly(Glu, Tyr) 4:1 as substrate after 1 hr by ELISA	BAO_0000357	single protein format	Homo sapiens	CHEMBL1974	Tyrosine-protein kinase receptor FLT3	Homo sapiens	SINGLE PROTEIN	CHEMBL4184325	Scientific Literature	J Med Chem	2018.0	1.0	<rdkit.DataStructs.cDataStructs.ExplicitBitVect object at 0x0000016BDB296EA0>	G1
CHEMBL4212531	PF-06273340	479.93	2.6	CC(C)(CO)n1cc(C(=O)c2cncc(NC(=O)Cc3ccc(Cl)cn3)c2)c2cnc(N)nc21	IC50	'='	nM	53.0	CHEMBL4681430	Inhibition of FLT3 (unknown origin)	BAO_0000357	single protein format	Homo sapiens	CHEMBL1974	Tyrosine-protein kinase receptor FLT3	Homo sapiens	SINGLE PROTEIN	CHEMBL4680090	Scientific Literature	J Med Chem	2016.0	1.0	<rdkit.DataStructs.cDataStructs.ExplicitBitVect object at 0x0000016BDB296F10>	G1
CHEMBL4571241		542.57	5.55	CCc1ccc2c(c1)c(=O)c(C(=O)Nc1ccc(Oc3ncnc4cc(OC)c(OC)cc34)c(F)c1)c(C)n2C	Kd	'='	nM	4.0	CHEMBL4426903	Binding affinity to human FLT3	BAO_0000357	single protein format	Homo sapiens	CHEMBL1974	Tyrosine-protein kinase receptor FLT3	Homo sapiens	SINGLE PROTEIN	CHEMBL4425136	Scientific Literature	J Med Chem	2016.0	1.0	<rdkit.DataStructs.cDataStructs.ExplicitBitVect object at 0x0000016BDB296F80>	G1
CHEMBL1835871		419.53	3.35	Nc1nc(Nc2ccc([C@H]3CC[C@@H](N4CCOCC4)CC3)cc2)nn1-c1ccccn1	Ki	'='	nM	5.0	CHEMBL1840408	Displacement of [33P]ATP from human recombinant FLT3 domain after 20 mins by scintillation counting	BAO_0000357	single protein format	Homo sapiens	CHEMBL1974	Tyrosine-protein kinase receptor FLT3	Homo sapiens	SINGLE PROTEIN	CHEMBL1833953	Scientific Literature	J Med Chem	2011.0	1.0	<rdkit.DataStructs.cDataStructs.ExplicitBitVect object at 0x0000016BDB296FF0>	G1
CHEMBL4846521		546.61	3.24	Cc1cc(Nc2cc(C)[nH]n2)nc(N2CCC3(CC2)OCCN([C@@H](C)c2ccc(-n4cc(F)cn4)nc2)C3=O)n1	IC50	'='	nM	30.8	CHEMBL4836466	Inhibition of FLT3 (unknown origin)	BAO_0000357	single protein format	Homo sapiens	CHEMBL1974	Tyrosine-protein kinase receptor FLT3	Homo sapiens	SINGLE PROTEIN	CHEMBL4834457	Scientific Literature	Bioorg Med Chem Lett	2021.0	1.0	<rdkit.DataStructs.cDataStructs.ExplicitBitVect object at 0x0000016BDB297060>	G1
CHEMBL5075546		466.59	2.15	COc1cc(N(C)CCN(C)C)ccc1NC(=O)c1cnn2ccc(N[C@@H]3CCCNC3)nc12	IC50	'='	nM	37.5	CHEMBL5054520	Inhibition of FLT3-ITD mutant (unknown origin) using Poly (Glu,Tyr) 4:1 as substrate incubated for 1 hr in presence of ATP by ELISA	BAO_0000357	single protein format	Homo sapiens	CHEMBL1974	Tyrosine-protein kinase receptor FLT3	Homo sapiens	SINGLE PROTEIN	CHEMBL5053519	Scientific Literature	Bioorg Med Chem	2021.0	1.0	<rdkit.DataStructs.cDataStructs.ExplicitBitVect object at 0x0000016BDB2970D0>	G1
CHEMBL4291202		477.65	5.01	CCC[C@H](C)Nc1ncc2c(-c3ccc(CN4CCOCC4)cc3)cn([C@H]3CC[C@H](O)CC3)c2n1	IC50	'='	nM	61.0	CHEMBL4276335	Inhibition of FLT3 (unknown origin) using 5'-FAM-KKKKEEIYFFF-CONH2 as substrate after 180 mins by MCE assay	BAO_0000357	single protein format	Homo sapiens	CHEMBL1974	Tyrosine-protein kinase receptor FLT3	Homo sapiens	SINGLE PROTEIN	CHEMBL4270664	Scientific Literature	J Med Chem	2018.0	1.0	<rdkit.DataStructs.cDataStructs.ExplicitBitVect object at 0x0000016BDB297140>	G1
CHEMBL3612510		459.49	1.44	Cc1ccc([N+](=O)[O-])cc1S(=O)(=O)N(C)/N=C/c1cnn2ccc(N3CCOCC3)nc12	IC50	'='	nM	15.1	CHEMBL3615646	Inhibition of FLT3 (unknown origin) using biotin-Glu-Gly-Pro-Trp-Leu-Glu-Glu-Glu-Glu-Glu-Ala-Tyr-Gly-Trp-Met-Asp-Phe-NH2 as substrate after 90 mins by luminescence assay	BAO_0000357	single protein format	Homo sapiens	CHEMBL1974	Tyrosine-protein kinase receptor FLT3	Homo sapiens	SINGLE PROTEIN	CHEMBL3612060	Scientific Literature	Bioorg Med Chem	2015.0	1.0	<rdkit.DataStructs.cDataStructs.ExplicitBitVect object at 0x0000016BDB2971B0>	G1
CHEMBL4163881		472.64	3.67	COc1ccc(Nc2nccc(-c3sc(SCCN4CCNCC4)nc3C)n2)c(OC)c1	Ki	'='	nM	100.0	CHEMBL4133273	Inhibition of recombinant human FLT3 using EAIYAAPFAKKK as substrate by ATP-Glo assay	BAO_0000357	single protein format	Homo sapiens	CHEMBL1974	Tyrosine-protein kinase receptor FLT3	Homo sapiens	SINGLE PROTEIN	CHEMBL4130417	Scientific Literature	Eur J Med Chem	2017.0	1.0	<rdkit.DataStructs.cDataStructs.ExplicitBitVect object at 0x0000016BDB297220>	G1
CHEMBL223147		348.45	4.0	CCN1C(=O)C(C)(C)c2cc3[nH]c4c(c3cc21)CCCc1c(C)n[nH]c1-4	IC50	'='	nM	2.0	CHEMBL970787	Inhibition of Flt3	BAO_0000357	single protein format	None	CHEMBL1974	Tyrosine-protein kinase receptor FLT3	Homo sapiens	SINGLE PROTEIN	CHEMBL1155876	Scientific Literature	J Med Chem	2008.0	1.0	<rdkit.DataStructs.cDataStructs.ExplicitBitVect object at 0x0000016BDB297290>	G1
CHEMBL4861566		414.39	3.51	CC(=O)NC1CCc2c(c(-c3c[nH]nc3C(F)(F)F)nc3ccc4[nH]ncc4c23)C1	IC50	'='	nM	20.0	CHEMBL4836766	Inhibition of human FLT3 ITD mutant using EAIYAAPFAKKK as substrate preincubated for 20 mins followed by 33P-ATP addition and measured after 2 hrs by filter binding method	BAO_0000357	single protein format	Homo sapiens	CHEMBL1974	Tyrosine-protein kinase receptor FLT3	Homo sapiens	SINGLE PROTEIN	CHEMBL4834472	Scientific Literature	J Med Chem	2021.0	1.0	<rdkit.DataStructs.cDataStructs.ExplicitBitVect object at 0x0000016BDB297300>	G1
