Compound_ID	Molecule Name	Molecular Weight	AlogP	Smiles	Standard Type	Standard Relation	Standard Units	Standard Value	Assay ChEMBL ID	Assay Description	BAO Format ID	BAO Label	Assay Organism	Target ChEMBL ID	Target Name	Target Organism	Target Type	Document ChEMBL ID	Source Description	Document Journal	Document Year	Active	bits	Group	ROMol	Set	Set_type
CHEMBL3906165		614.71	5.57	Cc1c(-c2nc(N)nc3[nH]c(-c4ccc(C(=O)N5CCOCC5)cc4)cc23)cccc1N1CCOc2cc(C3CC3)ccc2C1=O	IC50	'='	nM	55.0	CHEMBL3887851	Recombinant Human BTK Inhibition Assay: The inhibition assays were performed using the generic tyrosine kinase assay kit from C is Bio (HTRF KinEASE-TK #62TK0PEB). The assay is based on the principle of fluorescence resonance energy transfer (FRET) between the Europium Cryptate labeled anti-phosphotyrosine antibody and streptavidin labeled fluorophore, XL-665. In an uninhibited kinase reaction the biotinylated peptide substrate (Tk-Biotin) gets phosphorylated at an intermediate tyrosine site which is captured by anti-phosphotyrosine antibody which eventually acts as a FRET donor. The streptavidin labeled XL-665 binds strongly to the Tk-Biotin substrate and act as a FRET acceptor. The resultant FRET signal is measured at 665 nm. A ratio of this specific fluorescence (665 nm) to the background fluorescence (620 nm), conferred by the free antibody, is directly proportional to the kinase activity. Inhibition of the kinase activity by a pharmacological intervention such as a Btk inhibitor of the present disclosure will result into decreased FRET signal.	BAO_0000357	single protein format	Homo sapiens	CHEMBL5251	Tyrosine-protein kinase BTK	Homo sapiens	SINGLE PROTEIN	CHEMBL3886475	BindingDB Database		2016.0	1.0	<rdkit.DataStructs.cDataStructs.ExplicitBitVect object at 0x000001D3B7F94580>	G2	<rdkit.Chem.rdchem.Mol object at 0x000001D3BA08AAB0>	G2 active	Train
CHEMBL3952977		623.74	5.00	[C-]#[N+]/C(=C/C(C)(C)N1CCN(C)CC1)C(=O)N1CCC[C@H](n2nc(-c3ccc(Oc4ccccc4)cc3F)c3c(N)ncnc32)C1	IC50	'='	nM	0.3	CHEMBL3706082	Caliper-Based Kinase Assay: A Caliper-based kinase assay (Caliper Life Sciences, Hopkinton, Mass.) was used to measure inhibition of Btk kinase activity of a compound of the present disclosure. Serial dilutions of test compounds were incubated with human recombinant Btk (0.5 nM), ATP (16 μM) and a phosphoacceptor peptide substrate FAM-GEEPLYWSFPAKKK-NH2 (1 μM) at room temperature for 3 h. The reaction was then terminated with EDTA, final concentration 20 mM and the phosphorylated reaction product was quantified on a Caliper Desktop Profiler (Caliper LabChip 3000).	BAO_0000357	single protein format	Homo sapiens	CHEMBL5251	Tyrosine-protein kinase BTK	Homo sapiens	SINGLE PROTEIN	CHEMBL3639296	BindingDB Database		2015.0	1.0	<rdkit.DataStructs.cDataStructs.ExplicitBitVect object at 0x000001D3B7F943C0>	G2	<rdkit.Chem.rdchem.Mol object at 0x000001D3BA08B060>	G2 active	Train
CHEMBL3670123		641.81	6.02	CN1CCC(c2ccc(Nc3cc(-c4cc(F)cc(N5CCc6c(sc7c6CC(C)(C)C7)C5=O)c4CO)cn(C)c3=O)nc2)CC1	IC50	'='	nM	2.2	CHEMBL3705848	Biochemical Assay: A generalized procedure for a standard biochemical Btk Kinase Assay that can be used to test Formula I compounds. Alternatively, the Lanthascreen assay can be used to evaluate Btk activity through quantification of its phosphorylated peptide product. The FRET (Fluorescence Resonance Energy Transfer) that occurs between the fluorescein on the peptide product and the terbium on the detection antibody decreases with the addition of inhibitors of Btk that reduce the phosphorylation of the peptide.	BAO_0000357	single protein format	Homo sapiens	CHEMBL5251	Tyrosine-protein kinase BTK	Homo sapiens	SINGLE PROTEIN	CHEMBL3639120	BindingDB Database		2013.0	1.0	<rdkit.DataStructs.cDataStructs.ExplicitBitVect object at 0x000001D3B7F94350>	G2	<rdkit.Chem.rdchem.Mol object at 0x000001D3BA08AA40>	G2 active	Train
CHEMBL3917698		497.6	4.15	CN(C)C/C=C/C(=O)N1CCC(n2nc(-c3ccc(Oc4ccccc4)cc3)c3c(N)ncnc32)CC1	IC50	'='	nM	6.3	CHEMBL3887529	HotSpot kinase assay: IC50s were determined using the in vitro HotSpot kinase assay (purified enzymes, 33P-ATP, an appropriate substrate and 1 μM ATP.). For enzyme inhibition assays, compounds were tested in range of ten concentrations from 10 uM to 0.0005 uM using purified enzymes and the Hotspot kinase assay. Reaction conditions were 1 uM ATP, one hour incubation with inhibitor, and kinase activity detected using 33-ATP phosphorylation of an appropriately selected peptide substrate.	BAO_0000357	single protein format	Homo sapiens	CHEMBL5251	Tyrosine-protein kinase BTK	Homo sapiens	SINGLE PROTEIN	CHEMBL3886356	BindingDB Database		2015.0	1.0	<rdkit.DataStructs.cDataStructs.ExplicitBitVect object at 0x000001D3B7F942E0>	G2	<rdkit.Chem.rdchem.Mol object at 0x000001D3BA08A810>	G2 active	Train
CHEMBL4114740		541.56	5.17	N#C/C(=C\C1CC1)C(=O)N1CCC[C@@H](n2nc(-c3ccc(Oc4cc(F)cc(F)c4)cc3)c3c(N)ncnc32)C1	IC50	'='	nM	2.1	CHEMBL3887135	Enzymatic Activity Assay: A Caliper-based kinase assay (Caliper Life Sciences, Hopkinton, Mass.) was used to measure inhibition of Btk kinase activity of a compound of Formula (IA), (I′) or (I). Serial dilutions of test compounds were incubated with human recombinant Btk (2 nM), ATP (40 μM) and a phosphoacceptor peptide substrate FAM-GEEPLYWSFPAKKK-NH2 (1 μM) at room temperature for 3 h. The reaction was then terminated with EDTA, final concentration 20 mM and the phosphorylated reaction product was quantified on a Caliper Desktop Profiler (Caliper LabChip 3000). Percent inhibition was calculated for each compound dilution and the concentration that produced 50% inhibition was calculated.	BAO_0000357	single protein format	Homo sapiens	CHEMBL5251	Tyrosine-protein kinase BTK	Homo sapiens	SINGLE PROTEIN	CHEMBL3886180	BindingDB Database		2015.0	1.0	<rdkit.DataStructs.cDataStructs.ExplicitBitVect object at 0x000001D3B7F94270>	G2	<rdkit.Chem.rdchem.Mol object at 0x000001D3BA08AB90>	G2 active	Train
CHEMBL3657235		379.42	5.06	Nc1n[nH]c2c(-c3ccccn3)cnc(-c3ccc(Oc4ccccc4)cc3)c12	IC50	'='	nM	1.0	CHEMBL3705416	Enzyme Assay: To V-bottom 384-well plates were added test compounds, human recombinant Btk (1 nM, Invitrogen Corporation), fluoresceinated peptide (1.5 uM), ATP (20 uM), and assay buffer (20 mM HEPES pH 7.4, 10 mM MgCl2, 0.015% Brij35 and 4 mM DTT in 1.6% DMSO), with a final volume of 30 uL. After incubating at room temperature for 60 min, the reaction was terminated by adding 45 ul of 35 mM EDTA to each sample. The reaction mixture was analyzed on the Caliper LABCHIP 3000 (Caliper, Hopkinton, Mass.) by electrophoretic separation of the fluorescent substrate and phosphorylated product. Inhibition data were calculated by comparison to no enzyme control reactions for 100% inhibition and no inhibitor controls for 0% inhibition. Dose response curves were generated to determine the concentration required inhibiting 50% of kinase activity (IC50). Compounds were dissolved at 10 mM in dimethylsulfoxide (DMSO) and evaluated at eleven concentrations.	BAO_0000357	single protein format	Homo sapiens	CHEMBL5251	Tyrosine-protein kinase BTK	Homo sapiens	SINGLE PROTEIN	CHEMBL3638930	BindingDB Database		2014.0	1.0	<rdkit.DataStructs.cDataStructs.ExplicitBitVect object at 0x000001D3B7F94200>	G2	<rdkit.Chem.rdchem.Mol object at 0x000001D3BA08AC00>	G2 active	Train
CHEMBL3785329		536.55	3.53	C=CC(=O)Nc1cccc(-n2c(=O)n(C)c3cnc(Nc4ccc(Oc5ccnc(C(=O)NC)c5)cc4)nc32)c1	IC50	'='	nM	13.0	CHEMBL3789511	Inhibition of BTK (unknown origin)	BAO_0000357	single protein format	Homo sapiens	CHEMBL5251	Tyrosine-protein kinase BTK	Homo sapiens	SINGLE PROTEIN	CHEMBL3784966	Scientific Literature	Bioorg Med Chem Lett	2016.0	1.0	<rdkit.DataStructs.cDataStructs.ExplicitBitVect object at 0x000001D3B7F94190>	G2	<rdkit.Chem.rdchem.Mol object at 0x000001D3BA08AC70>	G2 active	Train
CHEMBL3402355		968.1	9.49	Cc1c(NC(=O)c2ccc(C(C)(C)C)cc2)cccc1-c1cn(C)c(=O)c(Nc2ccc(C(=O)N3CCN(C(=S)Nc4ccc(-c5c6ccc(=O)cc-6oc6cc(O)ccc56)c(C(=O)O)c4)CC3)cc2)n1	IC50	'='	nM	69.0	CHEMBL3407011	Inhibition of biotinylated and activated BTK (unknown origin) using FITC-labeled Srctide peptide substrate and ATP	BAO_0000357	single protein format	Homo sapiens	CHEMBL5251	Tyrosine-protein kinase BTK	Homo sapiens	SINGLE PROTEIN	CHEMBL3400106	Scientific Literature	Bioorg Med Chem Lett	2015.0	1.0	<rdkit.DataStructs.cDataStructs.ExplicitBitVect object at 0x000001D3B7F94120>	G2	<rdkit.Chem.rdchem.Mol object at 0x000001D3BA08ACE0>	G2 active	Train
CHEMBL505896		610.69	5.63	COc1cc2c(Oc3ccc(-c4cnc(Cc5ccccc5)n(C)c4=O)cc3F)ccnc2cc1OCCCN1CCOCC1	IC50	'='	nM	19.0	CHEMBL971826	Inhibition of BTK	BAO_0000357	single protein format	None	CHEMBL5251	Tyrosine-protein kinase BTK	Homo sapiens	SINGLE PROTEIN	CHEMBL1140082	Scientific Literature	J Med Chem	2008.0	1.0	<rdkit.DataStructs.cDataStructs.ExplicitBitVect object at 0x000001D3B7F940B0>	G2	<rdkit.Chem.rdchem.Mol object at 0x000001D3BA08AD50>	G2 active	Train
CHEMBL3670079		520.6	3.75	Cc1c(-c2cc(Nc3cc4n(n3)CCN(C)C4)c(=O)[nH]n2)cccc1N1CCn2c(cc3ccccc32)C1=O	IC50	'='	nM	22.9	CHEMBL3705848	Biochemical Assay: A generalized procedure for a standard biochemical Btk Kinase Assay that can be used to test Formula I compounds. Alternatively, the Lanthascreen assay can be used to evaluate Btk activity through quantification of its phosphorylated peptide product. The FRET (Fluorescence Resonance Energy Transfer) that occurs between the fluorescein on the peptide product and the terbium on the detection antibody decreases with the addition of inhibitors of Btk that reduce the phosphorylation of the peptide.	BAO_0000357	single protein format	Homo sapiens	CHEMBL5251	Tyrosine-protein kinase BTK	Homo sapiens	SINGLE PROTEIN	CHEMBL3639120	BindingDB Database		2013.0	1.0	<rdkit.DataStructs.cDataStructs.ExplicitBitVect object at 0x000001D3B7F94040>	G2	<rdkit.Chem.rdchem.Mol object at 0x000001D3BA08ADC0>	G2 active	Train
CHEMBL3954590		587.46	5.62	Cn1c(=O)n(-c2cccc(-c3c(Cl)cc(C(N)=O)c4[nH]c5cc(C(C)(C)O)ccc5c34)c2Cl)c(=O)c2ccccc21	IC50	'='	nM	2.0	CHEMBL3888436	Btk Enzyme Assay: To V-bottom 384-well plates were added test compounds, human recombinant Btk (1 nM, Invitrogen Corporation), fluoresceinated peptide (1.5 μM), ATP (20 μM), and assay buffer (20 mM HEPES pH 7.4, 10 mM MgCl2, 0.015% Brij 35 surfactant and 4 mM DTT in 1.6% DMSO), with a final volume of 30 μL. After incubating at room temperature for 60 min, the reaction was terminated by adding 45 μL of 35 mM EDTA to each sample. The reaction mixture was analyzed on the Caliper LABCHIP® 3000 (Caliper, Hopkinton, Mass.) by electrophoretic separation of the fluorescent substrate and phosphorylated product.	BAO_0000357	single protein format	Homo sapiens	CHEMBL5251	Tyrosine-protein kinase BTK	Homo sapiens	SINGLE PROTEIN	CHEMBL3886711	BindingDB Database		2016.0	1.0	<rdkit.DataStructs.cDataStructs.ExplicitBitVect object at 0x000001D3B7FF9BD0>	G2	<rdkit.Chem.rdchem.Mol object at 0x000001D3BA08AE30>	G2 active	Train
CHEMBL3898339		589.7	5.16	CN1CCCC(n2cc(-c3cc4c(-c5cccc(N6CCOc7cc(C8CC8)ccc7C6=O)c5CO)ncnc4[nH]3)cn2)C1	IC50	'='	nM	5.0	CHEMBL3887851	Recombinant Human BTK Inhibition Assay: The inhibition assays were performed using the generic tyrosine kinase assay kit from C is Bio (HTRF KinEASE-TK #62TK0PEB). The assay is based on the principle of fluorescence resonance energy transfer (FRET) between the Europium Cryptate labeled anti-phosphotyrosine antibody and streptavidin labeled fluorophore, XL-665. In an uninhibited kinase reaction the biotinylated peptide substrate (Tk-Biotin) gets phosphorylated at an intermediate tyrosine site which is captured by anti-phosphotyrosine antibody which eventually acts as a FRET donor. The streptavidin labeled XL-665 binds strongly to the Tk-Biotin substrate and act as a FRET acceptor. The resultant FRET signal is measured at 665 nm. A ratio of this specific fluorescence (665 nm) to the background fluorescence (620 nm), conferred by the free antibody, is directly proportional to the kinase activity. Inhibition of the kinase activity by a pharmacological intervention such as a Btk inhibitor of the present disclosure will result into decreased FRET signal.	BAO_0000357	single protein format	Homo sapiens	CHEMBL5251	Tyrosine-protein kinase BTK	Homo sapiens	SINGLE PROTEIN	CHEMBL3886475	BindingDB Database		2016.0	1.0	<rdkit.DataStructs.cDataStructs.ExplicitBitVect object at 0x000001D3B7FE7F40>	G2	<rdkit.Chem.rdchem.Mol object at 0x000001D3BA08B0D0>	G2 active	Train
CHEMBL3702828		580.67	5.10	CC(C)(/C=C(\C#N)C(=O)N1CCC[C@@H](n2nc(-c3ccc(Oc4ccccc4)cc3F)c3c(N)ncnc32)C1)N1CCC1	IC50	'='	nM	4.1	CHEMBL3888040	Caliper-Based Kinase Assay: A Caliper-based kinase assay (Caliper Life Sciences, Hopkinton, Mass.) was used to measure inhibition of Btk kinase activity of a compound of the present disclosure. Serial dilutions of test compounds were incubated with human recombinant Btk (0.5 nM), ATP (16 μM) and a phosphoacceptor peptide substrate FAM-GEEPLYWSFPAKKK-NH2 (1 μM) at room temperature for 3 h. The reaction was then terminated with EDTA, final concentration 20 mM and the phosphorylated reaction product was quantified on a Caliper Desktop Profiler (Caliper LabChip 3000).	BAO_0000357	single protein format	Homo sapiens	CHEMBL5251	Tyrosine-protein kinase BTK	Homo sapiens	SINGLE PROTEIN	CHEMBL3886550	BindingDB Database		2016.0	1.0	<rdkit.DataStructs.cDataStructs.ExplicitBitVect object at 0x000001D3B7FE7E60>	G2	<rdkit.Chem.rdchem.Mol object at 0x000001D3BA08AFF0>	G2 active	Train
CHEMBL3924953		596.76	5.12	Cc1c(-c2cn(C)c(=O)c(Nc3ccc(C4C(=O)NCCN4C)cc3)n2)cccc1N1Cc2cc(C(C)(C)C)sc2C1=O	IC50	'='	nM	24.7	CHEMBL3887917	Biochemical Btk Assay: A generalized procedure for a standard biochemical Btk Kinase Assay that can be used to test Formula I compounds is as follows. A master mix minus Btk enzyme is prepared containing 1x Cell Signaling kinase buffer (25 mM Tris-HCl, pH 7.5, 5 mM beta-glycerophosphate, 2 mM dithiothreitol, 0.1 mM Na3VO4, 10 mM MgCl2), 0.5 μM Promega PTK Biotinylated peptide substrate 2, and 0.01% BSA. A master mix plus Btk enzyme is prepared containing 1x Cell Signaling kinase buffer, 0.5 μM PTK Biotinylated peptide substrate 2, 0.01% BSA, and 100 ng/well (0.06 mU/well) Btk enzyme. Btk enzyme is prepared as follows: full length human wildtype Btk (accession number NM-000061) with a C-terminal V5 and 6xHis tag was subcloned into pFastBac vector for making baculovirus carrying this epitope-tagged Btk.	BAO_0000357	single protein format	Homo sapiens	CHEMBL5251	Tyrosine-protein kinase BTK	Homo sapiens	SINGLE PROTEIN	CHEMBL3886504	BindingDB Database		2016.0	1.0	<rdkit.DataStructs.cDataStructs.ExplicitBitVect object at 0x000001D3B7FE7DF0>	G2	<rdkit.Chem.rdchem.Mol object at 0x000001D3BA08B140>	G2 active	Train
CHEMBL3927293		501.59	4.23	C=CC(=O)N1CCC(C2CCNc3c(C(N)=O)c(-c4ccc(Oc5ccccc5)c(OC)c4)nn32)CC1	IC50	'='	nM	1.1	CHEMBL3889138	Time-Resolved Fluorescence Resonance Energy Transfer Assay: Compounds disclosed herein were tested for inhibition of Btk kinase activity in an assay based on time-resolved fluorescence resonance energy transfer methodology. Recombinant Btk was pre-incubated with the compounds disclosed herein at room temperature for 1 hour in an assay buffer containing 50 mM Tris pH7.4, 10 mM MgCl2, 2 mM MnCl2, 0.1 mM EDTA, 1 mM DT, 20 nM SEB, 0.1% BSA, 0.005% tween-20. The reactions were initiated by the addition of ATP (at the concentration of ATP Km) and peptide substrate (Biotin-AVLESEEELYSSARQ-NH2). After incubating at room temperature for 1 h, an equal volume of stop solution containing 50 mM HEPES pH7.0, 800 mM KF, 20 mM EDTA, 0.1% BSA, Eu cryptate-conjugated p-Tyr66 antibody and streptavidin-labeled XL665 was added to stop the reaction. Plates were further incubated at room temperature for 1 hour, and then the TR-FRET signals (ex337 nm, em 620 nm/665 nm) were read on BMG PHERAstar FS instrument. The residual enzyme activity in presence of increasing concentrations of compounds was calculated based on the ratio of fluorescence at 615 nm to that at 665 nm. The IC50 for each compound was derived from fitting the data to the four-parameter logistic equation by Graphpad Prism software.	BAO_0000357	single protein format	Homo sapiens	CHEMBL5251	Tyrosine-protein kinase BTK	Homo sapiens	SINGLE PROTEIN	CHEMBL3886959	BindingDB Database		2016.0	1.0	<rdkit.DataStructs.cDataStructs.ExplicitBitVect object at 0x000001D3B7FE7D80>	G2	<rdkit.Chem.rdchem.Mol object at 0x000001D3BA08B1B0>	G2 active	Train
CHEMBL4205974		454.53	5.17	C=CC(=O)N1CC[C@@H](n2nc(-c3ccc(Oc4cccc(OC)c4C)cc3)c3cnccc32)C1	IC50	'='	nM	10.0	CHEMBL4194325	Inhibition of BTK (unknown origin) using peptide substrate after 1 hr by HTRF assay	BAO_0000357	single protein format	Homo sapiens	CHEMBL5251	Tyrosine-protein kinase BTK	Homo sapiens	SINGLE PROTEIN	CHEMBL4190358	Scientific Literature	ACS Med Chem Lett	2017.0	1.0	<rdkit.DataStructs.cDataStructs.ExplicitBitVect object at 0x000001D3B7FE7D10>	G2	<rdkit.Chem.rdchem.Mol object at 0x000001D3BA08B220>	G2 active	Train
CHEMBL4109100		493.57	4.76	C=CC(=O)Nc1ccccc1[C@H]1CCNc2c(C(N)=O)c(-c3ccc(OCc4ccccc4)cc3)nn21	IC50	'='	nM	0.51	CHEMBL3889138	Time-Resolved Fluorescence Resonance Energy Transfer Assay: Compounds disclosed herein were tested for inhibition of Btk kinase activity in an assay based on time-resolved fluorescence resonance energy transfer methodology. Recombinant Btk was pre-incubated with the compounds disclosed herein at room temperature for 1 hour in an assay buffer containing 50 mM Tris pH7.4, 10 mM MgCl2, 2 mM MnCl2, 0.1 mM EDTA, 1 mM DT, 20 nM SEB, 0.1% BSA, 0.005% tween-20. The reactions were initiated by the addition of ATP (at the concentration of ATP Km) and peptide substrate (Biotin-AVLESEEELYSSARQ-NH2). After incubating at room temperature for 1 h, an equal volume of stop solution containing 50 mM HEPES pH7.0, 800 mM KF, 20 mM EDTA, 0.1% BSA, Eu cryptate-conjugated p-Tyr66 antibody and streptavidin-labeled XL665 was added to stop the reaction. Plates were further incubated at room temperature for 1 hour, and then the TR-FRET signals (ex337 nm, em 620 nm/665 nm) were read on BMG PHERAstar FS instrument. The residual enzyme activity in presence of increasing concentrations of compounds was calculated based on the ratio of fluorescence at 615 nm to that at 665 nm. The IC50 for each compound was derived from fitting the data to the four-parameter logistic equation by Graphpad Prism software.	BAO_0000357	single protein format	Homo sapiens	CHEMBL5251	Tyrosine-protein kinase BTK	Homo sapiens	SINGLE PROTEIN	CHEMBL3886959	BindingDB Database		2016.0	1.0	<rdkit.DataStructs.cDataStructs.ExplicitBitVect object at 0x000001D3B7FE7CA0>	G2	<rdkit.Chem.rdchem.Mol object at 0x000001D3BA08B290>	G2 active	Train
CHEMBL4250200		444.49	3.60	C=CC(=O)N1CCN(c2ccc(C(N)=O)c(Oc3ccc(Oc4ccccc4)cc3)n2)CC1	IC50	'='	nM	4.1	CHEMBL4236252	Inhibition of human full length BTK using FITC-AHA-EEPLYWSFPAKKK-NH2 as substrate after 90 mins by microfluid mobility shift assay	BAO_0000357	single protein format	Homo sapiens	CHEMBL5251	Tyrosine-protein kinase BTK	Homo sapiens	SINGLE PROTEIN	CHEMBL4229542	Scientific Literature	Bioorg Med Chem Lett	2018.0	1.0	<rdkit.DataStructs.cDataStructs.ExplicitBitVect object at 0x000001D3B7FE7C30>	G2	<rdkit.Chem.rdchem.Mol object at 0x000001D3BA08B300>	G2 active	Train
CHEMBL4868813		524.63	5.56	CC(C)n1cc(-c2nc3c(-c4ccc5c(c4)CCC[C@@H]5NC(=O)c4nc(C(C)(C)C)no4)ccnc3[nH]2)cn1	IC50	'='	nM	0.23	CHEMBL4822448	Inhibition of BTK (unknown origin)	BAO_0000357	single protein format	Homo sapiens	CHEMBL5251	Tyrosine-protein kinase BTK	Homo sapiens	SINGLE PROTEIN	CHEMBL4819115	Scientific Literature	Bioorg Med Chem	2021.0	1.0	<rdkit.DataStructs.cDataStructs.ExplicitBitVect object at 0x000001D3B7FE7BC0>	G2	<rdkit.Chem.rdchem.Mol object at 0x000001D3BA08B370>	G2 active	Train
CHEMBL4216788		494.56	3.68	C=CC(=O)N[C@@H](C)C(=O)NC1Cn2c(c(-c3ccc(Oc4ccccc4)cc3)c3c(N)ncnc32)C1=C	IC50	'='	nM	40.1	CHEMBL4189646	Inhibition of recombinant human BTK using Poly(Glu, Tyr) 4:1 as substrate after 1 hr by ELISA	BAO_0000357	single protein format	Homo sapiens	CHEMBL5251	Tyrosine-protein kinase BTK	Homo sapiens	SINGLE PROTEIN	CHEMBL4184325	Scientific Literature	J Med Chem	2018.0	1.0	<rdkit.DataStructs.cDataStructs.ExplicitBitVect object at 0x000001D3B7FE7B50>	G2	<rdkit.Chem.rdchem.Mol object at 0x000001D3BA08B3E0>	G2 active	Train
CHEMBL3670091		541.68	5.03	Cn1cc(-c2cccc(N3CCc4c(sc5c4CCCC5)C3=O)c2CO)cc(Nc2cc(C3CC3)n[nH]2)c1=O	IC50	'='	nM	3.0	CHEMBL3705848	Biochemical Assay: A generalized procedure for a standard biochemical Btk Kinase Assay that can be used to test Formula I compounds. Alternatively, the Lanthascreen assay can be used to evaluate Btk activity through quantification of its phosphorylated peptide product. The FRET (Fluorescence Resonance Energy Transfer) that occurs between the fluorescein on the peptide product and the terbium on the detection antibody decreases with the addition of inhibitors of Btk that reduce the phosphorylation of the peptide.	BAO_0000357	single protein format	Homo sapiens	CHEMBL5251	Tyrosine-protein kinase BTK	Homo sapiens	SINGLE PROTEIN	CHEMBL3639120	BindingDB Database		2013.0	1.0	<rdkit.DataStructs.cDataStructs.ExplicitBitVect object at 0x000001D3B7FE7AE0>	G2	<rdkit.Chem.rdchem.Mol object at 0x000001D3BA08B450>	G2 active	Train
CHEMBL3946624		537.04	4.83	NC(=O)c1c(-c2ccc(F)c(Cl)c2)nn2c1NCCC2c1ccccc1NC(=O)/C=C/CN1CCCCC1	IC50	'='	nM	6.1	CHEMBL3889138	Time-Resolved Fluorescence Resonance Energy Transfer Assay: Compounds disclosed herein were tested for inhibition of Btk kinase activity in an assay based on time-resolved fluorescence resonance energy transfer methodology. Recombinant Btk was pre-incubated with the compounds disclosed herein at room temperature for 1 hour in an assay buffer containing 50 mM Tris pH7.4, 10 mM MgCl2, 2 mM MnCl2, 0.1 mM EDTA, 1 mM DT, 20 nM SEB, 0.1% BSA, 0.005% tween-20. The reactions were initiated by the addition of ATP (at the concentration of ATP Km) and peptide substrate (Biotin-AVLESEEELYSSARQ-NH2). After incubating at room temperature for 1 h, an equal volume of stop solution containing 50 mM HEPES pH7.0, 800 mM KF, 20 mM EDTA, 0.1% BSA, Eu cryptate-conjugated p-Tyr66 antibody and streptavidin-labeled XL665 was added to stop the reaction. Plates were further incubated at room temperature for 1 hour, and then the TR-FRET signals (ex337 nm, em 620 nm/665 nm) were read on BMG PHERAstar FS instrument. The residual enzyme activity in presence of increasing concentrations of compounds was calculated based on the ratio of fluorescence at 615 nm to that at 665 nm. The IC50 for each compound was derived from fitting the data to the four-parameter logistic equation by Graphpad Prism software.	BAO_0000357	single protein format	Homo sapiens	CHEMBL5251	Tyrosine-protein kinase BTK	Homo sapiens	SINGLE PROTEIN	CHEMBL3886959	BindingDB Database		2016.0	1.0	<rdkit.DataStructs.cDataStructs.ExplicitBitVect object at 0x000001D3B7FE7A70>	G2	<rdkit.Chem.rdchem.Mol object at 0x000001D3BA08B4C0>	G2 active	Train
CHEMBL4749522		604.73	6.47	Cc1c(NC(=O)c2ccc(C3CC3)cc2)cc(F)cc1-c1ncnc2[nH]cc(C3=CCN(C(=O)/C=C/CN4CCCC4)CC3)c12	IC50	'='	nM	0.6	CHEMBL4668253	Inhibition of full length human unphosphorylated BTK using FITC-Ahx-TSELKKVVALYDYMPMNAND-NH2 as substrate incubated for 60 mins in presence of ATP at Km concentration	BAO_0000357	single protein format	Homo sapiens	CHEMBL5251	Tyrosine-protein kinase BTK	Homo sapiens	SINGLE PROTEIN	CHEMBL4665670	Scientific Literature	ACS Med Chem Lett	2019.0	1.0	<rdkit.DataStructs.cDataStructs.ExplicitBitVect object at 0x000001D3B7FE7A00>	G2	<rdkit.Chem.rdchem.Mol object at 0x000001D3BA08B530>	G2 active	Train
CHEMBL3939637		568.72	5.08	NC(=O)c1c(-c2ccc(Oc3ccccc3)cc2)nn2c1NCCC2C1CCN(C(=O)/C=C/CN2CCCCC2)CC1	IC50	'='	nM	3.8	CHEMBL3889138	Time-Resolved Fluorescence Resonance Energy Transfer Assay: Compounds disclosed herein were tested for inhibition of Btk kinase activity in an assay based on time-resolved fluorescence resonance energy transfer methodology. Recombinant Btk was pre-incubated with the compounds disclosed herein at room temperature for 1 hour in an assay buffer containing 50 mM Tris pH7.4, 10 mM MgCl2, 2 mM MnCl2, 0.1 mM EDTA, 1 mM DT, 20 nM SEB, 0.1% BSA, 0.005% tween-20. The reactions were initiated by the addition of ATP (at the concentration of ATP Km) and peptide substrate (Biotin-AVLESEEELYSSARQ-NH2). After incubating at room temperature for 1 h, an equal volume of stop solution containing 50 mM HEPES pH7.0, 800 mM KF, 20 mM EDTA, 0.1% BSA, Eu cryptate-conjugated p-Tyr66 antibody and streptavidin-labeled XL665 was added to stop the reaction. Plates were further incubated at room temperature for 1 hour, and then the TR-FRET signals (ex337 nm, em 620 nm/665 nm) were read on BMG PHERAstar FS instrument. The residual enzyme activity in presence of increasing concentrations of compounds was calculated based on the ratio of fluorescence at 615 nm to that at 665 nm. The IC50 for each compound was derived from fitting the data to the four-parameter logistic equation by Graphpad Prism software.	BAO_0000357	single protein format	Homo sapiens	CHEMBL5251	Tyrosine-protein kinase BTK	Homo sapiens	SINGLE PROTEIN	CHEMBL3886959	BindingDB Database		2016.0	1.0	<rdkit.DataStructs.cDataStructs.ExplicitBitVect object at 0x000001D3B7FE7990>	G2	<rdkit.Chem.rdchem.Mol object at 0x000001D3BA08B5A0>	G2 active	Train
CHEMBL3622193		592.68	4.93	CN1CCN(C(=O)c2ccc3c(c2)[nH]c2c(C(N)=O)ccc(-c4cccc(NC(=O)c5ccc(N(C)C)cc5)c4F)c23)CC1	IC50	'='	nM	3.0	CHEMBL3627421	Inhibition of human recombinant BTK	BAO_0000357	single protein format	Homo sapiens	CHEMBL5251	Tyrosine-protein kinase BTK	Homo sapiens	SINGLE PROTEIN	CHEMBL3621099	Scientific Literature	Bioorg Med Chem Lett	2015.0	1.0	<rdkit.DataStructs.cDataStructs.ExplicitBitVect object at 0x000001D3B7FE7920>	G2	<rdkit.Chem.rdchem.Mol object at 0x000001D3BA08B610>	G2 active	Train
