Compound_ID	Molecule Name	Molecular Weight	AlogP	Smiles	Standard Type	Standard Relation	Standard Units	Standard Value	Assay ChEMBL ID	Assay Description	BAO Format ID	BAO Label	Assay Organism	Target ChEMBL ID	Target Name	Target Organism	Target Type	Document ChEMBL ID	Source Description	Document Journal	Document Year	Active	bits	Group	ROMol	Set	Set_type
CHEMBL3647965		426.48	3.83	C=CC(=O)N1CC[C@H](n2nc(-c3ccc(Oc4ccccc4)cc3)c3c(N)ncnc32)C1	IC50	'='	nM	1.9	CHEMBL3887275	Time-Resolved Fluorescence Resonance Energy Transfer (TR-FRET) Assay: Btk kinase activity was determined using a time-resolved fluorescence resonance energy transfer (TR-FRET) methodology. Measurements were performed in a reaction volume of 50 uL using 96-well assay plates. Kinase enzyme, inhibitor, ATP (at the Km for the kinase), and 1 uM peptide substrate (Biotin-AVLESEEELYSSARQ-NH2) were incubated in a reaction buffer composed of 20 mM Tris, 50 mM NaCl, MgCl2 (5-25 mM depending on the kinase), MnCl2 (0-10 mM), 1 mM DTT, 0.1 mM EDTA, 0.01% bovine serum albumin, 0.005% Tween-20, and 10% DMSO at pH 7.4 for one hour. The reaction was quenched by the addition of 1.2 equivalents of EDTA (relative to divalent cation) in 25uL of 1x Lance buffer (Perkin-Elmer). Streptavidin-APC (Perkin-Elmer) and Eu-labeled p-Tyr100 antibody (Perkin-Elmer) in 1x Lance buffer were added in a 25 uL volume to give final concentrations of 100 nM and 2.5 nM, respectively, and the mixture was allowed to incubate for one hour.	BAO_0000357	single protein format	Homo sapiens	CHEMBL5251	Tyrosine-protein kinase BTK	Homo sapiens	SINGLE PROTEIN	CHEMBL3886252	BindingDB Database		2015.0	1.0	<rdkit.DataStructs.cDataStructs.ExplicitBitVect object at 0x000001D3B7FF1380>	G1	<rdkit.Chem.rdchem.Mol object at 0x000001D3B7F97450>	G2 active	Train
CHEMBL3967742		336.4	2.51	O=C(NC1CCCC(Nc2ncnc3[nH]cnc23)C1)c1ccccc1	IC50	'='	nM	45.32	CHEMBL3889150	FRET (Forster/Flouresence Resonance Energy Transfer) Assay: This BTK competition assay measures compound potency (IC50) for the inactivated state of Bruton's Tyrosine Kinase using FRET (FOrster/Flouresence Resonance Energy Transfer) technology. The BTK-Eu complex was incubated on ice one hour prior to use at a starting concentration of 50 nM BTK-Bioease: 10 nM Eu-streptavidin (Perkin-Elmer Catalog# AD0062). The assay buffer consisted of 20 mM HEPES (pH 7.15), 0.1 mM DTT, 10 mM MgCl2, 0.5 mg/ml BSA with 3% Kinase Stabilizer (Fremont Biosolutions, Catalog #STB-K02). After 1 h, the reaction mixture from above was diluted 10 fold in assay buffer to make 5 nM BTK: 1 nM Eu-Streptavidin complex (donor fluorophore). 18 ul of a mixture of 0.11 nM BTK-Eu and 0.11 nM Kinase Tracer 178 (Invitrogen, Catalog #PV5593,) with BTK-Eu alone as no negative control, was then dispensed into 384-well flat bottom plates (Greiner, 784076). Compounds to be tested in assay were prepared as 10x concentrations and serial dilution in half-log increments was performed in DMSO so as to generate 10 point curves. To initiate the FRET reaction, compounds prepared as 10x stock in DMSO was added to the plates and the plates were incubated 18-24 h at 14° C. After the incubation the plates were read on a BMG Pherastar Fluorescent plate reader (or equivalent) and used to measure the emission energy from the europium donor fluorophore (620 nm emission) and the FRET (665 nm emission). The negative control well values were averaged to obtain the mean minimum. The positive 'no inhibitor' control wells were averaged to obtain the mean maximum.	BAO_0000357	single protein format	Homo sapiens	CHEMBL5251	Tyrosine-protein kinase BTK	Homo sapiens	SINGLE PROTEIN	CHEMBL3886966	BindingDB Database		2016.0	1.0	<rdkit.DataStructs.cDataStructs.ExplicitBitVect object at 0x000001D3B7FF11C0>	G1	<rdkit.Chem.rdchem.Mol object at 0x000001D3B7F97610>	G2 active	Train
CHEMBL248676		395.45	2.8	Cc1ccc2[nH]ncc2c1Nc1ccnc(Nc2cccc(S(N)(=O)=O)c2)n1	IC50	'='	nM	69.0	CHEMBL923138	Inhibition of Btk	BAO_0000357	single protein format	None	CHEMBL5251	Tyrosine-protein kinase BTK	Homo sapiens	SINGLE PROTEIN	CHEMBL1140683	Scientific Literature	Bioorg Med Chem Lett	2007.0	1.0	<rdkit.DataStructs.cDataStructs.ExplicitBitVect object at 0x000001D3B7FF1150>	G1	<rdkit.Chem.rdchem.Mol object at 0x000001D3B7F97680>	G2 active	Train
CHEMBL3639560		489.5	4.43	Nc1n[nH]c2cc(-c3ccc(C(=O)Nc4nnn[nH]4)cc3)nc(-c3ccc(Oc4ccccc4)cc3)c12	IC50	'='	nM	0.7	CHEMBL3705416	Enzyme Assay: To V-bottom 384-well plates were added test compounds, human recombinant Btk (1 nM, Invitrogen Corporation), fluoresceinated peptide (1.5 uM), ATP (20 uM), and assay buffer (20 mM HEPES pH 7.4, 10 mM MgCl2, 0.015% Brij35 and 4 mM DTT in 1.6% DMSO), with a final volume of 30 uL. After incubating at room temperature for 60 min, the reaction was terminated by adding 45 ul of 35 mM EDTA to each sample. The reaction mixture was analyzed on the Caliper LABCHIP 3000 (Caliper, Hopkinton, Mass.) by electrophoretic separation of the fluorescent substrate and phosphorylated product. Inhibition data were calculated by comparison to no enzyme control reactions for 100% inhibition and no inhibitor controls for 0% inhibition. Dose response curves were generated to determine the concentration required inhibiting 50% of kinase activity (IC50). Compounds were dissolved at 10 mM in dimethylsulfoxide (DMSO) and evaluated at eleven concentrations.	BAO_0000357	single protein format	Homo sapiens	CHEMBL5251	Tyrosine-protein kinase BTK	Homo sapiens	SINGLE PROTEIN	CHEMBL3638930	BindingDB Database		2014.0	1.0	<rdkit.DataStructs.cDataStructs.ExplicitBitVect object at 0x000001D3B7FF10E0>	G1	<rdkit.Chem.rdchem.Mol object at 0x000001D3B7F976F0>	G2 active	Train
CHEMBL3935131		501.54	4.78	Cn1cc(-c2cc(-c3ccc(Cn4ncc5cc(C(C)(C)C)cc(F)c5c4=O)c(F)c3)cc(=O)[nH]2)cn1	IC50	'='	nM	14.19	CHEMBL3889112	TR-FRET (Time Resolved FRET) Assay: This BTK competition assay measures compound potency (IC50) for the inactivated state of Bruton's Tyrosine Kinase using FRET (Forster/Fluorescence Resonance Energy Transfer) technology. The BTK-Eu complex was incubated on ice one hour prior to use at a starting concentration of 50 nM BTK-Bioease: 10 nM Eu-streptavidin (Perkin-Elmer Catalog #AD0062). The assay buffer consisted of 20 mM HEPES (pH 7.15), 0.1 mM DTT, 10 mM MgCl2, 0.5 mg/ml BSA with 3% Kinase Stabilizer (Fremont Biosolutions, Catalog #STB-K02). After 1 h, the reaction mixture from above was diluted 10 fold in assay buffer to make 5 nM BTK: 1 nM Eu-Streptavidin complex (donor fluorophore). 18 μl of a mixture of 0.11 nM BTK-Eu and 0.11 nM Kinase Tracer 178 (Invitrogen, Catalog #PV5593,) with BTK-Eu alone as no negative control, was then dispensed into 384-well flat bottom plates (Greiner, 784076). Compounds to be tested in assay were prepared as 10x concentrations and serial dilution in half-log increments was performed in DMSO so as to generate 10 point curves. To initiate the FRET reaction, compounds prepared as 10x stock in DMSO was added to the plates and the plates were incubated 18-24 h at 14° C.	BAO_0000357	single protein format	Homo sapiens	CHEMBL5251	Tyrosine-protein kinase BTK	Homo sapiens	SINGLE PROTEIN	CHEMBL3886947	BindingDB Database		2016.0	1.0	<rdkit.DataStructs.cDataStructs.ExplicitBitVect object at 0x000001D3B7FF1000>	G1	<rdkit.Chem.rdchem.Mol object at 0x000001D3B7F977D0>	G2 active	Train
CHEMBL3787615		462.58	4.65	C=CC(=O)Nc1cccc(Nc2nc(Nc3ccc(N4CCOCC4)cc3)ncc2SC)c1	IC50	'='	nM	1.08	CHEMBL3789511	Inhibition of BTK (unknown origin)	BAO_0000357	single protein format	Homo sapiens	CHEMBL5251	Tyrosine-protein kinase BTK	Homo sapiens	SINGLE PROTEIN	CHEMBL3784966	Scientific Literature	Bioorg Med Chem Lett	2016.0	1.0	<rdkit.DataStructs.cDataStructs.ExplicitBitVect object at 0x000001D3B7FF0CF0>	G1	<rdkit.Chem.rdchem.Mol object at 0x000001D3B7F97AE0>	G2 active	Train
CHEMBL3907348		554.55	4.89	Cc1c(-c2c(F)cc(C(N)=O)c3[nH]c4cc(C(C)(C)O)ccc4c23)cccc1-n1c(=O)[nH]c2c(F)cccc2c1=O	IC50	'='	nM	0.48	CHEMBL3888436	Btk Enzyme Assay: To V-bottom 384-well plates were added test compounds, human recombinant Btk (1 nM, Invitrogen Corporation), fluoresceinated peptide (1.5 μM), ATP (20 μM), and assay buffer (20 mM HEPES pH 7.4, 10 mM MgCl2, 0.015% Brij 35 surfactant and 4 mM DTT in 1.6% DMSO), with a final volume of 30 μL. After incubating at room temperature for 60 min, the reaction was terminated by adding 45 μL of 35 mM EDTA to each sample. The reaction mixture was analyzed on the Caliper LABCHIP® 3000 (Caliper, Hopkinton, Mass.) by electrophoretic separation of the fluorescent substrate and phosphorylated product.	BAO_0000357	single protein format	Homo sapiens	CHEMBL5251	Tyrosine-protein kinase BTK	Homo sapiens	SINGLE PROTEIN	CHEMBL3886711	BindingDB Database		2016.0	1.0	<rdkit.DataStructs.cDataStructs.ExplicitBitVect object at 0x000001D3B7FF0C80>	G1	<rdkit.Chem.rdchem.Mol object at 0x000001D3B7F97B50>	G2 active	Train
CHEMBL4211270		526.64	6.77	COc1cc(Nc2nccc(-c3cccc(NC(=O)c4ccc(C(C)(C)C)cc4)c3C)n2)cc(OC)c1OC	IC50	'='	nM	6.1	CHEMBL4182608	Inhibition of BTK (unknown origin) using FITC-labeled Srctide substrate and ATP by microfluidic mobility shift assay	BAO_0000357	single protein format	Homo sapiens	CHEMBL5251	Tyrosine-protein kinase BTK	Homo sapiens	SINGLE PROTEIN	CHEMBL4177725	Scientific Literature	Bioorg Med Chem Lett	2018.0	1.0	<rdkit.DataStructs.cDataStructs.ExplicitBitVect object at 0x000001D3B7FF0C10>	G1	<rdkit.Chem.rdchem.Mol object at 0x000001D3B7F97BC0>	G2 active	Train
CHEMBL4859888		496.58	4.51	Cn1cc(-c2nc3c(-c4ccc5c(c4)CCC[C@H]5NC(=O)c4nc(C(C)(C)C)no4)ccnc3[nH]2)cn1	IC50	'='	nM	1.1	CHEMBL4822448	Inhibition of BTK (unknown origin)	BAO_0000357	single protein format	Homo sapiens	CHEMBL5251	Tyrosine-protein kinase BTK	Homo sapiens	SINGLE PROTEIN	CHEMBL4819115	Scientific Literature	Bioorg Med Chem	2021.0	1.0	<rdkit.DataStructs.cDataStructs.ExplicitBitVect object at 0x000001D3B7FF0BA0>	G1	<rdkit.Chem.rdchem.Mol object at 0x000001D3B7F97C30>	G2 active	Train
CHEMBL3925929		431.48	3.33	Nc1ccc2c(c1)CC(n1nc(-c3cc(F)c4c(c3)NCCO4)c3c(N)ncnc31)CC2	IC50	'='	nM	19.0	CHEMBL3865685	Inhibition of human BTK using KVEKIGEGTYGVVYK as substrate after 20 mins by [gamma-33P]ATP based assay	BAO_0000357	single protein format	Homo sapiens	CHEMBL5251	Tyrosine-protein kinase BTK	Homo sapiens	SINGLE PROTEIN	CHEMBL3864190	Scientific Literature	ACS Med Chem Lett	2016.0	1.0	<rdkit.DataStructs.cDataStructs.ExplicitBitVect object at 0x000001D3B7FF0B30>	G1	<rdkit.Chem.rdchem.Mol object at 0x000001D3B7F97CA0>	G2 active	Train
CHEMBL3699645		493.57	4.28	Cc1cc(Nc2cc(-c3ccc(F)c(N4Cc5cc(C(C)(C)C)sc5C4=O)n3)n[nH]c2=O)nn1C	IC50	'='	nM	45.0	CHEMBL3705508	Biochemical Assay: A generalized procedure for a standard biochemical Btk Kinase Assay that can be used to test Formula I compounds is as follows. A master mix minus Btk enzyme is prepared containing IX Cell Signaling kinase buffer (25 mM Tris-HCl, pH 7.5, 5 mM beta- glycerophosphate, 2 mM dithiothreitol, 0.1 mM Na3V04, 10 mM MgCl2), 0.5 ul Promega PTK Biotinylated peptide substrate 2, and 0.01% BSA. A master mix plus Btk enzyme is prepared containing IX Cell Signaling kinase buffer, 0.5 ul PTK Biotinylated peptide substrate 2, 0.01% BSA, and 100 ng/well (0.06 mU/well) Btk enzyme. Btk enzyme is prepared as follows: full length human wildtype Btk (accession number NM-000061) with a C-terminal V5 and 6x His tag was subcloned into pFastBac vector for making baculo virus carrying this epitope-tagged Btk. Generation of baculovirus is done based on Invitrogen's instructions detailed in its published protocol 'Bac-to-Bac Baculovirus Expression Systems'.	BAO_0000357	single protein format	Homo sapiens	CHEMBL5251	Tyrosine-protein kinase BTK	Homo sapiens	SINGLE PROTEIN	CHEMBL3638757	BindingDB Database		2015.0	1.0	<rdkit.DataStructs.cDataStructs.ExplicitBitVect object at 0x000001D3B7FF0AC0>	G1	<rdkit.Chem.rdchem.Mol object at 0x000001D3B7F97D10>	G2 active	Train
CHEMBL4114795		590.61	4.72	CNC(C)(C)/C=C(\C#N)C(=O)N1CCC[C@@H]1Cn1nc(-c2ccc(Oc3cccc(F)c3F)cc2F)c2c(N)ncnc21	IC50	'='	nM	1.3	CHEMBL3887135	Enzymatic Activity Assay: A Caliper-based kinase assay (Caliper Life Sciences, Hopkinton, Mass.) was used to measure inhibition of Btk kinase activity of a compound of Formula (IA), (I′) or (I). Serial dilutions of test compounds were incubated with human recombinant Btk (2 nM), ATP (40 μM) and a phosphoacceptor peptide substrate FAM-GEEPLYWSFPAKKK-NH2 (1 μM) at room temperature for 3 h. The reaction was then terminated with EDTA, final concentration 20 mM and the phosphorylated reaction product was quantified on a Caliper Desktop Profiler (Caliper LabChip 3000). Percent inhibition was calculated for each compound dilution and the concentration that produced 50% inhibition was calculated.	BAO_0000357	single protein format	Homo sapiens	CHEMBL5251	Tyrosine-protein kinase BTK	Homo sapiens	SINGLE PROTEIN	CHEMBL3886180	BindingDB Database		2015.0	1.0	<rdkit.DataStructs.cDataStructs.ExplicitBitVect object at 0x000001D3B7FF09E0>	G1	<rdkit.Chem.rdchem.Mol object at 0x000001D3B7F97DF0>	G2 active	Train
CHEMBL4210340		464.53	3.93	CC#CC(=O)N1CCC[C@@H](n2nc(-c3ccc(C(=O)Nc4ccccn4)cc3)c3cnccc32)C1	IC50	'='	nM	100.0	CHEMBL4194325	Inhibition of BTK (unknown origin) using peptide substrate after 1 hr by HTRF assay	BAO_0000357	single protein format	Homo sapiens	CHEMBL5251	Tyrosine-protein kinase BTK	Homo sapiens	SINGLE PROTEIN	CHEMBL4190358	Scientific Literature	ACS Med Chem Lett	2017.0	1.0	<rdkit.DataStructs.cDataStructs.ExplicitBitVect object at 0x000001D3B7FF0970>	G1	<rdkit.Chem.rdchem.Mol object at 0x000001D3B7F97E60>	G2 active	Train
CHEMBL4285083		492.58	2.05	C=CC(=O)N[C@H]1CCN(c2ccc(C(N)=O)c(Nc3ccc(C(=O)N4CC(C)OC(C)C4)cc3)n2)C1	IC50	'='	nM	2.8	CHEMBL4264020	Inhibition of full length human BTK (8 to 80 residues) using FITC-AHA-EEPLYWSFPAKKK-NH2 as substrate after 90 mins by off-chip mobility shift assay	BAO_0000357	single protein format	Homo sapiens	CHEMBL5251	Tyrosine-protein kinase BTK	Homo sapiens	SINGLE PROTEIN	CHEMBL4261599	Scientific Literature	Bioorg Med Chem Lett	2018.0	1.0	<rdkit.DataStructs.cDataStructs.ExplicitBitVect object at 0x000001D3B7FF0900>	G1	<rdkit.Chem.rdchem.Mol object at 0x000001D3B7F97ED0>	G2 active	Train
CHEMBL3918154		417.47	3.19	C=CC(=O)Nc1ccccc1C1CCNc2c(C(N)=O)c(-c3cccc(OC)c3)nn21	IC50	'='	nM	2.7	CHEMBL3889138	Time-Resolved Fluorescence Resonance Energy Transfer Assay: Compounds disclosed herein were tested for inhibition of Btk kinase activity in an assay based on time-resolved fluorescence resonance energy transfer methodology. Recombinant Btk was pre-incubated with the compounds disclosed herein at room temperature for 1 hour in an assay buffer containing 50 mM Tris pH7.4, 10 mM MgCl2, 2 mM MnCl2, 0.1 mM EDTA, 1 mM DT, 20 nM SEB, 0.1% BSA, 0.005% tween-20. The reactions were initiated by the addition of ATP (at the concentration of ATP Km) and peptide substrate (Biotin-AVLESEEELYSSARQ-NH2). After incubating at room temperature for 1 h, an equal volume of stop solution containing 50 mM HEPES pH7.0, 800 mM KF, 20 mM EDTA, 0.1% BSA, Eu cryptate-conjugated p-Tyr66 antibody and streptavidin-labeled XL665 was added to stop the reaction. Plates were further incubated at room temperature for 1 hour, and then the TR-FRET signals (ex337 nm, em 620 nm/665 nm) were read on BMG PHERAstar FS instrument. The residual enzyme activity in presence of increasing concentrations of compounds was calculated based on the ratio of fluorescence at 615 nm to that at 665 nm. The IC50 for each compound was derived from fitting the data to the four-parameter logistic equation by Graphpad Prism software.	BAO_0000357	single protein format	Homo sapiens	CHEMBL5251	Tyrosine-protein kinase BTK	Homo sapiens	SINGLE PROTEIN	CHEMBL3886959	BindingDB Database		2016.0	1.0	<rdkit.DataStructs.cDataStructs.ExplicitBitVect object at 0x000001D3B7FF0820>	G1	<rdkit.Chem.rdchem.Mol object at 0x000001D3B803D4D0>	G2 active	Train
CHEMBL4172284		318.34	2.16	Cc1cc2[nH]ncc2cc1-c1cccc2c(N)c(C(N)=O)nnc12	IC50	'='	nM	2.0	CHEMBL4152874	Inhibition of BTK (unknown origin)	BAO_0000357	single protein format	Homo sapiens	CHEMBL5251	Tyrosine-protein kinase BTK	Homo sapiens	SINGLE PROTEIN	CHEMBL4152198	Scientific Literature	Eur J Med Chem	2018.0	1.0	<rdkit.DataStructs.cDataStructs.ExplicitBitVect object at 0x000001D3B7FF07B0>	G1	<rdkit.Chem.rdchem.Mol object at 0x000001D3B803D700>	G2 active	Train
CHEMBL3612840		511.61	5.06	Nc1ncc(-c2cnn(CC(=O)N3CCOCC3)c2)c2scc(-c3ccc(Oc4ccccc4)cc3)c12	IC50	'='	nM	11.8	CHEMBL3614375	Inhibition of BTK (unknown origin) after 1 hr by TR-FRET assay	BAO_0000357	single protein format	Homo sapiens	CHEMBL5251	Tyrosine-protein kinase BTK	Homo sapiens	SINGLE PROTEIN	CHEMBL3611978	Scientific Literature	Bioorg Med Chem	2015.0	1.0	<rdkit.DataStructs.cDataStructs.ExplicitBitVect object at 0x000001D3B7FF0740>	G1	<rdkit.Chem.rdchem.Mol object at 0x000001D3B803D460>	G2 active	Train
CHEMBL4128567		660.78	4.59	C=CC(=O)Nc1cccc(-n2c(=O)n(CCc3ccccc3)c(=O)c3cnc(Nc4ccc(N5CCC(N(C)C)CC5)cc4OC)nc32)c1	IC50	'='	nM	23.0	CHEMBL4390265	Inhibition of BTK (unknown origin) by ELISA	BAO_0000357	single protein format	Homo sapiens	CHEMBL5251	Tyrosine-protein kinase BTK	Homo sapiens	SINGLE PROTEIN	CHEMBL4387758	Scientific Literature	Bioorg Med Chem	2019.0	1.0	<rdkit.DataStructs.cDataStructs.ExplicitBitVect object at 0x000001D3B7FF06D0>	G1	<rdkit.Chem.rdchem.Mol object at 0x000001D3B803D3F0>	G2 active	Train
CHEMBL4643808		408.41	4.42	C=CC(=O)N1CC(Oc2cccc3[nH]c(-c4n[nH]c5cc(C(F)F)ccc45)cc23)C1	IC50	'='	nM	71.0	CHEMBL4603779	Inhibition of BTK (unknown origin) using TK as substrate incubated for 30 mins by HTRF assay	BAO_0000357	single protein format	Homo sapiens	CHEMBL5251	Tyrosine-protein kinase BTK	Homo sapiens	SINGLE PROTEIN	CHEMBL4602634	Scientific Literature	Eur J Med Chem	2020.0	1.0	<rdkit.DataStructs.cDataStructs.ExplicitBitVect object at 0x000001D3B7FF0660>	G1	<rdkit.Chem.rdchem.Mol object at 0x000001D3B803D380>	G2 active	Train
CHEMBL4202814		519.49	4.04	C=CC(=O)N[C@@H]1Cn2c(c(-c3ccc(C(=O)Nc4cc(C(F)(F)F)ccn4)cc3)c3c(N)ncnc32)C1=C	IC50	'='	nM	0.8	CHEMBL4189646	Inhibition of recombinant human BTK using Poly(Glu, Tyr) 4:1 as substrate after 1 hr by ELISA	BAO_0000357	single protein format	Homo sapiens	CHEMBL5251	Tyrosine-protein kinase BTK	Homo sapiens	SINGLE PROTEIN	CHEMBL4184325	Scientific Literature	J Med Chem	2018.0	1.0	<rdkit.DataStructs.cDataStructs.ExplicitBitVect object at 0x000001D3B7FF05F0>	G1	<rdkit.Chem.rdchem.Mol object at 0x000001D3B803D310>	G2 active	Train
CHEMBL3290144		617.63	6.11	Cc1ccc(NC(=O)c2cccc(C(F)(F)F)c2)cc1C(=O)Nc1cnc(Nc2cccc(NC(=O)/C=C/CN(C)C)c2)nc1	IC50	'='	nM	15.0	CHEMBL3296229	Inhibition of Btk (unknown origin) after 1 hr by HTRF assay	BAO_0000357	single protein format	Homo sapiens	CHEMBL5251	Tyrosine-protein kinase BTK	Homo sapiens	SINGLE PROTEIN	CHEMBL3286193	Scientific Literature	J Med Chem	2014.0	1.0	<rdkit.DataStructs.cDataStructs.ExplicitBitVect object at 0x000001D3B7FF0580>	G1	<rdkit.Chem.rdchem.Mol object at 0x000001D3B803D230>	G2 active	Train
CHEMBL4440181		393.45	2.27	Nc1ncnc2c1c(-c1ccc3c(c1)OCO3)cn2C[C@H]1CCCN1C[C@@H]1CO1	IC50	'='	nM	8.9	CHEMBL4347057	Inhibition of BTK (unknown origin) in the presence of ATP by caliper mobility shift assay	BAO_0000357	single protein format	Homo sapiens	CHEMBL5251	Tyrosine-protein kinase BTK	Homo sapiens	SINGLE PROTEIN	CHEMBL4346659	Scientific Literature	Eur J Med Chem	2019.0	1.0	<rdkit.DataStructs.cDataStructs.ExplicitBitVect object at 0x000001D3B7FF0510>	G1	<rdkit.Chem.rdchem.Mol object at 0x000001D3B803D150>	G2 active	Train
CHEMBL3940779		596.7	5.64	CC(C)(O)CN1CC=C(c2cc3c(-c4cc(F)cc(N5CCOc6cc(C7CC7)ccc6C5=O)c4CO)ccnc3[nH]2)CC1	IC50	'='	nM	4.0	CHEMBL3887851	Recombinant Human BTK Inhibition Assay: The inhibition assays were performed using the generic tyrosine kinase assay kit from C is Bio (HTRF KinEASE-TK #62TK0PEB). The assay is based on the principle of fluorescence resonance energy transfer (FRET) between the Europium Cryptate labeled anti-phosphotyrosine antibody and streptavidin labeled fluorophore, XL-665. In an uninhibited kinase reaction the biotinylated peptide substrate (Tk-Biotin) gets phosphorylated at an intermediate tyrosine site which is captured by anti-phosphotyrosine antibody which eventually acts as a FRET donor. The streptavidin labeled XL-665 binds strongly to the Tk-Biotin substrate and act as a FRET acceptor. The resultant FRET signal is measured at 665 nm. A ratio of this specific fluorescence (665 nm) to the background fluorescence (620 nm), conferred by the free antibody, is directly proportional to the kinase activity. Inhibition of the kinase activity by a pharmacological intervention such as a Btk inhibitor of the present disclosure will result into decreased FRET signal.	BAO_0000357	single protein format	Homo sapiens	CHEMBL5251	Tyrosine-protein kinase BTK	Homo sapiens	SINGLE PROTEIN	CHEMBL3886475	BindingDB Database		2016.0	1.0	<rdkit.DataStructs.cDataStructs.ExplicitBitVect object at 0x000001D3B7FF0430>	G1	<rdkit.Chem.rdchem.Mol object at 0x000001D3B803D0E0>	G2 active	Train
CHEMBL3670108		602.74	4.46	CN1CCn2nc(Nc3cc(-c4cc(F)cc(N5CCc6c(sc7c6CC(C)(C)C7)C5=O)c4CO)cn(C)c3=O)cc2C1	IC50	'='	nM	4.9	CHEMBL3705848	Biochemical Assay: A generalized procedure for a standard biochemical Btk Kinase Assay that can be used to test Formula I compounds. Alternatively, the Lanthascreen assay can be used to evaluate Btk activity through quantification of its phosphorylated peptide product. The FRET (Fluorescence Resonance Energy Transfer) that occurs between the fluorescein on the peptide product and the terbium on the detection antibody decreases with the addition of inhibitors of Btk that reduce the phosphorylation of the peptide.	BAO_0000357	single protein format	Homo sapiens	CHEMBL5251	Tyrosine-protein kinase BTK	Homo sapiens	SINGLE PROTEIN	CHEMBL3639120	BindingDB Database		2013.0	1.0	<rdkit.DataStructs.cDataStructs.ExplicitBitVect object at 0x000001D3B7FF03C0>	G1	<rdkit.Chem.rdchem.Mol object at 0x000001D3B803D070>	G2 active	Train
CHEMBL3652682		566.67	3.66	CN(C)Cc1ccc(Nc2nn(-c3cccc(-n4ncc5cc(C(C)(C)C)ccc5c4=O)c3CO)cc2C(N)=O)nc1	IC50	'='	nM	0.39	CHEMBL3705288	Inhibition Assay: Plates assayed are 96-well polypropylene (Greiner) and 96-well 1.2 μm hydrophilic PVDF filter plates (Millipore). Concentrations reported here are final assay concentrations: 10-100 μM compounds in DMSO (Burdick and Jackson), 5-10 nM Btk enzyme (His-tagged, full-length), 30 μM peptide substrate (Biotin-Aca-AAAEEIYGEI-NH2), 100 μM ATP (Sigma), 8 mM imidazole (Sigma, pH 7.2), 8 mM glycerol-2-phosphate (Sigma), 200 μM EGTA (Roche Diagnostics), 1 mM MnCl2 (Sigma), 20 mM MgCl2 (Sigma), 0.1 mg/ml BSA (Sigma), 2 mM DTT (Sigma), 1 μCi 33P ATP (Amersham), 20% streptavidin sepharose beads (Amersham), 50 mM EDTA (Gibco), 2 M NaCl (Gibco), 2 M NaCl w/1% phosphoric acid (Gibco), microscint-20 (Perkin Elmer).	BAO_0000357	single protein format	Homo sapiens	CHEMBL5251	Tyrosine-protein kinase BTK	Homo sapiens	SINGLE PROTEIN	CHEMBL3639151	BindingDB Database		2014.0	1.0	<rdkit.DataStructs.cDataStructs.ExplicitBitVect object at 0x000001D3B7FF02E0>	G1	<rdkit.Chem.rdchem.Mol object at 0x000001D3B803F0D0>	G2 active	Train
CHEMBL3903899		519.55	4.34	CC#CC(=O)N1CCC(C2CCNc3c(C(N)=O)c(-c4ccc(Oc5ccc(F)cc5F)cc4)nn32)CC1	IC50	'='	nM	48.0	CHEMBL3889138	Time-Resolved Fluorescence Resonance Energy Transfer Assay: Compounds disclosed herein were tested for inhibition of Btk kinase activity in an assay based on time-resolved fluorescence resonance energy transfer methodology. Recombinant Btk was pre-incubated with the compounds disclosed herein at room temperature for 1 hour in an assay buffer containing 50 mM Tris pH7.4, 10 mM MgCl2, 2 mM MnCl2, 0.1 mM EDTA, 1 mM DT, 20 nM SEB, 0.1% BSA, 0.005% tween-20. The reactions were initiated by the addition of ATP (at the concentration of ATP Km) and peptide substrate (Biotin-AVLESEEELYSSARQ-NH2). After incubating at room temperature for 1 h, an equal volume of stop solution containing 50 mM HEPES pH7.0, 800 mM KF, 20 mM EDTA, 0.1% BSA, Eu cryptate-conjugated p-Tyr66 antibody and streptavidin-labeled XL665 was added to stop the reaction. Plates were further incubated at room temperature for 1 hour, and then the TR-FRET signals (ex337 nm, em 620 nm/665 nm) were read on BMG PHERAstar FS instrument. The residual enzyme activity in presence of increasing concentrations of compounds was calculated based on the ratio of fluorescence at 615 nm to that at 665 nm. The IC50 for each compound was derived from fitting the data to the four-parameter logistic equation by Graphpad Prism software.	BAO_0000357	single protein format	Homo sapiens	CHEMBL5251	Tyrosine-protein kinase BTK	Homo sapiens	SINGLE PROTEIN	CHEMBL3886959	BindingDB Database		2016.0	1.0	<rdkit.DataStructs.cDataStructs.ExplicitBitVect object at 0x000001D3B7FF0200>	G1	<rdkit.Chem.rdchem.Mol object at 0x000001D3B8041770>	G2 active	Train
