Compound_ID	Molecule Name	Molecular Weight	AlogP	Smiles	Standard Type	Standard Relation	Standard Units	Standard Value	Assay ChEMBL ID	Assay Description	BAO Format ID	BAO Label	Assay Organism	Target ChEMBL ID	Target Name	Target Organism	Target Type	Document ChEMBL ID	Source Description	Document Journal	Document Year	Active	bits	Group	ROMol	Set	Set_type
CHEMBL3948173		578.72	5.39	CN(C)C(=O)N1CC=C(c2cc3c(-c4cccc(N5CCc6cc(C(C)(C)C)ccc6C5=O)c4CO)ncnc3[nH]2)CC1	IC50	'='	nM	8.0	CHEMBL3887838	Biochemical Enzyme Assay: The inhibitory activity of the present compounds against Btk was assessed in a biochemical enzyme assay. Assay plates in 384 well format were prepared with 8-point serial dilutions for the test compounds on a Thermo CatX workstation equipped with a Innovadyne Nanodrop Express. The assay plates were prepared by addition of 50 nl per well of compound solution in 90% DMSO. The kinase reactions were started by stepwise addition of 4.5 ul per well of peptide/ATP-solution (4 uM FITC-Ahx-TSELKKVVALYDYMPMNAND-NH2, 164 uM ATP) in kinase buffer (50 mM HEPES, pH 7.5, 1 mM DTT, 0.02% Tween20, 0.02% BSA, 0.6% DMSO, 10 mM beta-glycerophosphate, and 10 uM sodium orthovanadate, 18 mM MgCl2, 1 mM MnCl2) and 4.5 ul per well of enzyme solution (6.4 nM full-length human recombinant BTK) in kinase buffer. Kinase reactions were incubated at 30° C. for 60 minutes and subsequently terminated by addition of 16 ul per well of stop solution (100 mM HEPES pH 7.5, 5% DMSO, 0.1% Caliper coating reagent, 10 mM EDTA, and 0.015% Brij35). Kinase reactions were analyzed on a Caliper LC3000 workstation by separating phosphorylated and unphosphorylated peptides and kinase activities were calculated from the amounts of newly formed phospho-peptide. Inhibition data were calculated by comparison to control reactions without enzyme (100% inhibition) and without inhibitors (0% inhibition).	BAO_0000357	single protein format	Homo sapiens	CHEMBL5251	Tyrosine-protein kinase BTK	Homo sapiens	SINGLE PROTEIN	CHEMBL3886469	BindingDB Database		2016.0	1.0	<rdkit.DataStructs.cDataStructs.ExplicitBitVect object at 0x000001D3BA25CA50>	G2	<rdkit.Chem.rdchem.Mol object at 0x000001D3B800F370>	G2 active	Train
CHEMBL3921217		538.65	5.98	CC(C)(C)c1ccc(C(=O)Nc2cccc(-c3ncnc4[nH]c(C5=CCC6(CC5)OCCO6)cc34)c2CO)cc1	IC50	'='	nM	24.0	CHEMBL3887838	Biochemical Enzyme Assay: The inhibitory activity of the present compounds against Btk was assessed in a biochemical enzyme assay. Assay plates in 384 well format were prepared with 8-point serial dilutions for the test compounds on a Thermo CatX workstation equipped with a Innovadyne Nanodrop Express. The assay plates were prepared by addition of 50 nl per well of compound solution in 90% DMSO. The kinase reactions were started by stepwise addition of 4.5 ul per well of peptide/ATP-solution (4 uM FITC-Ahx-TSELKKVVALYDYMPMNAND-NH2, 164 uM ATP) in kinase buffer (50 mM HEPES, pH 7.5, 1 mM DTT, 0.02% Tween20, 0.02% BSA, 0.6% DMSO, 10 mM beta-glycerophosphate, and 10 uM sodium orthovanadate, 18 mM MgCl2, 1 mM MnCl2) and 4.5 ul per well of enzyme solution (6.4 nM full-length human recombinant BTK) in kinase buffer. Kinase reactions were incubated at 30° C. for 60 minutes and subsequently terminated by addition of 16 ul per well of stop solution (100 mM HEPES pH 7.5, 5% DMSO, 0.1% Caliper coating reagent, 10 mM EDTA, and 0.015% Brij35). Kinase reactions were analyzed on a Caliper LC3000 workstation by separating phosphorylated and unphosphorylated peptides and kinase activities were calculated from the amounts of newly formed phospho-peptide. Inhibition data were calculated by comparison to control reactions without enzyme (100% inhibition) and without inhibitors (0% inhibition).	BAO_0000357	single protein format	Homo sapiens	CHEMBL5251	Tyrosine-protein kinase BTK	Homo sapiens	SINGLE PROTEIN	CHEMBL3886469	BindingDB Database		2016.0	1.0	<rdkit.DataStructs.cDataStructs.ExplicitBitVect object at 0x000001D3BA25CAC0>	G2	<rdkit.Chem.rdchem.Mol object at 0x000001D3B800F3E0>	G2 active	Train
CHEMBL4114660		568.65	6.57	CCOC(C)(C)/C=C(\C#N)C(=O)C1CCC[C@@H](n2nc(-c3ccc(Oc4ccccc4)cc3F)c3c(N)ncnc32)C1	IC50	'='	nM	7.0	CHEMBL3887135	Enzymatic Activity Assay: A Caliper-based kinase assay (Caliper Life Sciences, Hopkinton, Mass.) was used to measure inhibition of Btk kinase activity of a compound of Formula (IA), (I′) or (I). Serial dilutions of test compounds were incubated with human recombinant Btk (2 nM), ATP (40 μM) and a phosphoacceptor peptide substrate FAM-GEEPLYWSFPAKKK-NH2 (1 μM) at room temperature for 3 h. The reaction was then terminated with EDTA, final concentration 20 mM and the phosphorylated reaction product was quantified on a Caliper Desktop Profiler (Caliper LabChip 3000). Percent inhibition was calculated for each compound dilution and the concentration that produced 50% inhibition was calculated.	BAO_0000357	single protein format	Homo sapiens	CHEMBL5251	Tyrosine-protein kinase BTK	Homo sapiens	SINGLE PROTEIN	CHEMBL3886180	BindingDB Database		2015.0	1.0	<rdkit.DataStructs.cDataStructs.ExplicitBitVect object at 0x000001D3BA25CB30>	G2	<rdkit.Chem.rdchem.Mol object at 0x000001D3B800F450>	G2 active	Train
CHEMBL2179790		523.64	4.97	C=CC(=O)N1CCCC(n2nc(-c3cccc(C(=O)Nc4cccc(C(C)(C)C)c4)c3)c3c(N)ncnc32)C1	IC50	'='	nM	15.0	CHEMBL2185026	Inhibition of BTK in presence of 50 uM ATP	BAO_0000357	single protein format	None	CHEMBL5251	Tyrosine-protein kinase BTK	Homo sapiens	SINGLE PROTEIN	CHEMBL2177048	Scientific Literature	J Med Chem	2012.0	1.0	<rdkit.DataStructs.cDataStructs.ExplicitBitVect object at 0x000001D3BA25CC10>	G2	<rdkit.Chem.rdchem.Mol object at 0x000001D3B800F5A0>	G2 active	Train
CHEMBL4566818		586.74	6.54	Cc1c(NC(=O)c2ccc(C(C)(C)C)cc2)cccc1-c1ncnc2[nH]c(-c3ccc(C(=O)N4CCN(C)CC4)cc3)cc12	IC50	'='	nM	13.0	CHEMBL4358487	Inhibition of full-length human recombinant BTK using FITC-Ahx-TSELKKVVALYDYMPMNAND-NH2 as substrate measured after 60 mins by caliper assay	BAO_0000357	single protein format	Homo sapiens	CHEMBL5251	Tyrosine-protein kinase BTK	Homo sapiens	SINGLE PROTEIN	CHEMBL4354855	Scientific Literature	J Med Chem	2020.0	1.0	<rdkit.DataStructs.cDataStructs.ExplicitBitVect object at 0x000001D3BA25CCF0>	G2	<rdkit.Chem.rdchem.Mol object at 0x000001D3B800F680>	G2 active	Train
CHEMBL2437479		414.43	3.05	C=CC(=O)Nc1cccc(-n2c(=O)cnc3cnc(Nc4ccc(OC)cc4)nc32)c1	IC50	'='	nM	1.8	CHEMBL5045465	Inhibition of human BTK using poly-Glu-Tyr (4:1) as substrate incubated for 1 hr by ELISA	BAO_0000357	single protein format	Homo sapiens	CHEMBL5251	Tyrosine-protein kinase BTK	Homo sapiens	SINGLE PROTEIN	CHEMBL5042540	Scientific Literature	J Med Chem	2022.0	1.0	<rdkit.DataStructs.cDataStructs.ExplicitBitVect object at 0x000001D3BA25DE70>	G2	<rdkit.Chem.rdchem.Mol object at 0x000001D3B800F840>	G2 active	Train
CHEMBL5083323		486.58	4.50	Cn1cc(Nc2nccc(-c3ccc4c(c3)CCCCC4NC(=O)c3noc(C(C)(C)C)n3)n2)cn1	IC50	'='	nM	0.3	CHEMBL5043203	Inhibition of human BTK using fluorescein-labeled polyGAT peptide as substrate incubated for 30 mins by FRET assay	BAO_0000357	single protein format	Homo sapiens	CHEMBL5251	Tyrosine-protein kinase BTK	Homo sapiens	SINGLE PROTEIN	CHEMBL5042486	Scientific Literature	J Med Chem	2022.0	1.0	<rdkit.DataStructs.cDataStructs.ExplicitBitVect object at 0x000001D3BA25DEE0>	G2	<rdkit.Chem.rdchem.Mol object at 0x000001D3B800F8B0>	G2 active	Train
CHEMBL5073995		500.61	2.93	CN1CCc2cc(-c3ccnc(Nc4cnn(C)c4)n3)ccc2[C@H](NC(=O)c2cn(C(C)(C)C)nn2)C1	IC50	'='	nM	3.5	CHEMBL5043203	Inhibition of human BTK using fluorescein-labeled polyGAT peptide as substrate incubated for 30 mins by FRET assay	BAO_0000357	single protein format	Homo sapiens	CHEMBL5251	Tyrosine-protein kinase BTK	Homo sapiens	SINGLE PROTEIN	CHEMBL5042486	Scientific Literature	J Med Chem	2022.0	1.0	<rdkit.DataStructs.cDataStructs.ExplicitBitVect object at 0x000001D3BA25DE00>	G2	<rdkit.Chem.rdchem.Mol object at 0x000001D3B800F920>	G2 active	Train
CHEMBL3657222		450.54	6.7	CC(C)COc1cccc(-c2ncc(-c3ccc(Oc4ccccc4)cc3)c3c(N)n[nH]c23)c1	IC50	'='	nM	14000.0	CHEMBL3705416	Enzyme Assay: To V-bottom 384-well plates were added test compounds, human recombinant Btk (1 nM, Invitrogen Corporation), fluoresceinated peptide (1.5 uM), ATP (20 uM), and assay buffer (20 mM HEPES pH 7.4, 10 mM MgCl2, 0.015% Brij35 and 4 mM DTT in 1.6% DMSO), with a final volume of 30 uL. After incubating at room temperature for 60 min, the reaction was terminated by adding 45 ul of 35 mM EDTA to each sample. The reaction mixture was analyzed on the Caliper LABCHIP 3000 (Caliper, Hopkinton, Mass.) by electrophoretic separation of the fluorescent substrate and phosphorylated product. Inhibition data were calculated by comparison to no enzyme control reactions for 100% inhibition and no inhibitor controls for 0% inhibition. Dose response curves were generated to determine the concentration required inhibiting 50% of kinase activity (IC50). Compounds were dissolved at 10 mM in dimethylsulfoxide (DMSO) and evaluated at eleven concentrations.	BAO_0000357	single protein format	Homo sapiens	CHEMBL5251	Tyrosine-protein kinase BTK	Homo sapiens	SINGLE PROTEIN	CHEMBL3638930	BindingDB Database		2014.0	0.0	<rdkit.DataStructs.cDataStructs.ExplicitBitVect object at 0x0000024CECA1F7D0>	G2	<rdkit.Chem.rdchem.Mol object at 0x000001D3B800C120>	G2 inactive	Train
CHEMBL228043		360.01	3.51	C/C(O)=C(\C#N)C(=O)Nc1cc(Br)ccc1Br	IC50	'='	nM	17200.0	CHEMBL921719	Inhibition of human BTK	BAO_0000357	single protein format	Homo sapiens	CHEMBL5251	Tyrosine-protein kinase BTK	Homo sapiens	SINGLE PROTEIN	CHEMBL1145498	Scientific Literature	Proc Natl Acad Sci U S A	2007.0	0.0	<rdkit.DataStructs.cDataStructs.ExplicitBitVect object at 0x0000024CECA1F6F0>	G2	<rdkit.Chem.rdchem.Mol object at 0x000001D3B800D700>	G2 inactive	Train
CHEMBL246356		528.47	5.57	CNc1ncnc(-c2cccnc2Oc2cc(NC(=O)c3cccc(OC(F)(F)C(F)F)c3)ccc2C)n1	IC50	'='	nM	25000.0	CHEMBL887093	Inhibition of BTK by radioactive filtration assay	BAO_0000357	single protein format	None	CHEMBL5251	Tyrosine-protein kinase BTK	Homo sapiens	SINGLE PROTEIN	CHEMBL1139197	Scientific Literature	Bioorg Med Chem Lett	2007.0	0.0	<rdkit.DataStructs.cDataStructs.ExplicitBitVect object at 0x0000024CECA1F4C0>	G2	<rdkit.Chem.rdchem.Mol object at 0x000001D3B800C900>	G2 inactive	Train
CHEMBL373882		598.61	5.57	CNc1ncnc(-c2cccnc2Oc2ccc(F)c(C(=O)Nc3cc(C(F)(F)F)ccc3N(C)CCCN(C)C)c2)n1	IC50	'='	nM	25000.0	CHEMBL908525	Inhibition of BTK	BAO_0000357	single protein format	Homo sapiens	CHEMBL5251	Tyrosine-protein kinase BTK	Homo sapiens	SINGLE PROTEIN	CHEMBL1141380	Scientific Literature	J Med Chem	2007.0	0.0	<rdkit.DataStructs.cDataStructs.ExplicitBitVect object at 0x0000024CECA1FF40>	G2	<rdkit.Chem.rdchem.Mol object at 0x000001D3B800E340>	G2 inactive	Train
CHEMBL3912497		326.41	2.82	CC1CCCC(Nc2nc(Nc3cnn(C)c3)nc3[nH]cnc23)C1	IC50	'='	nM	40626.4	CHEMBL3889150	FRET (Forster/Flouresence Resonance Energy Transfer) Assay: This BTK competition assay measures compound potency (IC50) for the inactivated state of Bruton's Tyrosine Kinase using FRET (FOrster/Flouresence Resonance Energy Transfer) technology. The BTK-Eu complex was incubated on ice one hour prior to use at a starting concentration of 50 nM BTK-Bioease: 10 nM Eu-streptavidin (Perkin-Elmer Catalog# AD0062). The assay buffer consisted of 20 mM HEPES (pH 7.15), 0.1 mM DTT, 10 mM MgCl2, 0.5 mg/ml BSA with 3% Kinase Stabilizer (Fremont Biosolutions, Catalog #STB-K02). After 1 h, the reaction mixture from above was diluted 10 fold in assay buffer to make 5 nM BTK: 1 nM Eu-Streptavidin complex (donor fluorophore). 18 ul of a mixture of 0.11 nM BTK-Eu and 0.11 nM Kinase Tracer 178 (Invitrogen, Catalog #PV5593,) with BTK-Eu alone as no negative control, was then dispensed into 384-well flat bottom plates (Greiner, 784076). Compounds to be tested in assay were prepared as 10x concentrations and serial dilution in half-log increments was performed in DMSO so as to generate 10 point curves. To initiate the FRET reaction, compounds prepared as 10x stock in DMSO was added to the plates and the plates were incubated 18-24 h at 14° C. After the incubation the plates were read on a BMG Pherastar Fluorescent plate reader (or equivalent) and used to measure the emission energy from the europium donor fluorophore (620 nm emission) and the FRET (665 nm emission). The negative control well values were averaged to obtain the mean minimum. The positive 'no inhibitor' control wells were averaged to obtain the mean maximum.	BAO_0000357	single protein format	Homo sapiens	CHEMBL5251	Tyrosine-protein kinase BTK	Homo sapiens	SINGLE PROTEIN	CHEMBL3886966	BindingDB Database		2016.0	0.0	<rdkit.DataStructs.cDataStructs.ExplicitBitVect object at 0x0000024CECA1F920>	G2	<rdkit.Chem.rdchem.Mol object at 0x000001D3B800C200>	G2 inactive	Train
CHEMBL3764684		267.25	-1.67	N=C(N/C(=N/O)c1nonc1N)N1CCCN=C1N	IC50	'='	nM	46510.0	CHEMBL3767269	Antagonist activity at human BTK-PH domain (2 to 170 residues) assessed as reduction in PI(3,4,5)P3/BTK-PH interaction after 30 mins by competitive SPR analysis	BAO_0000357	single protein format	Homo sapiens	CHEMBL5251	Tyrosine-protein kinase BTK	Homo sapiens	SINGLE PROTEIN	CHEMBL3763051	Scientific Literature	Medchemcomm	2015.0	0.0	<rdkit.DataStructs.cDataStructs.ExplicitBitVect object at 0x0000024CECA1F290>	G2	<rdkit.Chem.rdchem.Mol object at 0x000001D3B800CD60>	G2 inactive	Train
CHEMBL4760364		406.45	2.23	C=CC(=O)N1CCC(Cn2nc(-c3ccc4c(c3)OCO4)c3c(N)ncnc32)CC1	IC50	'='	nM	70700.0	CHEMBL4720158	Inhibition of BTK (unknown origin) by caliper mobility shift assay	BAO_0000357	single protein format	Homo sapiens	CHEMBL5251	Tyrosine-protein kinase BTK	Homo sapiens	SINGLE PROTEIN	CHEMBL4715815	Scientific Literature	Eur J Med Chem	2018.0	0.0	<rdkit.DataStructs.cDataStructs.ExplicitBitVect object at 0x0000024CECA1FDF0>	G2	<rdkit.Chem.rdchem.Mol object at 0x000001D3B800EA40>	G2 inactive	Train
CHEMBL2312646		477.44	4.57	CN1CCC(NC(=O)c2cnc(NCc3cc(Cl)ccc3Cl)nc2NC2CCCC2)CC1	IC50	'='	nM	25670.0	CHEMBL2317786	Inhibition of BTK (unknown origin) in presence of ATP	BAO_0000357	single protein format	Homo sapiens	CHEMBL5251	Tyrosine-protein kinase BTK	Homo sapiens	SINGLE PROTEIN	CHEMBL2311250	Scientific Literature	Bioorg Med Chem Lett	2013.0	0.0	<rdkit.DataStructs.cDataStructs.ExplicitBitVect object at 0x0000024CECA1F140>	G2	<rdkit.Chem.rdchem.Mol object at 0x000001D3B800E960>	G2 inactive	Train
CHEMBL522011		292.35	2.56	CNc1nc2c(nc(-c3ccccc3)n2C)c2c1ncn2C	IC50	'='	nM	14000.0	CHEMBL960929	Inhibition of Btk	BAO_0000357	single protein format	None	CHEMBL5251	Tyrosine-protein kinase BTK	Homo sapiens	SINGLE PROTEIN	CHEMBL1153345	Scientific Literature	J Med Chem	2009.0	0.0	<rdkit.DataStructs.cDataStructs.ExplicitBitVect object at 0x0000024CECA1E9D0>	G2	<rdkit.Chem.rdchem.Mol object at 0x000001D3B800E7A0>	G2 inactive	Train
CHEMBL3902517		451.47	3.87	CC(C)(C)c1cc(F)c2c(=O)n(Cc3cc(CO)c(-c4cc[nH]c(=O)c4)cc3F)ncc2c1	IC50	'='	nM	52269.88	CHEMBL3889112	TR-FRET (Time Resolved FRET) Assay: This BTK competition assay measures compound potency (IC50) for the inactivated state of Bruton's Tyrosine Kinase using FRET (Forster/Fluorescence Resonance Energy Transfer) technology. The BTK-Eu complex was incubated on ice one hour prior to use at a starting concentration of 50 nM BTK-Bioease: 10 nM Eu-streptavidin (Perkin-Elmer Catalog #AD0062). The assay buffer consisted of 20 mM HEPES (pH 7.15), 0.1 mM DTT, 10 mM MgCl2, 0.5 mg/ml BSA with 3% Kinase Stabilizer (Fremont Biosolutions, Catalog #STB-K02). After 1 h, the reaction mixture from above was diluted 10 fold in assay buffer to make 5 nM BTK: 1 nM Eu-Streptavidin complex (donor fluorophore). 18 μl of a mixture of 0.11 nM BTK-Eu and 0.11 nM Kinase Tracer 178 (Invitrogen, Catalog #PV5593,) with BTK-Eu alone as no negative control, was then dispensed into 384-well flat bottom plates (Greiner, 784076). Compounds to be tested in assay were prepared as 10x concentrations and serial dilution in half-log increments was performed in DMSO so as to generate 10 point curves. To initiate the FRET reaction, compounds prepared as 10x stock in DMSO was added to the plates and the plates were incubated 18-24 h at 14° C.	BAO_0000357	single protein format	Homo sapiens	CHEMBL5251	Tyrosine-protein kinase BTK	Homo sapiens	SINGLE PROTEIN	CHEMBL3886947	BindingDB Database		2016.0	0.0	<rdkit.DataStructs.cDataStructs.ExplicitBitVect object at 0x0000024CECA1EB20>	G2	<rdkit.Chem.rdchem.Mol object at 0x000001D3B800E8F0>	G2 inactive	Train
CHEMBL3929151		384.87	3.29	O=C(NCc1cccc(Cl)c1)C1CCCC(Nc2ncnc3[nH]cnc23)C1	IC50	'='	nM	100000.0	CHEMBL3889150	FRET (Forster/Flouresence Resonance Energy Transfer) Assay: This BTK competition assay measures compound potency (IC50) for the inactivated state of Bruton's Tyrosine Kinase using FRET (FOrster/Flouresence Resonance Energy Transfer) technology. The BTK-Eu complex was incubated on ice one hour prior to use at a starting concentration of 50 nM BTK-Bioease: 10 nM Eu-streptavidin (Perkin-Elmer Catalog# AD0062). The assay buffer consisted of 20 mM HEPES (pH 7.15), 0.1 mM DTT, 10 mM MgCl2, 0.5 mg/ml BSA with 3% Kinase Stabilizer (Fremont Biosolutions, Catalog #STB-K02). After 1 h, the reaction mixture from above was diluted 10 fold in assay buffer to make 5 nM BTK: 1 nM Eu-Streptavidin complex (donor fluorophore). 18 ul of a mixture of 0.11 nM BTK-Eu and 0.11 nM Kinase Tracer 178 (Invitrogen, Catalog #PV5593,) with BTK-Eu alone as no negative control, was then dispensed into 384-well flat bottom plates (Greiner, 784076). Compounds to be tested in assay were prepared as 10x concentrations and serial dilution in half-log increments was performed in DMSO so as to generate 10 point curves. To initiate the FRET reaction, compounds prepared as 10x stock in DMSO was added to the plates and the plates were incubated 18-24 h at 14° C. After the incubation the plates were read on a BMG Pherastar Fluorescent plate reader (or equivalent) and used to measure the emission energy from the europium donor fluorophore (620 nm emission) and the FRET (665 nm emission). The negative control well values were averaged to obtain the mean minimum. The positive 'no inhibitor' control wells were averaged to obtain the mean maximum.	BAO_0000357	single protein format	Homo sapiens	CHEMBL5251	Tyrosine-protein kinase BTK	Homo sapiens	SINGLE PROTEIN	CHEMBL3886966	BindingDB Database		2016.0	0.0	<rdkit.DataStructs.cDataStructs.ExplicitBitVect object at 0x0000024CECA1F370>	G2	<rdkit.Chem.rdchem.Mol object at 0x000001D3B800E810>	G2 inactive	Train
CHEMBL3657215		307.36	2.44	Nc1n[nH]c2cncc(-c3ccc(C(=O)N4CCCC4)cc3)c12	IC50	'='	nM	40570.0	CHEMBL3705416	Enzyme Assay: To V-bottom 384-well plates were added test compounds, human recombinant Btk (1 nM, Invitrogen Corporation), fluoresceinated peptide (1.5 uM), ATP (20 uM), and assay buffer (20 mM HEPES pH 7.4, 10 mM MgCl2, 0.015% Brij35 and 4 mM DTT in 1.6% DMSO), with a final volume of 30 uL. After incubating at room temperature for 60 min, the reaction was terminated by adding 45 ul of 35 mM EDTA to each sample. The reaction mixture was analyzed on the Caliper LABCHIP 3000 (Caliper, Hopkinton, Mass.) by electrophoretic separation of the fluorescent substrate and phosphorylated product. Inhibition data were calculated by comparison to no enzyme control reactions for 100% inhibition and no inhibitor controls for 0% inhibition. Dose response curves were generated to determine the concentration required inhibiting 50% of kinase activity (IC50). Compounds were dissolved at 10 mM in dimethylsulfoxide (DMSO) and evaluated at eleven concentrations.	BAO_0000357	single protein format	Homo sapiens	CHEMBL5251	Tyrosine-protein kinase BTK	Homo sapiens	SINGLE PROTEIN	CHEMBL3638930	BindingDB Database		2014.0	0.0	<rdkit.DataStructs.cDataStructs.ExplicitBitVect object at 0x0000024CECA1FBC0>	G2	<rdkit.Chem.rdchem.Mol object at 0x000001D3B800E880>	G2 inactive	Train
CHEMBL2312649		520.51	4.64	CN1CCC(NC(=O)c2cnc(Nc3cc(Cl)cc(Cl)c3)nc2NC2CCC(N(C)C)CC2)CC1	IC50	'='	nM	30000.0	CHEMBL2317786	Inhibition of BTK (unknown origin) in presence of ATP	BAO_0000357	single protein format	Homo sapiens	CHEMBL5251	Tyrosine-protein kinase BTK	Homo sapiens	SINGLE PROTEIN	CHEMBL2311250	Scientific Literature	Bioorg Med Chem Lett	2013.0	0.0	<rdkit.DataStructs.cDataStructs.ExplicitBitVect object at 0x0000024CECA1E810>	G2	<rdkit.Chem.rdchem.Mol object at 0x000001D3B800ECE0>	G2 inactive	Train
CHEMBL93815		161.16	1.18	Oc1n[nH]c(-c2ccccc2)n1	IC50	'='	nM	501187.23	CHEMBL5031679	Inhibition of Btk (unknown origin) assessed as inhibition of phosphorylation of FAM-labelled peptide substrate	BAO_0000357	single protein format	Homo sapiens	CHEMBL5251	Tyrosine-protein kinase BTK	Homo sapiens	SINGLE PROTEIN	CHEMBL5030537	Scientific Literature	J Med Chem	2021.0	0.0	<rdkit.DataStructs.cDataStructs.ExplicitBitVect object at 0x0000024CECA1EC70>	G2	<rdkit.Chem.rdchem.Mol object at 0x000001D3B800FF40>	G2 inactive	Train
CHEMBL3657216		497.56	6.92	Nc1n[nH]c2c(-c3ccc(NC(=O)c4ccccc4)cc3)ncc(-c3ccc(Oc4ccccc4)cc3)c12	IC50	'='	nM	14860.0	CHEMBL3705416	Enzyme Assay: To V-bottom 384-well plates were added test compounds, human recombinant Btk (1 nM, Invitrogen Corporation), fluoresceinated peptide (1.5 uM), ATP (20 uM), and assay buffer (20 mM HEPES pH 7.4, 10 mM MgCl2, 0.015% Brij35 and 4 mM DTT in 1.6% DMSO), with a final volume of 30 uL. After incubating at room temperature for 60 min, the reaction was terminated by adding 45 ul of 35 mM EDTA to each sample. The reaction mixture was analyzed on the Caliper LABCHIP 3000 (Caliper, Hopkinton, Mass.) by electrophoretic separation of the fluorescent substrate and phosphorylated product. Inhibition data were calculated by comparison to no enzyme control reactions for 100% inhibition and no inhibitor controls for 0% inhibition. Dose response curves were generated to determine the concentration required inhibiting 50% of kinase activity (IC50). Compounds were dissolved at 10 mM in dimethylsulfoxide (DMSO) and evaluated at eleven concentrations.	BAO_0000357	single protein format	Homo sapiens	CHEMBL5251	Tyrosine-protein kinase BTK	Homo sapiens	SINGLE PROTEIN	CHEMBL3638930	BindingDB Database		2014.0	0.0	<rdkit.DataStructs.cDataStructs.ExplicitBitVect object at 0x0000024CECA1EAB0>	G2	<rdkit.Chem.rdchem.Mol object at 0x000001D3B8031D20>	G2 inactive	Train
CHEMBL3657223		392.46	5.97	Cc1ccccc1-c1ncc(-c2ccc(Oc3ccccc3)cc2)c2c(N)n[nH]c12	IC50	'='	nM	12680.0	CHEMBL3705416	Enzyme Assay: To V-bottom 384-well plates were added test compounds, human recombinant Btk (1 nM, Invitrogen Corporation), fluoresceinated peptide (1.5 uM), ATP (20 uM), and assay buffer (20 mM HEPES pH 7.4, 10 mM MgCl2, 0.015% Brij35 and 4 mM DTT in 1.6% DMSO), with a final volume of 30 uL. After incubating at room temperature for 60 min, the reaction was terminated by adding 45 ul of 35 mM EDTA to each sample. The reaction mixture was analyzed on the Caliper LABCHIP 3000 (Caliper, Hopkinton, Mass.) by electrophoretic separation of the fluorescent substrate and phosphorylated product. Inhibition data were calculated by comparison to no enzyme control reactions for 100% inhibition and no inhibitor controls for 0% inhibition. Dose response curves were generated to determine the concentration required inhibiting 50% of kinase activity (IC50). Compounds were dissolved at 10 mM in dimethylsulfoxide (DMSO) and evaluated at eleven concentrations.	BAO_0000357	single protein format	Homo sapiens	CHEMBL5251	Tyrosine-protein kinase BTK	Homo sapiens	SINGLE PROTEIN	CHEMBL3638930	BindingDB Database		2014.0	0.0	<rdkit.DataStructs.cDataStructs.ExplicitBitVect object at 0x0000024CECA1E7A0>	G2	<rdkit.Chem.rdchem.Mol object at 0x000001D3B8031C40>	G2 inactive	Train
CHEMBL454973		366.45	2.92	CNc1nc2sc(-c3cccc(CNC(C)=O)c3)nc2c2c1ncn2C	IC50	'='	nM	17000.0	CHEMBL960929	Inhibition of Btk	BAO_0000357	single protein format	None	CHEMBL5251	Tyrosine-protein kinase BTK	Homo sapiens	SINGLE PROTEIN	CHEMBL1153345	Scientific Literature	J Med Chem	2009.0	0.0	<rdkit.DataStructs.cDataStructs.ExplicitBitVect object at 0x0000024CECA1F760>	G2	<rdkit.Chem.rdchem.Mol object at 0x000001D3B80315B0>	G2 inactive	Train
CHEMBL4246190		465.51	1.33	C=CC(=O)N[C@H]1CCN(c2ccc(C(N)=O)c(Oc3ccc(C(=O)N4CCOCC4)cc3)n2)C1	IC50	'='	nM	10000.0	CHEMBL4236278	Inhibition of BTK (unknown origin)	BAO_0000357	single protein format	Homo sapiens	CHEMBL5251	Tyrosine-protein kinase BTK	Homo sapiens	SINGLE PROTEIN	CHEMBL4229542	Scientific Literature	Bioorg Med Chem Lett	2018.0	0.0	<rdkit.DataStructs.cDataStructs.ExplicitBitVect object at 0x0000024CECA1EF10>	G2	<rdkit.Chem.rdchem.Mol object at 0x000001D3B8032030>	G2 inactive	Train
CHEMBL3657211		424.46	5.8	COc1ccc(Oc2cc(-c3ccc(Oc4ccccc4)cc3)c3c(N)n[nH]c3n2)cc1	IC50	'='	nM	27910.0	CHEMBL3705416	Enzyme Assay: To V-bottom 384-well plates were added test compounds, human recombinant Btk (1 nM, Invitrogen Corporation), fluoresceinated peptide (1.5 uM), ATP (20 uM), and assay buffer (20 mM HEPES pH 7.4, 10 mM MgCl2, 0.015% Brij35 and 4 mM DTT in 1.6% DMSO), with a final volume of 30 uL. After incubating at room temperature for 60 min, the reaction was terminated by adding 45 ul of 35 mM EDTA to each sample. The reaction mixture was analyzed on the Caliper LABCHIP 3000 (Caliper, Hopkinton, Mass.) by electrophoretic separation of the fluorescent substrate and phosphorylated product. Inhibition data were calculated by comparison to no enzyme control reactions for 100% inhibition and no inhibitor controls for 0% inhibition. Dose response curves were generated to determine the concentration required inhibiting 50% of kinase activity (IC50). Compounds were dissolved at 10 mM in dimethylsulfoxide (DMSO) and evaluated at eleven concentrations.	BAO_0000357	single protein format	Homo sapiens	CHEMBL5251	Tyrosine-protein kinase BTK	Homo sapiens	SINGLE PROTEIN	CHEMBL3638930	BindingDB Database		2014.0	0.0	<rdkit.DataStructs.cDataStructs.ExplicitBitVect object at 0x0000024CECA1FCA0>	G2	<rdkit.Chem.rdchem.Mol object at 0x000001D3B8031FC0>	G2 inactive	Train
