Compound_ID	Molecule Name	Molecular Weight	AlogP	Smiles	Standard Type	Standard Relation	Standard Units	Standard Value	Assay ChEMBL ID	Assay Description	BAO Format ID	BAO Label	Assay Organism	Target ChEMBL ID	Target Name	Target Organism	Target Type	Document ChEMBL ID	Source Description	Document Journal	Document Year	Active	bits	Group	ROMol	Set	Set_type
CHEMBL3103867		406.47	3.04	Nc1ccc(-c2ccccc2F)nc1C(=O)Nc1cnccc1N1CCC[C@H](N)C1	Ki	'='	nM	0.03	CHEMBL4316999	Inhibition of recombinant human PIM1 using FAM-pimtide as substrate after 90 mins by Z-LYTE assay	BAO_0000357	single protein format	Homo sapiens	CHEMBL2147	Serine/threonine-protein kinase PIM1	Homo sapiens	SINGLE PROTEIN	CHEMBL4316591	Scientific Literature	J Med Chem	2019.0	1.0	<rdkit.DataStructs.cDataStructs.ExplicitBitVect object at 0x0000022A7244F840>	G2	<rdkit.Chem.rdchem.Mol object at 0x0000022A74CC2F10>	G1 active	G1
CHEMBL3949175		393.47	3.73	C[C@H]1NC(=O)c2cc(-c3c(F)ccc4c3N=C(NC3(C)CC3)N(C3CC3)C4)[nH]c21	IC50	'='	nM	0.046	CHEMBL3888799	Homogeneous Time Resolved Fluorescence Assay (HTRF): The assay for the determination of Pim activity is based on the formation of phosphorylated biotinylated-BAD peptide at the Serine 112 residue (S112) and employs HTRF® (homogeneous time resolved fluorescence) technology to detect the product in a 384-well plate format. The phosphorylation of biotinylated-BAD (S112) peptide by full length recombinant Pim-1, Pim-2, or Pim-3 protein was detected with streptavidin:Allophycocyanin (APC) conjugate and a europium (Eu) labeled antibody directed against phosphorylated-BAD (S112). Excitation of Eu by a high energy laser light (337 nm) leads to a transfer of energy to the APC molecule, and results in an emission at 665 nm. The fluorescence is directly proportional to the amount of phosphorylated BAD peptide present in the reaction. Compounds were prepared in DMSO by conducting 3-fold serial dilutions to give a 22-point dosing curve having a high dose of 1 μM. A reference compound was included on each assay plate [Costar 3658] in order to validate that plate; on one plate of every assay run, two additional reference compounds were included. The Reaction Buffer consisted of 45 mM Hepes, pH 7.0, 15 mM NaCl, and 1 mM MgCl. The quench/detection buffer consisted of 50 mM Tris, 100 mM NaCl, 0.05% BSA, 0.1% Tween and 3 mM EDTA. Biotinylated BAD peptide (Biopeptide), 10 mM ATP (Sigma), Labeled p-BAD (S112) mAb (Cell Signalling and Perkin Elmer) [with 0.05% BSA and 2 mM DTT added] streptavidin:Allophycocyanin [Perkin Elmer]. Final concentrations either Pim-1 enzyme [5 pM], or Pim-2 enzyme [0.5 pM], DMSO [1%], BLC BAD (S112) [0.5 μM], ATP [1.5 μM], streptavidin:Allophycocyanin [0.002 mg/mL] and biotinylated-BAD (S112) mAb [100 pM]. Initial incubations were carried out at RT (22° C.) for 30 min for both Pim-1 and for Pim-2. Pim enzyme is added to compound in buffer, and plates are incubated of 30 min. Biotinylated BAD and ATP are added and plates are incubated for 1 h. A mixture of labeled p-BAD (S112) mAb and quench/detection buffer are added and incubated for 2 h. Fluorescence was measured by an HTRF® Envision microplate reader.	BAO_0000357	single protein format	None	CHEMBL2147	Serine/threonine-protein kinase PIM1	Homo sapiens	SINGLE PROTEIN	CHEMBL3886836	BindingDB Database		2016.0	1.0	<rdkit.DataStructs.cDataStructs.ExplicitBitVect object at 0x0000022A7244D7E0>	G2	<rdkit.Chem.rdchem.Mol object at 0x0000022A7241C0B0>	G1 active	G1
CHEMBL2036118		333.44	4.43	CN(C)CCCCn1c2ccccc2c2ccc3c(C=O)c[nH]c3c21	IC50	'='	nM	75.0	CHEMBL2040255	Inhibition of Pim-1 using RSRHSSYPAGT as substrate after 30 mins	BAO_0000357	single protein format	None	CHEMBL2147	Serine/threonine-protein kinase PIM1	Homo sapiens	SINGLE PROTEIN	CHEMBL2034961	Scientific Literature	Bioorg Med Chem Lett	2012.0	1.0	<rdkit.DataStructs.cDataStructs.ExplicitBitVect object at 0x0000022A7244DD90>	G2	<rdkit.Chem.rdchem.Mol object at 0x0000022A7241C190>	G1 active	G1
CHEMBL3664625		361.41	2.31	c1cc(OCC2CNCCO2)c2nc(-c3nnc4ccccn34)ccc2c1	IC50	'='	nM	14.2	CHEMBL3705106	PIM-1 Enzyme Assay: The assay for the determination of PIM activity is based on the incorporation of [33P] ATP into PIM2tide substrate and capture of the radiolabeled peptide onto a Whatman P81 (phosphocellulose) filter plate. Assay mixtures contained 35uM [gamma-33P] ATP (20 uCi/mL), 7.5 uM PIM2tide and 0.25 nM PIM-1 in a total volume of 50 pt.	BAO_0000357	single protein format	None	CHEMBL2147	Serine/threonine-protein kinase PIM1	Homo sapiens	SINGLE PROTEIN	CHEMBL3639321	BindingDB Database		2013.0	1.0	<rdkit.DataStructs.cDataStructs.ExplicitBitVect object at 0x0000022A7244C510>	G2	<rdkit.Chem.rdchem.Mol object at 0x0000022A7241FA70>	G1 active	G1
CHEMBL1835063		380.37	2.27	NC(=O)c1cnc(N2CCC[C@H](N)C2)nc1Nc1cccc(C(F)(F)F)c1	IC50	'='	nM	53.0	CHEMBL4629877	Inhibition of human PIM1 using KKRNRTLTK as substrate in presence of [gamma-33P]-ATP by hotspot kinase assay	BAO_0000357	single protein format	Homo sapiens	CHEMBL2147	Serine/threonine-protein kinase PIM1	Homo sapiens	SINGLE PROTEIN	CHEMBL4627396	Scientific Literature	J Med Chem	2020.0	1.0	<rdkit.DataStructs.cDataStructs.ExplicitBitVect object at 0x0000022A7244D150>	G2	<rdkit.Chem.rdchem.Mol object at 0x0000022A7241C430>	G1 active	G1
CHEMBL3921910		415.42	4.35	NCCC1CNC(=O)c2cc(-c3cccc(OC(F)(F)F)c3)c(-c3ccccc3)n21	IC50	'='	nM	7.0	CHEMBL3887519	Trans-Phosphorylation Assay: The inhibitory activity of putative kinase inhibitors and the potency of selected compounds were determined using a trans-phosphorylation assay. Specific peptide or protein substrates were trans-phosphorylated by their specific ser-thr or tyr kinase in the presence of ATP traced with 33P-gamma-ATP, and in the presence of their own optimal buffer and cofactors.At the end of the phosphorylation reaction, more than 98% unlabeled ATP and radioactive ATP were captured by an excess of the ion exchange dowex resin; the resin then settled down to the bottom of the reaction plate by gravity. Supernatant was subsequently withdrawn and transferred into a counting plate, then evaluated by beta-counting. Kinase Buffer (KB):The buffer for PIM1 assay was composed of HEPES 50 mM, at pH 7.5, with 10 mM MgCl2, 1 mM DTT, 3 uM NaVO3, and 0.2 mg/mL BSA.Â  Full-length human PIM1 was expressed and purified as described in Bullock A N, et al., J. Biol. Chem. 2005, 280, 41675-82.	BAO_0000357	single protein format	None	CHEMBL2147	Serine/threonine-protein kinase PIM1	Homo sapiens	SINGLE PROTEIN	CHEMBL3886350	BindingDB Database		2015.0	1.0	<rdkit.DataStructs.cDataStructs.ExplicitBitVect object at 0x0000022A7244DB60>	G2	<rdkit.Chem.rdchem.Mol object at 0x0000022A7241D930>	G1 active	G1
CHEMBL3964497		536.59	5.05	COc1nc(-c2cn(S(=O)(=O)c3ccc(C)cc3)c3ccc(-c4nnc(NC(C)(C)C)o4)cc23)ncc1F	IC50	'='	nM	8.767	CHEMBL3888377	Enzyme Assay: The assay for the determination of Pim activity is based on the formation of phosphorylated biotinylated-BAD peptide at the Serine 112 residue (S112) and employs HTRF® (homogeneous time resolved fluorescence) technology to detect the product in a 96-well plate format. The phosphorylation of biotinylated-BAD (S112) peptide by full length recombinant Pim-1, Pim-2, or Pim-3 protein was detected with streptavidin:Allophycocyanin (APC) conjugate and a europium (Eu) labeled antibody directed against phosphorylated-BAD (S112). Excitation of Eu by a high energy laser light (337 nm) leads to a transfer of energy to the APC molecule, and results in an emission at 665 nm. The fluorescence is directly proportional to the amount of phosphorylated BAD peptide present in the reaction.Compounds were prepared in DMSO by conducting 3-fold serial dilutions to give a 10-point dosing curve having a high dose of 1 uM. A reference compound was included on each assay plate in order to validate that plate; on	BAO_0000357	single protein format	None	CHEMBL2147	Serine/threonine-protein kinase PIM1	Homo sapiens	SINGLE PROTEIN	CHEMBL3886684	BindingDB Database		2016.0	1.0	<rdkit.DataStructs.cDataStructs.ExplicitBitVect object at 0x0000022A7244FF40>	G2	<rdkit.Chem.rdchem.Mol object at 0x0000022A7241D9A0>	G1 active	G1
CHEMBL4104431		388.42	4.2	O=C1NC(=S)S/C1=C\c1csc(-c2ccc(OC(F)(F)F)cc2)n1	IC50	'='	nM	2.9	CHEMBL4029679	Inhibition of recombinant PIM1 (unknown origin) by pyruvate kinase/lactate dehydrogenase-coupled assay	BAO_0000357	single protein format	Homo sapiens	CHEMBL2147	Serine/threonine-protein kinase PIM1	Homo sapiens	SINGLE PROTEIN	CHEMBL4028814	Scientific Literature	Bioorg Med Chem	2017.0	1.0	<rdkit.DataStructs.cDataStructs.ExplicitBitVect object at 0x0000022A7244C970>	G2	<rdkit.Chem.rdchem.Mol object at 0x0000022A7241C040>	G1 active	G1
CHEMBL4070120		487.79	5.16	O=c1[nH]c(-c2ccc(NCC3CCNCC3)cc2Cl)nc2c1oc1ccc(Br)cc12	IC50	'='	nM	7.0	CHEMBL4044916	Inhibition of human recombinant PIM1 in presence of ATP by ELISA based spectrophotometric analysis	BAO_0000357	single protein format	Homo sapiens	CHEMBL2147	Serine/threonine-protein kinase PIM1	Homo sapiens	SINGLE PROTEIN	CHEMBL4043135	Scientific Literature	Bioorg Med Chem	2017.0	1.0	<rdkit.DataStructs.cDataStructs.ExplicitBitVect object at 0x0000022A7244DE70>	G2	<rdkit.Chem.rdchem.Mol object at 0x0000022A7241CB30>	G1 active	G1
CHEMBL2387467		387.37	3.29	N#Cc1ccc(Cc2cc(O)n3ncc(C(=O)Nc4ccc(F)cc4)c3n2)cc1	Ki	'='	nM	1.1	CHEMBL2388109	Inhibition of PIM1 (unknown origin) using FAM-pimtide as substrate after 90 mins by spectrophotometry in presence of ATP	BAO_0000357	single protein format	Homo sapiens	CHEMBL2147	Serine/threonine-protein kinase PIM1	Homo sapiens	SINGLE PROTEIN	CHEMBL2385019	Scientific Literature	Bioorg Med Chem Lett	2013.0	1.0	<rdkit.DataStructs.cDataStructs.ExplicitBitVect object at 0x0000022A7244E110>	G2	<rdkit.Chem.rdchem.Mol object at 0x0000022A7241D460>	G1 active	G1
CHEMBL1915644		362.82	4.54	CNC(=O)c1cccc2c1nc(Nc1ccccc1Cl)c1ccncc12	IC50	'='	nM	16.0	CHEMBL1919423	Inhibition of PIM1 using KKRNRTLTV as substrate by millipore assay in the presence of 90 uM [ATP]	BAO_0000357	single protein format	None	CHEMBL2147	Serine/threonine-protein kinase PIM1	Homo sapiens	SINGLE PROTEIN	CHEMBL1914433	Scientific Literature	Bioorg Med Chem Lett	2011.0	1.0	<rdkit.DataStructs.cDataStructs.ExplicitBitVect object at 0x0000022A7244E260>	G2	<rdkit.Chem.rdchem.Mol object at 0x0000022A7241C510>	G1 active	G1
CHEMBL4793492		379.49	3.61	N[C@H]1CCCN(c2c(/C=C3\SC(=O)NC3=O)cccc2-c2ccccc2)C1	IC50	'='	nM	0.4	CHEMBL4687896	Inhibition of human PIM1 using full length BAD peptide substrate in presence of ATP at Km concentration	BAO_0000357	single protein format	Homo sapiens	CHEMBL2147	Serine/threonine-protein kinase PIM1	Homo sapiens	SINGLE PROTEIN	CHEMBL4680285	Scientific Literature	Bioorg Med Chem	2020.0	1.0	<rdkit.DataStructs.cDataStructs.ExplicitBitVect object at 0x0000022A7244FA70>	G2	<rdkit.Chem.rdchem.Mol object at 0x0000022A7241C6D0>	G1 active	G1
CHEMBL495827		247.32	3.13	CC(C)c1ccc(/C=C2\SC(=O)NC2=O)cc1	IC50	'='	nM	40.0	CHEMBL957365	Inhibition of human recombinant Pim1 by ATP depletion assay	BAO_0000357	single protein format	Homo sapiens	CHEMBL2147	Serine/threonine-protein kinase PIM1	Homo sapiens	SINGLE PROTEIN	CHEMBL1139352	Scientific Literature	J Med Chem	2009.0	1.0	<rdkit.DataStructs.cDataStructs.ExplicitBitVect object at 0x0000022A724C9A10>	G2	<rdkit.Chem.rdchem.Mol object at 0x0000022A7241C820>	G1 active	G1
CHEMBL3896794		318.34	3.13	Nc1nnc(-c2ccc3[nH]cc(-c4cncc(C5CC5)n4)c3c2)o1	IC50	'='	nM	4.344	CHEMBL3888377	Enzyme Assay: The assay for the determination of Pim activity is based on the formation of phosphorylated biotinylated-BAD peptide at the Serine 112 residue (S112) and employs HTRF® (homogeneous time resolved fluorescence) technology to detect the product in a 96-well plate format. The phosphorylation of biotinylated-BAD (S112) peptide by full length recombinant Pim-1, Pim-2, or Pim-3 protein was detected with streptavidin:Allophycocyanin (APC) conjugate and a europium (Eu) labeled antibody directed against phosphorylated-BAD (S112). Excitation of Eu by a high energy laser light (337 nm) leads to a transfer of energy to the APC molecule, and results in an emission at 665 nm. The fluorescence is directly proportional to the amount of phosphorylated BAD peptide present in the reaction.Compounds were prepared in DMSO by conducting 3-fold serial dilutions to give a 10-point dosing curve having a high dose of 1 uM. A reference compound was included on each assay plate in order to validate that plate; on	BAO_0000357	single protein format	None	CHEMBL2147	Serine/threonine-protein kinase PIM1	Homo sapiens	SINGLE PROTEIN	CHEMBL3886684	BindingDB Database		2016.0	1.0	<rdkit.DataStructs.cDataStructs.ExplicitBitVect object at 0x0000022A724C8740>	G2	<rdkit.Chem.rdchem.Mol object at 0x0000022A7241C900>	G1 active	G1
CHEMBL3684975		619.94	6.46	Cc1c(Nc2nc3c(Br)c(Br)c(Br)c(Br)c3[nH]2)cccc1-c1nncn1C	IC50	'='	nM	48.89	CHEMBL3705636	Luminometric Kinase Assay: Kinase assay was performed using luminescent Kinase-Glo (Promega) system. The Kinase-Glo Luminescent Kinase Assay Platform provides a homogeneous, high-throughput screening method for measuring kinase activity by quantifying the amount of ATP remaining in solution following a kinase reaction.	BAO_0000357	single protein format	None	CHEMBL2147	Serine/threonine-protein kinase PIM1	Homo sapiens	SINGLE PROTEIN	CHEMBL3638987	BindingDB Database		2013.0	1.0	<rdkit.DataStructs.cDataStructs.ExplicitBitVect object at 0x0000022A724CA030>	G2	<rdkit.Chem.rdchem.Mol object at 0x0000022A7241CC10>	G1 active	G1
CHEMBL3973281		391.4	3.98	N[C@H]1CC[C@H](Nc2ccc3ncc(-c4cccc(OC(F)(F)F)c4)n3n2)CC1	IC50	'='	nM	4.0	CHEMBL3888916	Kinase-Glo Assay: These assays are set up in duplicate 50 ul volumes in white, flat bottom 96 well plates. Inhibitors are added to the solution of 1× kinase buffer, 10 uM ATP, 100 uM Pim-1-specific substrate, 50 ng of active Pim-1 enzyme, and water in serial dilutions ranging from micromolar to nanomolar concentrations. This solution is incubated at 30 degrees Celsius at 360 rpm for two hours. Following the incubation, 50 ul of Kinase-Glo reagent is added to each well, including all positive and negative control wells, and incubated at room temperature for 15 minutes. The plate is then read by the Luminoskan Ascent instrument and the results displayed with the Ascent Software version 2.6.	BAO_0000357	single protein format	None	CHEMBL2147	Serine/threonine-protein kinase PIM1	Homo sapiens	SINGLE PROTEIN	CHEMBL3886885	BindingDB Database		2016.0	1.0	<rdkit.DataStructs.cDataStructs.ExplicitBitVect object at 0x0000022A724CA2D0>	G2	<rdkit.Chem.rdchem.Mol object at 0x0000022A7241CC80>	G1 active	G1
CHEMBL1910892		370.46	4.01	Oc1ccc(-c2ccc3c(-c4ccc(N5CCNCC5)cc4)c[nH]c3n2)cc1	IC50	'='	nM	30.0	CHEMBL1912525	Inhibition of PIM1 using BAD peptide as substrate preincubated for 15 mins measured after 60 to 100 mins by luminescence assay	BAO_0000357	single protein format	None	CHEMBL2147	Serine/threonine-protein kinase PIM1	Homo sapiens	SINGLE PROTEIN	CHEMBL1909629	Scientific Literature	Bioorg Med Chem Lett	2011.0	1.0	<rdkit.DataStructs.cDataStructs.ExplicitBitVect object at 0x0000022A724CA260>	G2	<rdkit.Chem.rdchem.Mol object at 0x0000022A7241CD60>	G1 active	G1
CHEMBL4580240		420.29	3.94	Cc1nc2sc3c(c2c(C)c1Br)NC(c1ccc(O)c(O)c1)NC3=O	IC50	'='	nM	60.0	CHEMBL4348704	Inhibition of human PIM1 by ELISA	BAO_0000357	single protein format	Homo sapiens	CHEMBL2147	Serine/threonine-protein kinase PIM1	Homo sapiens	SINGLE PROTEIN	CHEMBL4346696	Scientific Literature	Eur J Med Chem	2019.0	1.0	<rdkit.DataStructs.cDataStructs.ExplicitBitVect object at 0x0000022A724C9540>	G2	<rdkit.Chem.rdchem.Mol object at 0x0000022A7241CEB0>	G1 active	G1
CHEMBL575461		336.42	3.26	CN(C)Cc1nc2c(sc3ccc(-c4cccnc4)cc32)c(=O)[nH]1	Ki	'='	nM	2.0	CHEMBL1059319	Inhibition of human PIM1 by scintillation counting	BAO_0000357	single protein format	Homo sapiens	CHEMBL2147	Serine/threonine-protein kinase PIM1	Homo sapiens	SINGLE PROTEIN	CHEMBL1154637	Scientific Literature	J Med Chem	2009.0	1.0	<rdkit.DataStructs.cDataStructs.ExplicitBitVect object at 0x0000022A724CA730>	G2	<rdkit.Chem.rdchem.Mol object at 0x0000022A7241D150>	G1 active	G1
CHEMBL1782522		368.23	3.66	O=C(O)c1cc2cc(Br)cc(OCCC3CCNCC3)c2o1	IC50	'='	nM	51.0	CHEMBL1786237	Inhibition of human Pim1 using 5-FAM-RSRHSSYPAGT-CONH2 as substrate after 45 mins by off-chip mobility shift method	BAO_0000357	single protein format	Homo sapiens	CHEMBL2147	Serine/threonine-protein kinase PIM1	Homo sapiens	SINGLE PROTEIN	CHEMBL1781944	Scientific Literature	Bioorg Med Chem Lett	2011.0	1.0	<rdkit.DataStructs.cDataStructs.ExplicitBitVect object at 0x0000022A724CA8F0>	G2	<rdkit.Chem.rdchem.Mol object at 0x0000022A7241FC30>	G1 active	G1
CHEMBL3913664		393.42	4.2	CNC(=O)c1ccc(F)c(-c2c[nH]c3ccc(-c4nnc(NC(C)C)o4)cc23)c1	IC50	'='	nM	69.6	CHEMBL3888377	Enzyme Assay: The assay for the determination of Pim activity is based on the formation of phosphorylated biotinylated-BAD peptide at the Serine 112 residue (S112) and employs HTRF® (homogeneous time resolved fluorescence) technology to detect the product in a 96-well plate format. The phosphorylation of biotinylated-BAD (S112) peptide by full length recombinant Pim-1, Pim-2, or Pim-3 protein was detected with streptavidin:Allophycocyanin (APC) conjugate and a europium (Eu) labeled antibody directed against phosphorylated-BAD (S112). Excitation of Eu by a high energy laser light (337 nm) leads to a transfer of energy to the APC molecule, and results in an emission at 665 nm. The fluorescence is directly proportional to the amount of phosphorylated BAD peptide present in the reaction.Compounds were prepared in DMSO by conducting 3-fold serial dilutions to give a 10-point dosing curve having a high dose of 1 uM. A reference compound was included on each assay plate in order to validate that plate; on	BAO_0000357	single protein format	None	CHEMBL2147	Serine/threonine-protein kinase PIM1	Homo sapiens	SINGLE PROTEIN	CHEMBL3886684	BindingDB Database		2016.0	1.0	<rdkit.DataStructs.cDataStructs.ExplicitBitVect object at 0x0000022A724C89E0>	G2	<rdkit.Chem.rdchem.Mol object at 0x0000022A7241D230>	G1 active	G1
CHEMBL2017323		377.86	5.63	Clc1ccccc1Nc1nc2c(-c3nnc[nH]3)cccc2c2sccc12	IC50	'='	nM	3.0	CHEMBL2020770	Inhibition of human recombinant Pim1 using RSRHSSYPAGT as substrate and 30 uM ATP by radiometric assay	BAO_0000357	single protein format	Homo sapiens	CHEMBL2147	Serine/threonine-protein kinase PIM1	Homo sapiens	SINGLE PROTEIN	CHEMBL2016532	Scientific Literature	Bioorg Med Chem Lett	2012.0	1.0	<rdkit.DataStructs.cDataStructs.ExplicitBitVect object at 0x0000022A724C9150>	G2	<rdkit.Chem.rdchem.Mol object at 0x0000022A7241D380>	G1 active	G1
CHEMBL3962494		393.48	3.02	CNc1nnc(-c2ccc3[nH]cc(-c4nccc(N5CCOCC5)n4)c3c2)s1	IC50	'='	nM	38.01	CHEMBL3888377	Enzyme Assay: The assay for the determination of Pim activity is based on the formation of phosphorylated biotinylated-BAD peptide at the Serine 112 residue (S112) and employs HTRF® (homogeneous time resolved fluorescence) technology to detect the product in a 96-well plate format. The phosphorylation of biotinylated-BAD (S112) peptide by full length recombinant Pim-1, Pim-2, or Pim-3 protein was detected with streptavidin:Allophycocyanin (APC) conjugate and a europium (Eu) labeled antibody directed against phosphorylated-BAD (S112). Excitation of Eu by a high energy laser light (337 nm) leads to a transfer of energy to the APC molecule, and results in an emission at 665 nm. The fluorescence is directly proportional to the amount of phosphorylated BAD peptide present in the reaction.Compounds were prepared in DMSO by conducting 3-fold serial dilutions to give a 10-point dosing curve having a high dose of 1 uM. A reference compound was included on each assay plate in order to validate that plate; on	BAO_0000357	single protein format	None	CHEMBL2147	Serine/threonine-protein kinase PIM1	Homo sapiens	SINGLE PROTEIN	CHEMBL3886684	BindingDB Database		2016.0	1.0	<rdkit.DataStructs.cDataStructs.ExplicitBitVect object at 0x0000022A724C8580>	G2	<rdkit.Chem.rdchem.Mol object at 0x0000022A7241D690>	G1 active	G1
CHEMBL494354		338.41	2.92	N[C@H]1CC[C@H](Nc2cncc(-c3cccc(/C=C/C(=O)O)c3)n2)CC1	IC50	'='	nM	13.0	CHEMBL960122	Inhibition of Pim1 in presence of 1 uM ATP	BAO_0000357	single protein format	None	CHEMBL2147	Serine/threonine-protein kinase PIM1	Homo sapiens	SINGLE PROTEIN	CHEMBL1153342	Scientific Literature	J Med Chem	2009.0	1.0	<rdkit.DataStructs.cDataStructs.ExplicitBitVect object at 0x0000022A724C84A0>	G2	<rdkit.Chem.rdchem.Mol object at 0x0000022A7241C4A0>	G1 active	G1
CHEMBL3685745		464.5	4.84	N[C@H]1C[C@@H](CF)CN(c2ccncc2Nc2cccc3cnc(-c4c(F)cccc4F)nc23)C1	IC50	'='	nM	53.0	CHEMBL3705205	ATP Depletion Assay: The activity of PIM1 is measured using a luciferase-luciferin based ATP detection reagent to quantify ATP depletion resulting from kinase-catalyzed phosphoryl transfer to a peptide substrate. Compounds to be tested are dissolved in 100% DMSO and directly distributed into white 384-well plates at 0.5 uA per well. To start the reaction, 10 ul of 5 nM Pim1 kinase and 80 uM BAD peptide (RSRHSSYPAGT-OH) in assay buffer (50 mM HEPES pH 7.5, 5 mM MgCl2, 1 mM DTT, 0.05% BSA) is added into each well. After 15 minutes, 10 ul of 40 uM ATP in assay buffer is added. Final assay concentrations are 2.5 nM PIM1, 20 uM ATP, 40 uM BAD peptide and 2.5% DMSO. The reaction is performed until approximately 50% of the ATP is depleted, then stopped with the addition of 20 ul KinaseGlo Plus (Promega Corporation) solution. The stopped reaction is incubated for 10 minutes and the remaining ATP detected via luminescence on the Victor2 (Perkin Elmer).	BAO_0000357	single protein format	None	CHEMBL2147	Serine/threonine-protein kinase PIM1	Homo sapiens	SINGLE PROTEIN	CHEMBL3638844	BindingDB Database		2014.0	1.0	<rdkit.DataStructs.cDataStructs.ExplicitBitVect object at 0x0000022A724C9AF0>	G2	<rdkit.Chem.rdchem.Mol object at 0x0000022A7241D8C0>	G1 active	G1
CHEMBL2035602		312.76	3.77	Cc1cc(-c2cc(-c3ccccc3Cl)[nH]c(=O)n2)ccc1O	IC50	'='	nM	75.0	CHEMBL2038186	Inhibition of PIM1	BAO_0000357	single protein format	None	CHEMBL2147	Serine/threonine-protein kinase PIM1	Homo sapiens	SINGLE PROTEIN	CHEMBL2034948	Scientific Literature	Bioorg Med Chem Lett	2012.0	1.0	<rdkit.DataStructs.cDataStructs.ExplicitBitVect object at 0x0000022A724C9FC0>	G2	<rdkit.Chem.rdchem.Mol object at 0x0000022A7241FCA0>	G1 active	G1
CHEMBL3684938		610.97	6.03	Cc1nccn1CC1CCCN(c2nc3c(Br)c(Br)c(Br)c(Br)c3[nH]2)C1	IC50	'='	nM	61.36	CHEMBL3705636	Luminometric Kinase Assay: Kinase assay was performed using luminescent Kinase-Glo (Promega) system. The Kinase-Glo Luminescent Kinase Assay Platform provides a homogeneous, high-throughput screening method for measuring kinase activity by quantifying the amount of ATP remaining in solution following a kinase reaction.	BAO_0000357	single protein format	None	CHEMBL2147	Serine/threonine-protein kinase PIM1	Homo sapiens	SINGLE PROTEIN	CHEMBL3638987	BindingDB Database		2013.0	1.0	<rdkit.DataStructs.cDataStructs.ExplicitBitVect object at 0x0000022A724CADC0>	G2	<rdkit.Chem.rdchem.Mol object at 0x0000022A7241E3B0>	G1 active	G1
CHEMBL4090634		440.48	4.49	Nc1ccc(-c2c[nH]c3cc(-c4cncc(OC[C@@H](N)c5ccccc5)n4)ccc23)c(F)n1	IC50	'='	nM	2.0	CHEMBL4044916	Inhibition of human recombinant PIM1 in presence of ATP by ELISA based spectrophotometric analysis	BAO_0000357	single protein format	Homo sapiens	CHEMBL2147	Serine/threonine-protein kinase PIM1	Homo sapiens	SINGLE PROTEIN	CHEMBL4043135	Scientific Literature	Bioorg Med Chem	2017.0	1.0	<rdkit.DataStructs.cDataStructs.ExplicitBitVect object at 0x0000022A724C9380>	G2	<rdkit.Chem.rdchem.Mol object at 0x0000022A7241F6F0>	G1 active	G1
CHEMBL5089915		445.51	2.84	CN(C)c1cnc2ccc(-c3nc(Nc4ccc(N5CCNCC5)cn4)ncc3F)cc2n1	IC50	'='	nM	94.0	CHEMBL5041380	Inhibition of PIM1 (unknown origin) using 5FAM-ARKRRRHPSGPPTA peptide substrate incubated for 2 hrs by by electrophoretic mobility change analysis	BAO_0000357	single protein format	Homo sapiens	CHEMBL2147	Serine/threonine-protein kinase PIM1	Homo sapiens	SINGLE PROTEIN	CHEMBL5038637	Scientific Literature	J Med Chem	2022.0	1.0	<rdkit.DataStructs.cDataStructs.ExplicitBitVect object at 0x0000022A724C9770>	G2	<rdkit.Chem.rdchem.Mol object at 0x0000022A7241E8F0>	G1 active	G1
CHEMBL3684952		545.9	4.52	CCn1c(N2CCNCC2)nc2c(Br)c(Br)c(Br)c(Br)c21	IC50	'='	nM	6.55	CHEMBL3705636	Luminometric Kinase Assay: Kinase assay was performed using luminescent Kinase-Glo (Promega) system. The Kinase-Glo Luminescent Kinase Assay Platform provides a homogeneous, high-throughput screening method for measuring kinase activity by quantifying the amount of ATP remaining in solution following a kinase reaction.	BAO_0000357	single protein format	None	CHEMBL2147	Serine/threonine-protein kinase PIM1	Homo sapiens	SINGLE PROTEIN	CHEMBL3638987	BindingDB Database		2013.0	1.0	<rdkit.DataStructs.cDataStructs.ExplicitBitVect object at 0x0000022A724CAB20>	G2	<rdkit.Chem.rdchem.Mol object at 0x0000022A7241EB90>	G1 active	G1
