Compound_ID	Molecule Name	Molecular Weight	AlogP	Smiles	Standard Type	Standard Relation	Standard Units	Standard Value	Assay ChEMBL ID	Assay Description	BAO Format ID	BAO Label	Assay Organism	Target ChEMBL ID	Target Name	Target Organism	Target Type	Document ChEMBL ID	Source Description	Document Journal	Document Year	Active	bits	Group	ROMol	Set	Set_type
CHEMBL3596873		507.57	5.27	CC(C)(C)c1cc(NC(=O)Nc2cccc(Oc3cncc(-c4ccc(S(C)(=O)=O)cc4)n3)c2)no1	IC50	'='	nM	92.0	CHEMBL3598604	Inhibition of human recombinant TrkA using ATP and 5FAM tagged TrkA peptide substrate incubated for 60 mins by microfluidics assay	BAO_0000357	single protein format	Homo sapiens	CHEMBL2815	Nerve growth factor receptor Trk-A	Homo sapiens	SINGLE PROTEIN	CHEMBL3596123	Scientific Literature	Medchemcomm	2014.0	1.0	<rdkit.DataStructs.cDataStructs.ExplicitBitVect object at 0x0000022A724A5000>	G1	<rdkit.Chem.rdchem.Mol object at 0x0000022A724244A0>	G2 active	Train
CHEMBL1230609	FORETINIB	632.66	5.77	COc1cc2c(Oc3ccc(NC(=O)C4(C(=O)Nc5ccc(F)cc5)CC4)cc3F)ccnc2cc1OCCCN1CCOCC1	Kd	'='	nM	4.8	CHEMBL1908505	Binding constant for TRKA kinase domain	BAO_0000357	single protein format	None	CHEMBL2815	Nerve growth factor receptor Trk-A	Homo sapiens	SINGLE PROTEIN	CHEMBL1908390	Scientific Literature	Nat Biotechnol	2011.0	1.0	<rdkit.DataStructs.cDataStructs.ExplicitBitVect object at 0x0000022A724A4D60>	G1	<rdkit.Chem.rdchem.Mol object at 0x0000022A724242E0>	G2 active	Train
CHEMBL2158230		488.64	4.0	N#Cc1cnc(C(=O)Nc2ccc(C3CCN(CCN4CCOCC4)CC3)cc2C2=CCCCC2)[nH]1	IC50	'='	nM	19.0	CHEMBL2161435	Inhibition of TRKA	BAO_0000357	single protein format	None	CHEMBL2815	Nerve growth factor receptor Trk-A	Homo sapiens	SINGLE PROTEIN	CHEMBL2157860	Scientific Literature	J Med Chem	2011.0	1.0	<rdkit.DataStructs.cDataStructs.ExplicitBitVect object at 0x0000022A724A4970>	G1	<rdkit.Chem.rdchem.Mol object at 0x0000022A724240B0>	G2 active	Train
CHEMBL3962940		482.42	4.38	O=C(Nc1cc(C(=O)c2cn(C3COC3)c3ccncc23)ccn1)c1cccc(OC(F)(F)F)c1	IC50	'='	nM	33.0	CHEMBL3887111	HTRF Assay: Isolated TRK Enzyme assays use the HTRF KinEASE-TK kit (Cisbio Cat#62TK0PEJ) with recombinant His-tagged cytoplasmic domains of each TRK receptor sourced from Invitrogen (see table below). This activity-assay measures the phosphorylation of tyrosine residues within a substrate from the HTRF kit which has been validated by Cisbio for a variety of tyrosine kinases including the TRK receptors.Assay Details: Invitrogen Amino FAC FAC Assay ReactionTarget Cat# acids enzyme ATP TimeTRKA PV3144 aa 441-4 nM 40 uM 35 min (NTRK1) 796 TRKB PV3616 aa 526-1 nM 1.4 uM 40 min (NTRK2) 838 TRKC PV3617 aa 510- 10 nM 15 uM 30 min (NTRK3) 8250.5 mM stock solutions of test compounds are prepared and serially diluted in 100% DMSO. A standard curve using the compound of Example 135 disclosed in WO2005/116035 of 150 uM is also prepared on each test plate. High percentage effect (HPE) is defined by 150 uM.	BAO_0000357	single protein format	None	CHEMBL2815	Nerve growth factor receptor Trk-A	Homo sapiens	SINGLE PROTEIN	CHEMBL3886170	BindingDB Database		2015.0	1.0	<rdkit.DataStructs.cDataStructs.ExplicitBitVect object at 0x0000022A724A4890>	G1	<rdkit.Chem.rdchem.Mol object at 0x0000022A72427610>	G2 active	Train
CHEMBL3982504		620.62	6.68	Cc1ccccc1-n1nc(C(F)(F)F)cc1NC(=O)Nc1cnc(Oc2ccc(-c3cnc(N4CCCC4=O)s3)cc2)nc1	IC50	'='	nM	50.0	CHEMBL3887906	LanthaScreen Kinase Assay: TrkA-inhibiting activity was measured according to the following method using LanthaScreen kinase assay reagents (Invitrogen; Fluorescein-Poly GT, LanthaScreen Tb-PY20 and TR-FRET Dilution Buffer), TrkA (Invitrogen), ATP (Sigma-Aldrich), a kinase reaction buffer (50 mM HEPES buffer (Sigma-Aldrich) (pH 7.5) containing 0.01% Brij35 (Sigma-Aldrich), 10 mM MgCl2 (Sigma-Aldrich) and 1 mM EGTA (Sigma-Aldrich)) and 0.5 M EDTA (pH 8.0) (Invitrogen).The present compound was dissolved in dimethylsulfoxide (hereinafter abbreviated as DMSO) to prepare a 10 mM solution. The test compound at 10 mM was distributed into a 96-well plate and serially diluted with DMSO with the geometrical ratio of 3. The serial dilutions (DMSO solutions) were diluted with the kinase reaction buffer to 20-fold to prepare solutions of the present compound with 5-times concentrations (DMSO concentration: 5%). TrkA was diluted with the kinase reaction buffer to prepare a solution at 38.5 ng/mL (enzyme solution). Adenosine	BAO_0000357	single protein format	None	CHEMBL2815	Nerve growth factor receptor Trk-A	Homo sapiens	SINGLE PROTEIN	CHEMBL3886498	BindingDB Database		2016.0	1.0	<rdkit.DataStructs.cDataStructs.ExplicitBitVect object at 0x0000022A724A42E0>	G1	<rdkit.Chem.rdchem.Mol object at 0x0000022A72427840>	G2 active	Train
CHEMBL3912980		470.57	4.74	CC(C)n1cc(C(=O)c2cncc(NC(=O)Cc3cccc(CC(C)(C)O)c3)c2)c2cnccc21	IC50	'='	nM	39.2	CHEMBL3887111	HTRF Assay: Isolated TRK Enzyme assays use the HTRF KinEASE-TK kit (Cisbio Cat#62TK0PEJ) with recombinant His-tagged cytoplasmic domains of each TRK receptor sourced from Invitrogen (see table below). This activity-assay measures the phosphorylation of tyrosine residues within a substrate from the HTRF kit which has been validated by Cisbio for a variety of tyrosine kinases including the TRK receptors.Assay Details: Invitrogen Amino FAC FAC Assay ReactionTarget Cat# acids enzyme ATP TimeTRKA PV3144 aa 441-4 nM 40 uM 35 min (NTRK1) 796 TRKB PV3616 aa 526-1 nM 1.4 uM 40 min (NTRK2) 838 TRKC PV3617 aa 510- 10 nM 15 uM 30 min (NTRK3) 8250.5 mM stock solutions of test compounds are prepared and serially diluted in 100% DMSO. A standard curve using the compound of Example 135 disclosed in WO2005/116035 of 150 uM is also prepared on each test plate. High percentage effect (HPE) is defined by 150 uM.	BAO_0000357	single protein format	None	CHEMBL2815	Nerve growth factor receptor Trk-A	Homo sapiens	SINGLE PROTEIN	CHEMBL3886170	BindingDB Database		2015.0	1.0	<rdkit.DataStructs.cDataStructs.ExplicitBitVect object at 0x0000022A724A5620>	G1	<rdkit.Chem.rdchem.Mol object at 0x0000022A72427F40>	G2 active	Train
CHEMBL365585		455.51	4.09	CC1(C)O[C@@H](n2c3ccccc3c3c4c(c5c6ccccc6[nH]c5c32)CNC4=O)C[C@]1(O)CO	IC50	'='	nM	4.0	CHEMBL832085	Inhibition of baculovirus expressed human trkA	BAO_0000357	single protein format	Homo sapiens	CHEMBL2815	Nerve growth factor receptor Trk-A	Homo sapiens	SINGLE PROTEIN	CHEMBL1139527	Scientific Literature	J Med Chem	2005.0	1.0	<rdkit.DataStructs.cDataStructs.ExplicitBitVect object at 0x0000022A724A59A0>	G1	<rdkit.Chem.rdchem.Mol object at 0x0000022A72427ED0>	G2 active	Train
CHEMBL430406		474.41	5.15	Cc1ccc(Sc2cnc(Nc3cccc(Br)n3)s2)cc1C(=O)NCCC#N	IC50	'='	nM	67.0	CHEMBL928869	Inhibition of TrkA	BAO_0000357	single protein format	None	CHEMBL2815	Nerve growth factor receptor Trk-A	Homo sapiens	SINGLE PROTEIN	CHEMBL1140800	Scientific Literature	Bioorg Med Chem Lett	2008.0	1.0	<rdkit.DataStructs.cDataStructs.ExplicitBitVect object at 0x0000022A724A6960>	G1	<rdkit.Chem.rdchem.Mol object at 0x0000022A72427760>	G2 active	Train
CHEMBL4793897		459.55	4.4	O=C(Nc1ccc(N2CCOCC2)cc1N1CCOCC1)c1cccc(Oc2ccccc2)c1	IC50	'='	nM	94.0	CHEMBL4716036	Inhibition of human TRKA at inactive state assessed as inhibition of substrate phosphorylation using fluorescently-labelled peptide as substrate by caliper assay	BAO_0000357	single protein format	Homo sapiens	CHEMBL2815	Nerve growth factor receptor Trk-A	Homo sapiens	SINGLE PROTEIN	CHEMBL4715685	Scientific Literature	RSC Med Chem	2020.0	1.0	<rdkit.DataStructs.cDataStructs.ExplicitBitVect object at 0x0000022A724A5C40>	G1	<rdkit.Chem.rdchem.Mol object at 0x0000022A72427B50>	G2 active	Train
CHEMBL4852786		641.12	3.98	CN1CCN(C(=O)c2cc(NC(=O)[C@@H]3CCCN3c3nc(Nc4cc(F)cc(F)c4)ncc3Cl)ccc2N2CCOCC2)CC1	IC50	'='	nM	9.2	CHEMBL4811213	Inhibition of human TRKA assessed as decreased enzymatic reactions measured after 1 hr by mobility shift assay	BAO_0000357	single protein format	Homo sapiens	CHEMBL2815	Nerve growth factor receptor Trk-A	Homo sapiens	SINGLE PROTEIN	CHEMBL4808257	Scientific Literature	Bioorg Med Chem	2021.0	1.0	<rdkit.DataStructs.cDataStructs.ExplicitBitVect object at 0x0000022A724A5CB0>	G1	<rdkit.Chem.rdchem.Mol object at 0x0000022A72427DF0>	G2 active	Train
CHEMBL2152283		415.5	3.59	Nc1cc(OCCN2CCOCC2)cc(-c2cnc3[nH]cc(-c4ccncc4)c3c2)c1	IC50	'='	nM	8.36	CHEMBL2157053	Inhibition of TRKA assessed as [gamma33P]ATP incorporation into substrate	BAO_0000357	single protein format	None	CHEMBL2815	Nerve growth factor receptor Trk-A	Homo sapiens	SINGLE PROTEIN	CHEMBL2150859	Scientific Literature	J Med Chem	2012.0	1.0	<rdkit.DataStructs.cDataStructs.ExplicitBitVect object at 0x0000022A724A7680>	G1	<rdkit.Chem.rdchem.Mol object at 0x0000022A72427D10>	G2 active	Train
CHEMBL2037224		503.48	6.91	O=C(Nc1cccc(Nc2ccc3c(c2)NC(=O)/C3=C\c2ccc[nH]2)c1)Nc1cccc(C(F)(F)F)c1	IC50	'='	nM	7.0	CHEMBL2038860	Inhibition of TRKA by HTRF assay	BAO_0000357	single protein format	None	CHEMBL2815	Nerve growth factor receptor Trk-A	Homo sapiens	SINGLE PROTEIN	CHEMBL2034853	Scientific Literature	ACS Med Chem Lett	2012.0	1.0	<rdkit.DataStructs.cDataStructs.ExplicitBitVect object at 0x0000022A724A7760>	G1	<rdkit.Chem.rdchem.Mol object at 0x0000022A72427C30>	G2 active	Train
CHEMBL4778234		344.39	4.88	Fc1ccc(CNc2ccc3[nH]nc(/C=C/c4ccccn4)c3c2)cc1	IC50	'='	nM	49.3	CHEMBL4772612	Inhibition of TrkA (unknown origin) using Tyr1 peptide as substrate in presence of ATP measured after 2 hrs by FRET-based Z-Lyte kinase assay	BAO_0000357	single protein format	Homo sapiens	CHEMBL2815	Nerve growth factor receptor Trk-A	Homo sapiens	SINGLE PROTEIN	CHEMBL4765391	Scientific Literature	Eur J Med Chem	2020.0	1.0	<rdkit.DataStructs.cDataStructs.ExplicitBitVect object at 0x0000022A724A5070>	G1	<rdkit.Chem.rdchem.Mol object at 0x0000022A72427E60>	G2 active	Train
CHEMBL3676079		410.45	2.25	CC1(NC(=O)c2cnn3ccc(N4[C@H](CO)CC[C@@H]4c4cncc(F)c4)nc23)CC1	IC50	'='	nM	8.6	CHEMBL3887070	ELISA Assay: An enzyme-linked immunosorbant assay (ELISA) was used to assess TrkA kinase activity in the presence of inhibitors. Immulon 4HBX 384-well microtiter plates (Thermo part #8755) were coated with a 0.025 mg/mL solution of poly (Glu, Ala, Tyr; 6:3:1; Sigma P3899). Various concentrations of test compound, 2.5 nM TrkA (Invitrogen Corp., histidine-tagged recombinant human TrkA, cytoplasmic domain), and 500 uM ATP were incubated for 25 minutes at ambient temperature in the coated plates while shaking The assay buffer consisted of 25 mM MOPS pH 7.5, 0.005% (v/v) Triton X-100 and 5 mM MgCl2. The reaction mixture was removed from the plate by washing with PBS containing 0.1% (v/v) Tween 20. The phosphorylated reaction product was detected using 0.2 ug/mL of a phosphotyrosine specific monoclonal antibody (clone PY20) conjugated to horseradish peroxidase in conjunction with the TMB Peroxidase Substrate System (KPL).	BAO_0000357	single protein format	None	CHEMBL2815	Nerve growth factor receptor Trk-A	Homo sapiens	SINGLE PROTEIN	CHEMBL3638907	BindingDB Database		2014.0	1.0	<rdkit.DataStructs.cDataStructs.ExplicitBitVect object at 0x0000022A724A4E40>	G1	<rdkit.Chem.rdchem.Mol object at 0x0000022A72427D80>	G2 active	Train
CHEMBL3671312		546.58	3.93	CC(Cc1cc(F)ccc1F)Nc1cc[nH]c(=O)c1-c1nc2cc3c(cc2[nH]1)C(=O)N(C1CCN(C)CC1)C3=O	IC50	'='	nM	6.353	CHEMBL3887072	In Vitro Kinase Activity Assay: Compounds to be tested were dissolved in 100% DMSO in a range of concentrations from 10-8 to 10-3 M including negative control (DMSO), then diluted with Kinase Buffer (50 mM HEPES, pH 7.5, 1 mM EGTA, 10 mM MgCl2, 0.01% Tween-20, and 2 mM DTT, added fresh) to 4x the final concentration. The final curve included 11 concentrations (10-11 to 10-5 M) plus negative control DMSO tested in triplicate.Kinase and ATP concentrations necessary for optimal activity were determined in separate experiments. (Table 2). Briefly, increasing concentrations of kinase were incubated in a fixed concentration of ATP (200 uM) in Kinase Buffer to determine maximal activity at various time points (30-120 min). The concentration of kinase that resulted in maximal activity with the shortest incubation time was then incubated in Kinase Buffer with increasing concentrations of ATP.	BAO_0000357	single protein format	None	CHEMBL2815	Nerve growth factor receptor Trk-A	Homo sapiens	SINGLE PROTEIN	CHEMBL3639188	BindingDB Database		2014.0	1.0	<rdkit.DataStructs.cDataStructs.ExplicitBitVect object at 0x0000022A724A4660>	G1	<rdkit.Chem.rdchem.Mol object at 0x0000022A723AA6C0>	G2 active	Train
CHEMBL4113123		414.42	2.38	CN(C)C(=O)C(=O)Nc1cnn2ccc(N3CCC[C@@H]3c3cc(F)ccc3F)nc12	IC50	'='	nM	47.45	CHEMBL3887076	ELISA Assay: An enzyme-linked immunosorbant assay (ELISA) was used to assess TrkA kinase activity in the presence of inhibitors. Immulon 4HBX 384-well microtiter plates (Thermo part #8755) were coated with a 0.025 mg/mL solution of poly (Glu, Ala, Tyr; 6:3:1; Sigma P3899). Various concentrations of test compound, 2.5 nM TrkA (Invitrogen Corp., histidine-tagged recombinant human TrkA, cytoplasmic domain), and 500 uM ATP were incubated for 25 minutes at ambient temperature in the coated plates while shaking. The assay buffer consisted of 25 mM MOPS pH 7.5, 0.005% (v/v) Triton X-100 and 5 mM MgCl2. The reaction mixture was removed from the plate by washing with PBS containing 0.1% (v/v) Tween 20. The phosphorylated reaction product was detected using 0.2 ug/mL of a phosphotyrosine specific monoclonal antibody (clone PY20) conjugated to horseradish peroxidase in conjunction with the TMB Peroxidase Substrate System (KPL).	BAO_0000357	single protein format	None	CHEMBL2815	Nerve growth factor receptor Trk-A	Homo sapiens	SINGLE PROTEIN	CHEMBL3886151	BindingDB Database		2014.0	1.0	<rdkit.DataStructs.cDataStructs.ExplicitBitVect object at 0x0000022A724A4510>	G1	<rdkit.Chem.rdchem.Mol object at 0x0000022A723ABCA0>	G2 active	Train
CHEMBL212317		404.95	4.76	CC(Cc1ccc(Cl)cc1)Sc1nsc(Nc2cccnc2)c1C(N)=O	IC50	'='	nM	29.0	CHEMBL867240	Inhibition of TrkA kinase	BAO_0000357	single protein format	Homo sapiens	CHEMBL2815	Nerve growth factor receptor Trk-A	Homo sapiens	SINGLE PROTEIN	CHEMBL1138090	Scientific Literature	Bioorg Med Chem Lett	2006.0	1.0	<rdkit.DataStructs.cDataStructs.ExplicitBitVect object at 0x0000022A724A44A0>	G1	<rdkit.Chem.rdchem.Mol object at 0x0000022A723ABDF0>	G2 active	Train
CHEMBL3673478		508.5	5.07	COc1cc(Cn2c(N)nc3cc(-c4cnn(C)c4)cnc32)ccc1OCc1ccc(C(F)(F)F)cc1	IC50	'='	nM	0.2	CHEMBL3887112	Inhibition Assay: Reagents and consumables were purchased from Sigma Aldrich, Carna Biosciences, or Caliper Life Sciences. All assay reaction conditions for IC50 determinations were within the linear range with respect to time and enzyme concentration. In a 384 well polypropylene plate, TrkA (0.4 nM, Carna 08-186) was pre-incubated in a 100 mM Hepes-NaOH pH 7.5 buffer containing 0.01% Triton X-100, 10 mM MgCl2, 0.1% BSA, 1 mM DTT, 10 uM sodium orthovanadate and 10 uM beta-glycerophosphate and compound with a concentration of 2.5% DMSO for 15 minutes at room temperature. The reaction was initiated with an equal volume of peptide substrate (Caliper Life Sciences catalog no. 760430) and ATP in the aforementioned buffer. The final concentrations in the reaction were 200 pM TrkA, 1.5 uM peptide substrate and 55 uM ATP (ATP Km). The reaction was incubated at room temperature for 180 minutes and terminated with a buffer containing excess EDTA (100 mM Hepes-NaOH pH 7.5, 0.02% Brij.	BAO_0000357	single protein format	None	CHEMBL2815	Nerve growth factor receptor Trk-A	Homo sapiens	SINGLE PROTEIN	CHEMBL3638818	BindingDB Database		2015.0	1.0	<rdkit.DataStructs.cDataStructs.ExplicitBitVect object at 0x0000022A724A4190>	G1	<rdkit.Chem.rdchem.Mol object at 0x0000022A74D0F4C0>	G2 active	Train
CHEMBL5094232		526.6	5.46	CC1(C)Oc2c(ncnc2Nc2ccc(NC(=O)Nc3cc(C(C)(C)C)nn3-c3ccccc3)cc2)NC1=O	IC50	'='	nM	35.0	CHEMBL5045112	Inhibition of wild type TrkA (unknown origin) using poly(Glu: Tyr) as substrate preincubated for 15 mins followed by substrate addition and further incubated for 30 mins in presence of [gamma-33P]ATP by scintillation counting method	BAO_0000357	single protein format	Homo sapiens	CHEMBL2815	Nerve growth factor receptor Trk-A	Homo sapiens	SINGLE PROTEIN	CHEMBL5042533	Scientific Literature	J Med Chem	2022.0	1.0	<rdkit.DataStructs.cDataStructs.ExplicitBitVect object at 0x0000022A724A63B0>	G1	<rdkit.Chem.rdchem.Mol object at 0x0000022A74D0F530>	G2 active	Train
CHEMBL5089164		432.45	3.77	Cn1ccc2cc(Nc3ncc(C(F)(F)F)c(N[C@H]4CC[C@@H](N)CC4)n3)ccc2c1=O	IC50	'='	nM	22.56	CHEMBL5045759	Inhibition of human recombinant TRKA incubated for 1 hrs by HTRF KinEASE TK assay	BAO_0000357	single protein format	Homo sapiens	CHEMBL2815	Nerve growth factor receptor Trk-A	Homo sapiens	SINGLE PROTEIN	CHEMBL5042545	Scientific Literature	J Med Chem	2022.0	1.0	<rdkit.DataStructs.cDataStructs.ExplicitBitVect object at 0x0000022A724A6D50>	G1	<rdkit.Chem.rdchem.Mol object at 0x0000022A74D0F5A0>	G2 active	Train
CHEMBL5078405		416.41	4.09	C[C@@H](Nc1ccn2ncc(-c3cnn(C)c3)c2n1)c1cc(F)ccc1OCC(F)F	IC50	'='	nM	0.5	CHEMBL5035648	Inhibition of wildtype TRKA (unknown origin) preincubated for 30 mins followed by biotinylated TK-peptide substrate addition and measured after 40 mins by FRET-based Z-lyte kinase assay	BAO_0000357	single protein format	Homo sapiens	CHEMBL2815	Nerve growth factor receptor Trk-A	Homo sapiens	SINGLE PROTEIN	CHEMBL5034031	Scientific Literature	J Med Chem	2021.0	1.0	<rdkit.DataStructs.cDataStructs.ExplicitBitVect object at 0x0000022A724A6650>	G1	<rdkit.Chem.rdchem.Mol object at 0x0000022A74D0F610>	G2 active	Train
CHEMBL3666257		444.5	2.93	CC(C)n1cc(C(=O)c2cncc(NC(=O)Cn3ccc(C4CC4)n3)c2)c2cnc(N)nc21	IC50	'='	nM	3.92	CHEMBL3887033	Enzyme Assay: Isolated TRK Enzyme assays use the HTRF KinEASE-TK kit (Cisbio Cat# 62TK0PEJ) with recombinant His-tagged cytoplasmic domains of each TRK receptor sourced from Invitrogen (see table below). This activity-assay measures the phosphorylation of tyrosine residues within a substrate from the HTRF kit which has been validated by Cisbio for a variety of tyrosine kinases including the TRK receptors. Assay details: Target:TRKA; Invitrogen Cat# PV3144; Amino acids:aa 441-796; FAC enzyme:4nM; FAC ATP:40uM; Assay Reaction Time:35min.	BAO_0000357	single protein format	None	CHEMBL2815	Nerve growth factor receptor Trk-A	Homo sapiens	SINGLE PROTEIN	CHEMBL3639348	BindingDB Database		2014.0	1.0	<rdkit.DataStructs.cDataStructs.ExplicitBitVect object at 0x0000022A724A62D0>	G2	<rdkit.Chem.rdchem.Mol object at 0x0000022A74D0F6F0>	G2 active	Train
CHEMBL3671396		415.45	3.31	CC(C)n1cc(C(=O)c2cncc(NC(=O)C(O)c3ccccc3)c2)c2cncnc21	IC50	'='	nM	7.3	CHEMBL3887033	Enzyme Assay: Isolated TRK Enzyme assays use the HTRF KinEASE-TK kit (Cisbio Cat# 62TK0PEJ) with recombinant His-tagged cytoplasmic domains of each TRK receptor sourced from Invitrogen (see table below). This activity-assay measures the phosphorylation of tyrosine residues within a substrate from the HTRF kit which has been validated by Cisbio for a variety of tyrosine kinases including the TRK receptors. Assay details: Target:TRKA; Invitrogen Cat# PV3144; Amino acids:aa 441-796; FAC enzyme:4nM; FAC ATP:40uM; Assay Reaction Time:35min.	BAO_0000357	single protein format	None	CHEMBL2815	Nerve growth factor receptor Trk-A	Homo sapiens	SINGLE PROTEIN	CHEMBL3639348	BindingDB Database		2014.0	1.0	<rdkit.DataStructs.cDataStructs.ExplicitBitVect object at 0x0000022A724A61F0>	G2	<rdkit.Chem.rdchem.Mol object at 0x0000022A74D0F680>	G2 active	Train
CHEMBL2152270		300.37	4.33	CNc1cccc(-c2cnc3[nH]cc(-c4ccncc4)c3c2)c1	IC50	'='	nM	31.4	CHEMBL2157053	Inhibition of TRKA assessed as [gamma33P]ATP incorporation into substrate	BAO_0000357	single protein format	None	CHEMBL2815	Nerve growth factor receptor Trk-A	Homo sapiens	SINGLE PROTEIN	CHEMBL2150859	Scientific Literature	J Med Chem	2012.0	1.0	<rdkit.DataStructs.cDataStructs.ExplicitBitVect object at 0x0000022A724A6F80>	G2	<rdkit.Chem.rdchem.Mol object at 0x0000022A74D0F760>	G2 active	Train
CHEMBL3671447		497.43	3.95	CC1(n2cc(C(=O)c3cncc(NC(=O)c4cccc(OC(F)(F)F)c4)c3)c3cncnc32)COC1	IC50	'='	nM	3.09	CHEMBL3887033	Enzyme Assay: Isolated TRK Enzyme assays use the HTRF KinEASE-TK kit (Cisbio Cat# 62TK0PEJ) with recombinant His-tagged cytoplasmic domains of each TRK receptor sourced from Invitrogen (see table below). This activity-assay measures the phosphorylation of tyrosine residues within a substrate from the HTRF kit which has been validated by Cisbio for a variety of tyrosine kinases including the TRK receptors. Assay details: Target:TRKA; Invitrogen Cat# PV3144; Amino acids:aa 441-796; FAC enzyme:4nM; FAC ATP:40uM; Assay Reaction Time:35min.	BAO_0000357	single protein format	None	CHEMBL2815	Nerve growth factor receptor Trk-A	Homo sapiens	SINGLE PROTEIN	CHEMBL3639348	BindingDB Database		2014.0	1.0	<rdkit.DataStructs.cDataStructs.ExplicitBitVect object at 0x0000022A724A6340>	G2	<rdkit.Chem.rdchem.Mol object at 0x0000022A74D0F840>	G2 active	Train
CHEMBL3671405		508.38	3.73	CC(C)(C)n1cc(C(=O)c2cncc(NC(=O)Cc3ccc(Br)cn3)c2)c2cnc(N)nc21	IC50	'='	nM	3.93	CHEMBL3887033	Enzyme Assay: Isolated TRK Enzyme assays use the HTRF KinEASE-TK kit (Cisbio Cat# 62TK0PEJ) with recombinant His-tagged cytoplasmic domains of each TRK receptor sourced from Invitrogen (see table below). This activity-assay measures the phosphorylation of tyrosine residues within a substrate from the HTRF kit which has been validated by Cisbio for a variety of tyrosine kinases including the TRK receptors. Assay details: Target:TRKA; Invitrogen Cat# PV3144; Amino acids:aa 441-796; FAC enzyme:4nM; FAC ATP:40uM; Assay Reaction Time:35min.	BAO_0000357	single protein format	None	CHEMBL2815	Nerve growth factor receptor Trk-A	Homo sapiens	SINGLE PROTEIN	CHEMBL3639348	BindingDB Database		2014.0	1.0	<rdkit.DataStructs.cDataStructs.ExplicitBitVect object at 0x0000022A724A65E0>	G2	<rdkit.Chem.rdchem.Mol object at 0x0000022A74D0F8B0>	G2 active	Train
CHEMBL3671153		437.45	3.04	O=C(NCCc1cnc[nH]1)c1cnn2ccc(N3CCC[C@@H]3c3cc(F)ccc3F)nc12	IC50	'='	nM	0.4	CHEMBL3887070	ELISA Assay: An enzyme-linked immunosorbant assay (ELISA) was used to assess TrkA kinase activity in the presence of inhibitors. Immulon 4HBX 384-well microtiter plates (Thermo part #8755) were coated with a 0.025 mg/mL solution of poly (Glu, Ala, Tyr; 6:3:1; Sigma P3899). Various concentrations of test compound, 2.5 nM TrkA (Invitrogen Corp., histidine-tagged recombinant human TrkA, cytoplasmic domain), and 500 uM ATP were incubated for 25 minutes at ambient temperature in the coated plates while shaking The assay buffer consisted of 25 mM MOPS pH 7.5, 0.005% (v/v) Triton X-100 and 5 mM MgCl2. The reaction mixture was removed from the plate by washing with PBS containing 0.1% (v/v) Tween 20. The phosphorylated reaction product was detected using 0.2 ug/mL of a phosphotyrosine specific monoclonal antibody (clone PY20) conjugated to horseradish peroxidase in conjunction with the TMB Peroxidase Substrate System (KPL).	BAO_0000357	single protein format	None	CHEMBL2815	Nerve growth factor receptor Trk-A	Homo sapiens	SINGLE PROTEIN	CHEMBL3638907	BindingDB Database		2014.0	1.0	<rdkit.DataStructs.cDataStructs.ExplicitBitVect object at 0x0000022A724A5310>	G2	<rdkit.Chem.rdchem.Mol object at 0x0000022A74D0F990>	G2 active	Train
CHEMBL3661547		466.55	4.92	Cc1ccc2[nH]c(C)c(CC(=O)Nc3cncc(C(=O)c4cn(C(C)C)c5ncncc45)c3)c2c1	IC50	'='	nM	71.5	CHEMBL3887033	Enzyme Assay: Isolated TRK Enzyme assays use the HTRF KinEASE-TK kit (Cisbio Cat# 62TK0PEJ) with recombinant His-tagged cytoplasmic domains of each TRK receptor sourced from Invitrogen (see table below). This activity-assay measures the phosphorylation of tyrosine residues within a substrate from the HTRF kit which has been validated by Cisbio for a variety of tyrosine kinases including the TRK receptors. Assay details: Target:TRKA; Invitrogen Cat# PV3144; Amino acids:aa 441-796; FAC enzyme:4nM; FAC ATP:40uM; Assay Reaction Time:35min.	BAO_0000357	single protein format	None	CHEMBL2815	Nerve growth factor receptor Trk-A	Homo sapiens	SINGLE PROTEIN	CHEMBL3639348	BindingDB Database		2014.0	1.0	<rdkit.DataStructs.cDataStructs.ExplicitBitVect object at 0x0000022A724A5380>	G2	<rdkit.Chem.rdchem.Mol object at 0x0000022A74D0FA00>	G2 active	Train
CHEMBL3905235		433.54	4.5	Cc1nc(CC(=O)Nc2cc(C(=O)c3cn(C(C)C)c4ccncc34)ccn2)c(C)s1	IC50	'='	nM	56.0	CHEMBL3887111	HTRF Assay: Isolated TRK Enzyme assays use the HTRF KinEASE-TK kit (Cisbio Cat#62TK0PEJ) with recombinant His-tagged cytoplasmic domains of each TRK receptor sourced from Invitrogen (see table below). This activity-assay measures the phosphorylation of tyrosine residues within a substrate from the HTRF kit which has been validated by Cisbio for a variety of tyrosine kinases including the TRK receptors.Assay Details: Invitrogen Amino FAC FAC Assay ReactionTarget Cat# acids enzyme ATP TimeTRKA PV3144 aa 441-4 nM 40 uM 35 min (NTRK1) 796 TRKB PV3616 aa 526-1 nM 1.4 uM 40 min (NTRK2) 838 TRKC PV3617 aa 510- 10 nM 15 uM 30 min (NTRK3) 8250.5 mM stock solutions of test compounds are prepared and serially diluted in 100% DMSO. A standard curve using the compound of Example 135 disclosed in WO2005/116035 of 150 uM is also prepared on each test plate. High percentage effect (HPE) is defined by 150 uM.	BAO_0000357	single protein format	None	CHEMBL2815	Nerve growth factor receptor Trk-A	Homo sapiens	SINGLE PROTEIN	CHEMBL3886170	BindingDB Database		2015.0	1.0	<rdkit.DataStructs.cDataStructs.ExplicitBitVect object at 0x0000022A724A54D0>	G2	<rdkit.Chem.rdchem.Mol object at 0x0000022A74D0FA70>	G2 active	Train
