Compound_ID	Molecule Name	Molecular Weight	AlogP	Smiles	Standard Type	Standard Relation	Standard Units	Standard Value	Assay ChEMBL ID	Assay Description	BAO Format ID	BAO Label	Assay Organism	Target ChEMBL ID	Target Name	Target Organism	Target Type	Document ChEMBL ID	Source Description	Document Journal	Document Year	Active	bits	Group	ROMol	Set	Set_type
CHEMBL3657549		441.9	3.18	Cc1cn(-c2nc(Nc3ccc4c(c3)c(Cl)nn4C)ncc2F)cc1CN1CC(O)C1	IC50	'='	nM	1.5	CHEMBL3705866	Kinase Inhibition Assay: Compounds of the invention were initially diluted to 10 mM in 100% DMSO (CALBIOCHEM) for storage and made into kinase buffer solution to create a compound concentration ranging from 1 uM and 10 uM. Serial dilutions of compounds of the invention were dispensed into a 96-well plate (GREINER BIOSCIENCES) at 6 uL each. Purified full-length human SYK, and KDR (CARNA BIOSCIENCES) were diluted in kinase buffer and added to the compound solutions and pre-incubated for 30 minutes at room temperature. Next, ATP (TEKNOVA) of Km (15 uM) and substrate solution (suggested manufacture substrates of PerkinElmer, for example, Ulight-TK peptide for SYK and Ulight-JAK1 for KDR (PERKINELMER)) was added (12 uL each) to the wells containing the compound solution and enzyme. The reaction mixture was incubated for 1 hour. Following the incubation, the stop solution made with EDTA, water, and Lance detection buffer (PERKINELMER) was added (12 uL each) to stop phosphorylation.	BAO_0000357	single protein format	Homo sapiens	CHEMBL2599	Tyrosine-protein kinase SYK	Homo sapiens	SINGLE PROTEIN	CHEMBL3638941	BindingDB Database		2014.0	1.0	<rdkit.DataStructs.cDataStructs.ExplicitBitVect object at 0x00000176BBEAEFF0>	G2	<rdkit.Chem.rdchem.Mol object at 0x00000176BBEC57E0>	G1 active	G1
CHEMBL3415583		354.46	2.62	Cc1cc(C)nc(Nc2cc(N[C@@H]3CCCC[C@@H]3N)cnc2C(N)=O)c1	IC50	'='	nM	58.0	CHEMBL3420414	Inhibition of Syk in anti-IgE-activated human basophils assessed as CysLT release in whole blood preincubated with IL-3 primed blood for 30 mins	BAO_0000357	single protein format	Homo sapiens	CHEMBL2599	Tyrosine-protein kinase SYK	Homo sapiens	SINGLE PROTEIN	CHEMBL3414497	Scientific Literature	J Med Chem	2015.0	1.0	<rdkit.DataStructs.cDataStructs.ExplicitBitVect object at 0x00000176BBEAEF10>	G2	<rdkit.Chem.rdchem.Mol object at 0x00000176BBEC52A0>	G1 active	G1
CHEMBL3645119		425.49	1.19	COCC(=O)N1CCN(c2ccc(Nc3ncc(C(N)=O)c(NC4CC4)n3)cc2)CC1	Kd	'='	nM	98.0	CHEMBL3707841	Ambit KinomeScan Assay: This assay is an ATP-site dependent competition binding assay in which human kinases of interest are fused to a proprietary tag (T7 bacteriophage). The amount of kinase bound to an immobilized, active-site directed ligand is measured in the presence and absence of the test compound. Ambit's JAK assays use kinase domains and not full-length proteins. The domain used for JAK1 binding is the pseudo kinase domain while that for JAK3 binding is the catalytic domain (Mazen W Karaman, Sanna Herrgard, Daniel K Treiber, et. al. A Quantitative analysis of kinase inhibitor selectivity. Nature Biotechnology, 2008, Volume 26, No. 1, Page 127-132).	BAO_0000357	single protein format	Homo sapiens	CHEMBL2599	Tyrosine-protein kinase SYK	Homo sapiens	SINGLE PROTEIN	CHEMBL3638708	BindingDB Database		2015.0	1.0	<rdkit.DataStructs.cDataStructs.ExplicitBitVect object at 0x00000176BBEAEF80>	G2	<rdkit.Chem.rdchem.Mol object at 0x00000176BBEC6180>	G1 active	G1
CHEMBL3622941		504.64	3.50	Cc1cn(-c2ccnc(Nc3cc(C)c(OCC(=O)N4CCCC4)c(C)c3)n2)cc1CN1CC[C@@H](O)C1	IC50	'='	nM	14.4	CHEMBL3627015	Inhibition of purified full-length human SYK pre-incubated for 30 mins at room temperature before Ulight-TK peptide substrate addition and measured 1 hr after substrate addition by cell free kinase assay	BAO_0000357	single protein format	Homo sapiens	CHEMBL2599	Tyrosine-protein kinase SYK	Homo sapiens	SINGLE PROTEIN	CHEMBL3621069	Scientific Literature	Bioorg Med Chem Lett	2015.0	1.0	<rdkit.DataStructs.cDataStructs.ExplicitBitVect object at 0x00000176BBEAEDC0>	G2	<rdkit.Chem.rdchem.Mol object at 0x00000176BBEC62D0>	G1 active	G1
CHEMBL3409422		458.55	4.29	Cc1cc(N)c2cc(Nc3nc(Nc4ccc(N5CCN(C)CC5)cc4)ncc3F)ccc2n1	IC50	'='	nM	13.0	CHEMBL3411021	Inhibition of SYK (unknown origin)	BAO_0000357	single protein format	Homo sapiens	CHEMBL2599	Tyrosine-protein kinase SYK	Homo sapiens	SINGLE PROTEIN	CHEMBL3407453	Scientific Literature	Eur J Med Chem	2015.0	1.0	<rdkit.DataStructs.cDataStructs.ExplicitBitVect object at 0x00000176BBEAECE0>	G2	<rdkit.Chem.rdchem.Mol object at 0x00000176BBEC5D90>	G1 active	G1
CHEMBL3934804		456.48	2.78	CNC(=O)COC1=C(C)CCC(Nc2ncc(F)c(Nc3cccc(C(=O)NOC)c3)n2)=C1	IC50	'='	nM	66.5	CHEMBL3889292	Biochemical Assay: Several 2,4-pyrimidinediamine compounds were tested for the ability to inhibit Syk kinase catalyzed phosphorylation of a peptide substrate in a biochemical fluorescenced polarization assay with isolated Syk kinase. In this experiment, Compounds were diluted to 1% DMSO in kinase buffer (20 mM HEPES, pH 7.4, 5 mM MgCl2, 2 mM MnCl2, 1 mM DTT, 0.1 mg/mL acetylated Bovine Gamma Globulin). Compound in 1% DMSO (0.2% DMSO final) was mixed with ATP/substrate solution at room temperature. Syk kinase (Upstate, Lake Placid N.Y.) was added to a final reaction volume of 20 uL, and the reaction was incubated for 30 minutes at room temperature. Final enzyme reaction conditions were 20 mM HEPES, pH 7.4, 5 mM MgCl2, 2 mM MnCl2, 1 mM DTT, 0.1 mg/mL acetylated Bovine Gamma Globulin, 0.125 ng Syk, 4 uM ATP, 2.5 uM peptide substrate (biotin-EQEDEPEGDYEEVLE-CONH2, SynPep Corporation). EDTA (10 mM final)/anti-phosphotyrosine antibody (1x final)/fluorescent phosphopeptide tracer (0.5x final) was added in FP Dilution Buffer to stop the reaction for a total volume of 40 uL according to manufacturer's instructions (PanVera Corporation) The plate was incubated for 30 minutes in the dark at room temperature. Plates were read on a Polarion fluorescence polarization plate reader (Tecan). Data were converted to amount of phosphopeptide present using a calibration curve generated by competition with the phosphopeptide competitor provided in the Tyrosine Kinase Assay Kit, Green (PanVera Corporation).	BAO_0000357	single protein format	Homo sapiens	CHEMBL2599	Tyrosine-protein kinase SYK	Homo sapiens	SINGLE PROTEIN	CHEMBL3887020	BindingDB Database		2016.0	1.0	<rdkit.DataStructs.cDataStructs.ExplicitBitVect object at 0x00000176BBEAF300>	G2	<rdkit.Chem.rdchem.Mol object at 0x00000176BBEC66C0>	G1 active	G1
CHEMBL3915286		699.79	7.80	COc1cc(Nc2cc(Oc3ccc(NC(=O)Nc4cc(C(C)(C)C)cc(NS(C)(=O)=O)c4OC)c4ccccc34)ccn2)ccc1C(=O)O	IC50	'='	nM	5.0	CHEMBL3889290	Enzyme Inhibition Assay: The inhibitory activities of the compound of the invention against c-Src and Syk enzymes (Invitrogen), are evaluated in a similar fashion to that described hereinabove. The relevant enzyme (3000 ng/mL or 2000 ng/mL respectively, 2.5 μL) is incubated with the test compound (either 1 μg/mL, 0.1 μg/mL, 0.01 μg/mL, or 0.001 μg/mL, 2.5 μL each) for 2 hr at RT. The FRET peptides (8 μM, 2.5 μL), and appropriate ATP solutions (2.5 μL, 800 μM for c-Src, and 60 μM ATP for Syk) are then added to the enzymes/compound mixtures and the mixture incubated for 1 hr. Development reagent (protease, 5 μL) is added for 1 hr prior to detection in a fluorescence microplate reader (Varioskan® Flash, ThermoFisher Scientific).	BAO_0000357	single protein format	Homo sapiens	CHEMBL2599	Tyrosine-protein kinase SYK	Homo sapiens	SINGLE PROTEIN	CHEMBL3887019	BindingDB Database		2016.0	1.0	<rdkit.DataStructs.cDataStructs.ExplicitBitVect object at 0x00000176BBEAF920>	G2	<rdkit.Chem.rdchem.Mol object at 0x00000176BBEC6DC0>	G1 active	G1
CHEMBL2347997		364.41	2.83	COc1ccc2cnn(-c3cnc4[nH]cc(C(=O)NC(C)(C)C)c4n3)c2c1	IC50	'='	nM	33.0	CHEMBL2350855	Inhibition of human recombinant truncated SYK (360 to 365 amino acid residues) using N-terminally biotinylated EPEGDYEEVLE peptide as substrate assessed as inhibition of [33P]-ATP incorporation incubated for 10 mins prior to substrate addition measured after 15 mins by scintillation counting	BAO_0000357	single protein format	Homo sapiens	CHEMBL2599	Tyrosine-protein kinase SYK	Homo sapiens	SINGLE PROTEIN	CHEMBL2346624	Scientific Literature	J Med Chem	2013.0	1.0	<rdkit.DataStructs.cDataStructs.ExplicitBitVect object at 0x00000176BBEAD770>	G2	<rdkit.Chem.rdchem.Mol object at 0x00000176BBEC6F80>	G1 active	G1
CHEMBL3912785		444.46	4.76	COCC1CN(c2cc(Nc3nccc(C(F)(F)F)n3)cc(-c3ccccc3)c2)CCO1	IC50	'='	nM	58.1	CHEMBL3888530	Homogeneous Time-Resolved Fluorescence (HTRF) Assay: A recombinant GST-hSYK fusion protein was used to measure potency of compounds to inhibit human Syk activity. The recombinant human GST-SYK (Carna Biosciences #08-176) (5 μM final concentration) was incubated with various concentrations of the inhibitor diluted in DMSO (0.1% final concentration) for 10 minutes at room temperature in 15 mM Tris-HCl (pH 7.5), 0.01% tween 20, 2 mM DTT in 384 well plate format. To initiate the reaction the biotinylated substrate peptide (250 nM final concentration) that contains the phosphorylation site for Syk was added with magnesium (5 mM final concentration) and ATP (25 μM final concentration). Final volume of the reaction was 10 μL. Phosphorylation of the peptide was allowed to proceed for 45' at room temperature. To quench the reaction and detect the phosphorylated product, 2 nM of a Europium-anti-phosphotyrosine antibody (Perkin Elmer #AD0161) and 70 nM SA-APC (Perkin-Elmer #CR130-100) were added together in 15 mM Tris pH 7.5, 40 mM EDTA, 0.01% tween 20. Final volume of the quenching solution was 10 μL. The resulting HTRF signal was measured after 30 minutes on an EnVision (Perkin-Elmer) reader using a time-resolved fluorescence protocol.	BAO_0000357	single protein format	Homo sapiens	CHEMBL2599	Tyrosine-protein kinase SYK	Homo sapiens	SINGLE PROTEIN	CHEMBL3886750	BindingDB Database		2016.0	1.0	<rdkit.DataStructs.cDataStructs.ExplicitBitVect object at 0x00000176BBEAD930>	G2	<rdkit.Chem.rdchem.Mol object at 0x00000176BBE522D0>	G1 active	G1
CHEMBL3415610		382.42	1.26	COc1cccc2[nH]c(-c3nc(N[C@@H]4CCOC[C@@H]4N)cnc3C(N)=O)cc12	IC50	'='	nM	0.7	CHEMBL3420413	Inhibition of full-length GST-tagged human Syk preincubated for 10 mins followed by peptide substrate/ATP addition measured after 45 mins by TR-FRET assay	BAO_0000357	single protein format	Homo sapiens	CHEMBL2599	Tyrosine-protein kinase SYK	Homo sapiens	SINGLE PROTEIN	CHEMBL3414497	Scientific Literature	J Med Chem	2015.0	1.0	<rdkit.DataStructs.cDataStructs.ExplicitBitVect object at 0x00000176BBEAE2D0>	G2	<rdkit.Chem.rdchem.Mol object at 0x00000176BBE52260>	G1 active	G1
CHEMBL3641500		409.45	4.08	NC(=O)c1ccccc1-c1ccnc(-c2ccnc(Nc3ccc4c(c3)COC4)n2)c1	IC50	'='	nM	15.0	CHEMBL3705803	Kinase Glo Luminescence Kinase Assay: Recombinant human Syk (amino acids 342-635) was expressed as a fusion protein with an N-terminal GST tag, affinity-purified and deep-frozen at a concentration of approx. 50-100 uM in test buffer (25 mM HEPES pH7.5; 25 mM MgCl2; 5 mM MnCl2; 50 mM KCl; 0.2% BSA; 0.01% CHAPS; 100 uM Na3VO4; 0.5 mM DTT) and 10% glycerol at -80 C until use. The catalytic activity of the GST-Syk kinase fusion protein was determined using the Kinase Glo Luminescence Kinase test (Promega; V6712). In this homogeneous test the amount of ATP remaining after the kinase reaction is quantified by a luciferin-luciferase reaction using luminescence. The luminescence signal obtained correlates with the amount of ATP still present and thus correlates inversely with the activity of the protein kinase. The test compounds were dissolved in 100% DMSO at a concentration of 10 mM and diluted in DMSO to a concentration of 1 mM.	BAO_0000357	single protein format	Homo sapiens	CHEMBL2599	Tyrosine-protein kinase SYK	Homo sapiens	SINGLE PROTEIN	CHEMBL3638486	BindingDB Database		2014.0	1.0	<rdkit.DataStructs.cDataStructs.ExplicitBitVect object at 0x00000176BBEAE260>	G2	<rdkit.Chem.rdchem.Mol object at 0x00000176BBE52180>	G1 active	G1
CHEMBL3698400		539.62	4.80	COC(=O)c1ccc2c(c1)CCC[C@]2(O)c1ncc(-c2cc(C)cc(Nc3cc(-c4c[nH]nn4)ccn3)n2)s1	IC50	'='	nM	1.62	CHEMBL3706005	Homogeneous Time-Resolved Fluorescence Assay: A recombinant GST-hSyk fusion protein was used to measure potency of compounds to inhibit human Syk activity. The recombinant human GST-Syk (Cama Biosciences #08-176) (5 pM final concentration) was incubated with various concentrations of the inhibitor diluted in DMSO (0.1% final concentration) for 10 minutes at rt in 15 mM Tris-HCl (pH 7.5), 0.01% tween 20, 2 mM DTT in 384 well plate format. To initiate the reaction the biotinylated substrate peptide (250 nM final concentration) that contains the phosphorylation site for Syk was added with magnesium (5 mM final concentration) and ATP (25 uM final concentration). Final volume of the reaction was 10 uL. Phosphorylation of the peptide was allowed to proceed for 45' at rt. To quench the reaction and detect the phosphorylated product, 2 nM of a Europium-anti-phosphotyrosine antibody (Perkin Elmer #AD0161) and 70 nM SA-APC (Perkin-Elmer #CR130-100) were added together in 15 mM Tris pH 7.5, 40 mM EDTA, 0.01% tween 20.	BAO_0000357	single protein format	Homo sapiens	CHEMBL2599	Tyrosine-protein kinase SYK	Homo sapiens	SINGLE PROTEIN	CHEMBL3639224	BindingDB Database		2014.0	1.0	<rdkit.DataStructs.cDataStructs.ExplicitBitVect object at 0x00000176BBF320A0>	G2	<rdkit.Chem.rdchem.Mol object at 0x00000176BBE51E00>	G1 active	G1
CHEMBL1835064		340.43	2.31	Cc1cccc(Nc2nc(N[C@H]3CCCC[C@H]3N)ncc2C(N)=O)c1	IC50	'='	nM	79.43	CHEMBL1838853	Inhibition of human full-length recombinant 6His-SYK assessed as phosphorylation of Biotin-AAAEEIYGEI substrate after 60 mins by by TR-FRET assay	BAO_0000357	single protein format	Homo sapiens	CHEMBL2599	Tyrosine-protein kinase SYK	Homo sapiens	SINGLE PROTEIN	CHEMBL1833860	Scientific Literature	Bioorg Med Chem Lett	2011.0	1.0	<rdkit.DataStructs.cDataStructs.ExplicitBitVect object at 0x00000176BBF32AB0>	G2	<rdkit.Chem.rdchem.Mol object at 0x00000176BBE51D90>	G1 active	G1
CHEMBL3696018		380.4	2.55	COc1ccc(-c2cc3ncccc3c(NCC3CC(=O)NO3)n2)cc1OC	IC50	'='	nM	38.6	CHEMBL3705989	Kinase Glo Luminescence Kinase Assay: Recombinant human Syk (amino acids 342-635) was expressed as a fusion protein with an N-terminal GST tag, affinity-purified and deep-frozen at a concentration of approx. 50 - 100 uM in test buffer (25 mM HEPES pH7.5; 25 mM MgCI2;5 mM MnCI2; 50 mM KCI; 0.2% BSA; 0.01 % CHAPS; 100 uM Na3V04; 0.5 mM DTT) and 10% glycerol at -80 C until use.The catalytic activity of the GST-Syk kinase fusion protein was determined using the Kinase Glo Luminescence Kinase test (Promega; V6712). In this homogeneous test the amount of ATP remaining after the kinase reaction is quantified by a luciferin-luciferase reaction using luminescence. The luminescence signal obtained correlates with the amount of ATP still present and thus correlates inversely with the activity of the protein kinase. Method:The test compounds were dissolved in 100 % DMSO at a concentration of 10 mM and diluted in DMSO to a concentration of 1 mM.	BAO_0000357	single protein format	Homo sapiens	CHEMBL2599	Tyrosine-protein kinase SYK	Homo sapiens	SINGLE PROTEIN	CHEMBL3639308	BindingDB Database		2015.0	1.0	<rdkit.DataStructs.cDataStructs.ExplicitBitVect object at 0x00000176BBF32B20>	G2	<rdkit.Chem.rdchem.Mol object at 0x00000176BBE51B60>	G1 active	G1
CHEMBL3964579		357.44	2.08	CC[C@H](N)CNc1nnc(C(N)=O)c(Nc2cccc3sccc23)n1	IC50	'='	nM	0.35	CHEMBL3887308	Syk Kinase Inhibition Assay: The in vitro inhibitory activity of the compound of the present invention against Syk kinase activity was assayed under the following conditions: the purified human Syk protein used in the test were purchased from Carna Biosciences, Inc. For the inhibitory activity assay on the compound, the compound of the present invention was first serially diluted with dimethyl sulfoxide (DMSO). Next, the purified human Syk protein FL-Peptide 22 (final concentration: 1 uM) (Caliper Life Sciences, Inc.), magnesium chloride (final concentration: 5 mM), ATP (final concentration: 30 uM), and each DMSO solution of the compound of the present invention (final concentration of DMSO: 5%) were added into a buffer solution for reaction (20 mM tris-HCl pH 7.5, 20 mM NaCl, 2.5 mM DTT, 0.02% Tween-20, 1% glycerol, 0.01 mM Pefabloc), and the mixture was then incubated at 25° C. for 30 minutes to perform kinase reaction. The kinase reaction was stopped by the addition thereto of EDTA.	BAO_0000357	single protein format	Homo sapiens	CHEMBL2599	Tyrosine-protein kinase SYK	Homo sapiens	SINGLE PROTEIN	CHEMBL3886160	BindingDB Database		2015.0	1.0	<rdkit.DataStructs.cDataStructs.ExplicitBitVect object at 0x00000176BBF32C70>	G2	<rdkit.Chem.rdchem.Mol object at 0x00000176BBE51AF0>	G1 active	G1
CHEMBL3695981		439.47	2.46	COc1cc(-c2cc3c(ccc[n+]3[O-])c(O[C@H](C)[C@H]3CNC(=O)C3)n2)cc(OC)c1OC	IC50	'='	nM	4.3	CHEMBL3705989	Kinase Glo Luminescence Kinase Assay: Recombinant human Syk (amino acids 342-635) was expressed as a fusion protein with an N-terminal GST tag, affinity-purified and deep-frozen at a concentration of approx. 50 - 100 uM in test buffer (25 mM HEPES pH7.5; 25 mM MgCI2;5 mM MnCI2; 50 mM KCI; 0.2% BSA; 0.01 % CHAPS; 100 uM Na3V04; 0.5 mM DTT) and 10% glycerol at -80 C until use.The catalytic activity of the GST-Syk kinase fusion protein was determined using the Kinase Glo Luminescence Kinase test (Promega; V6712). In this homogeneous test the amount of ATP remaining after the kinase reaction is quantified by a luciferin-luciferase reaction using luminescence. The luminescence signal obtained correlates with the amount of ATP still present and thus correlates inversely with the activity of the protein kinase. Method:The test compounds were dissolved in 100 % DMSO at a concentration of 10 mM and diluted in DMSO to a concentration of 1 mM.	BAO_0000357	single protein format	Homo sapiens	CHEMBL2599	Tyrosine-protein kinase SYK	Homo sapiens	SINGLE PROTEIN	CHEMBL3639308	BindingDB Database		2015.0	1.0	<rdkit.DataStructs.cDataStructs.ExplicitBitVect object at 0x00000176BBF32CE0>	G2	<rdkit.Chem.rdchem.Mol object at 0x00000176BBE51A80>	G1 active	G1
CHEMBL3653758		383.45	4.35	C[C@@H](Oc1cc(-c2ccc3ncccc3c2)cc2ncccc12)[C@H]1CNC(=O)C1	IC50	'='	nM	0.3	CHEMBL3706124	Kinase Assay: Recombinant human Syk (amino acids 342-635) was expressed as a fusion protein with an N-terminal GST tag, affinity-purified and deep-frozen at a concentration of approx. 50-100 uM in test buffer (25 mM HEPES pH7.5; 25 mM MgCl2; 5 mM MnCl2; 50 mM KCl; either 0.2% BSA or 0.2% HSA; 0.01% CHAPS; 100 uM Na3VO4; 0.5 mM DTT) and 10% glycerol at -80 C. until use.The catalytic activity of the GST-Syk kinase fusion protein was determined using the Kinase Glo Luminescence Kinase test (Promega; V6712). In this homogeneous test the amount of ATP remaining after the kinase reaction is quantified by a luciferin-luciferase reaction using luminescence. The luminescence signal obtained correlates with the amount of ATP still present and thus correlates inversely with the activity of the protein kinase.MethodThe test compounds were dissolved in 100% DMSO at a concentration of 10 mM and diluted in DMSO to a concentration of 1 mM.	BAO_0000357	single protein format	Homo sapiens	CHEMBL2599	Tyrosine-protein kinase SYK	Homo sapiens	SINGLE PROTEIN	CHEMBL3638790	BindingDB Database		2014.0	1.0	<rdkit.DataStructs.cDataStructs.ExplicitBitVect object at 0x00000176BBF33220>	G2	<rdkit.Chem.rdchem.Mol object at 0x00000176BBE51700>	G1 active	G1
CHEMBL475780		440.51	1.97	COc1cc(Nc2nc(NC3CCCC[C@H]3N)n3nc(C)nc3c2C(N)=O)cc(OC)c1	IC50	'='	nM	11.2	CHEMBL1022010	Inhibition of recombinant Syk	BAO_0000357	single protein format	None	CHEMBL2599	Tyrosine-protein kinase SYK	Homo sapiens	SINGLE PROTEIN	CHEMBL1138583	Scientific Literature	Bioorg Med Chem Lett	2009.0	1.0	<rdkit.DataStructs.cDataStructs.ExplicitBitVect object at 0x00000176BBF33ED0>	G2	<rdkit.Chem.rdchem.Mol object at 0x00000176BBE513F0>	G1 active	G1
CHEMBL3664147		395.85	3.46	CN(C)C(=O)c1cc2cc(Nc3nccc(-c4cn(C)cn4)n3)cc(Cl)c2[nH]1	IC50	'='	nM	2.8	CHEMBL3706038	In Vitro Kinase Assay: Recombinant human Syk (amino acids 342-635) was expressed as a fusion protein with an N-terminal GST tag, affinity-purified and deep-frozen at a concentration of approx. 50-100 uM in test buffer (25 mM HEPES pH7.5; 25 mM MgCl2; 5 mM MnCl2; 50 mM KCl; 1% HSA; 0.01% CHAPS; 100 uM Na3VO4; 0.5 mM DTT) and 10% glycerol at -80 C. until use.The catalytic activity of the GST-Syk kinase fusion protein was determined using the Kinase Glo Luminescence Kinase test (Promega; V6712). In this homogeneous test the amount of ATP remaining after the kinase reaction is quantified by a luciferin-luciferase reaction using luminescence. The luminescence signal obtained correlates with the amount of ATP still present and thus correlates inversely with the activity of the protein kinase. Method:The test compounds were dissolved in 100% DMSO at a concentration of 10 mM and diluted in DMSO to a concentration of 1 mM. All further dilutions of the substances were carried out with 7.5% DMSO.	BAO_0000357	single protein format	Homo sapiens	CHEMBL2599	Tyrosine-protein kinase SYK	Homo sapiens	SINGLE PROTEIN	CHEMBL3638603	BindingDB Database		2015.0	1.0	<rdkit.DataStructs.cDataStructs.ExplicitBitVect object at 0x00000176BBF33CA0>	G2	<rdkit.Chem.rdchem.Mol object at 0x00000176BBE511C0>	G1 active	G1
CHEMBL3641563		405.48	4.21	COc1ccnc(-c2ccnc(Nc3ccc4sc(C(=O)N(C)C)cc4c3)n2)c1	IC50	'='	nM	15.4	CHEMBL3705803	Kinase Glo Luminescence Kinase Assay: Recombinant human Syk (amino acids 342-635) was expressed as a fusion protein with an N-terminal GST tag, affinity-purified and deep-frozen at a concentration of approx. 50-100 uM in test buffer (25 mM HEPES pH7.5; 25 mM MgCl2; 5 mM MnCl2; 50 mM KCl; 0.2% BSA; 0.01% CHAPS; 100 uM Na3VO4; 0.5 mM DTT) and 10% glycerol at -80 C until use. The catalytic activity of the GST-Syk kinase fusion protein was determined using the Kinase Glo Luminescence Kinase test (Promega; V6712). In this homogeneous test the amount of ATP remaining after the kinase reaction is quantified by a luciferin-luciferase reaction using luminescence. The luminescence signal obtained correlates with the amount of ATP still present and thus correlates inversely with the activity of the protein kinase. The test compounds were dissolved in 100% DMSO at a concentration of 10 mM and diluted in DMSO to a concentration of 1 mM.	BAO_0000357	single protein format	Homo sapiens	CHEMBL2599	Tyrosine-protein kinase SYK	Homo sapiens	SINGLE PROTEIN	CHEMBL3638486	BindingDB Database		2014.0	1.0	<rdkit.DataStructs.cDataStructs.ExplicitBitVect object at 0x00000176BBF33530>	G2	<rdkit.Chem.rdchem.Mol object at 0x00000176BBE51000>	G1 active	G1
CHEMBL3955380		561.43	6.39	Cc1cc(Nc2cc(C(F)F)ccn2)nc(-c2ccc(C(C)(O)[C@H]3CC[C@H](C(=O)O)CC3)nc2)c1Br	IC50	'='	nM	1.0	CHEMBL3887083	Homogeneous Time-Resolved Fluorescence (HTRF) Assay: A recombinant GST-hSyk fusion protein was used to measure potency of compounds to inhibit human Syk activity. The recombinant human GST-Syk (Carna Biosciences #08-176) (5 pM final concentration) was incubated with various concentrations of the inhibitor diluted in DMSO (0.1% final concentration) for 10 minutes at room temperature in 15 mM Tris-HCl (pH 7.5), 0.01% tween 20, 2 mM DTT in 384 well plate format. To initiate the reaction the biotinylated substrate peptide (250 nM final concentration) that contains the phosphorylation site for Syk was added with magnesium (5 mM final concentration) and ATP (25 uM final concentration). Final volume of the reaction was 10 uL. Phosphorylation of the peptide was allowed to proceed for 45x at room temperature. To quench the reaction and detect the phosphorylated product, 2 nM of a Europium-anti-phosphotyrosine antibody (Perkin Elmer #AD0161) and 70 nM SA-APC (Perkin-Elmer #CR130-100) were added together in 15 mM Tris pH 7.5.	BAO_0000357	single protein format	Homo sapiens	CHEMBL2599	Tyrosine-protein kinase SYK	Homo sapiens	SINGLE PROTEIN	CHEMBL3886158	BindingDB Database		2015.0	1.0	<rdkit.DataStructs.cDataStructs.ExplicitBitVect object at 0x00000176BBF33C30>	G2	<rdkit.Chem.rdchem.Mol object at 0x00000176BBE50EB0>	G1 active	G1
CHEMBL3989516	FOSTAMATINIB DISODIUM	732.52	3.09	COc1cc(Nc2ncc(F)c(Nc3ccc4c(n3)N(COP(=O)([O-])[O-])C(=O)C(C)(C)O4)n2)cc(OC)c1OC	IC50	'='	nM	17.0	CHEMBL2189057	Inhibition of human recombinant spleen tyrosine kinase (360 to 635 amino acid residues) after 10 mins by scintillation counting analysis	BAO_0000357	single protein format	Homo sapiens	CHEMBL2599	Tyrosine-protein kinase SYK	Homo sapiens	SINGLE PROTEIN	CHEMBL2176924	Scientific Literature	J Med Chem	2012.0	1.0	<rdkit.DataStructs.cDataStructs.ExplicitBitVect object at 0x00000176BBF333E0>	G2	<rdkit.Chem.rdchem.Mol object at 0x00000176BBE505F0>	G1 active	G1
CHEMBL475248		415.5	3.30	Cc1cc(C)cc(Nc2nc(N[C@H](CN)c3ccccc3)n3ccnc3c2C(N)=O)c1	IC50	'='	nM	21.0	CHEMBL1022010	Inhibition of recombinant Syk	BAO_0000357	single protein format	None	CHEMBL2599	Tyrosine-protein kinase SYK	Homo sapiens	SINGLE PROTEIN	CHEMBL1138583	Scientific Literature	Bioorg Med Chem Lett	2009.0	1.0	<rdkit.DataStructs.cDataStructs.ExplicitBitVect object at 0x00000176BBF33680>	G2	<rdkit.Chem.rdchem.Mol object at 0x00000176BBE506D0>	G1 active	G1
CHEMBL3237572		385.52	2.80	CC(C)C[C@H](CN)Nc1cc(Nc2cccc(C(C)(C)C)n2)c(C(N)=O)nn1	IC50	'='	nM	6.31	CHEMBL3240906	Inhibition of human SYK (360 to 635) using biotin-EPEGDYEEVLE as substrate preincubated for 10 mins followed by substrate/ATP/[33Pgamma]ATP addition measured after 15 mins by scintillation counting analysis	BAO_0000357	single protein format	Homo sapiens	CHEMBL2599	Tyrosine-protein kinase SYK	Homo sapiens	SINGLE PROTEIN	CHEMBL3232975	Scientific Literature	J Med Chem	2014.0	1.0	<rdkit.DataStructs.cDataStructs.ExplicitBitVect object at 0x00000176BBF33450>	G2	<rdkit.Chem.rdchem.Mol object at 0x00000176BBE507B0>	G1 active	G1
